Sheet: code
A1: contract_type_cd
A2: 1 | B2: Management position
A3: 2 | B3: Employee
A4: 3 | B4: Contract employee
A5: 4 | B5: Outsourcer
A6: 5 | B6: Part-time workers
A7: 6 | B7: Others

Sheet: calendar
A1: calendar_date | B1: calendar_type_cd | C1: open_time | D1: close_time | E1: calendar_comment
A2: 2024-09-01T00:00:00.000 | B2: =IF(WEEKDAY(RC[-1])=4,2,1) -> 1 | C2: =IF(RC[-1]=1,RC[-2]+(1/24*11),"") -> 2024-09-01T11:00:00.000 | D2: =IF(RC[-2]=1,RC[-3]+(1/24*23),"") -> 2024-09-01T23:00:00.000
A3: 2024-09-02T00:00:00.000 | B3: =IF(WEEKDAY(RC[-1])=4,2,1) -> 1 | C3: =IF(RC[-1]=1,RC[-2]+(1/24*11),"") -> 2024-09-02T11:00:00.000 | D3: =IF(RC[-2]=1,RC[-3]+(1/24*23),"") -> 2024-09-02T23:00:00.000
A4: 2024-09-03T00:00:00.000 | B4: =IF(WEEKDAY(RC[-1])=4,2,1) -> 1 | C4: =IF(RC[-1]=1,RC[-2]+(1/24*11),"") -> 2024-09-03T11:00:00.000 | D4: =IF(RC[-2]=1,RC[-3]+(1/24*23),"") -> 2024-09-03T23:00:00.000
A5: 2024-09-04T00:00:00.000 | B5: =IF(WEEKDAY(RC[-1])=4,2,1) -> 2 | C5: =IF(RC[-1]=1,RC[-2]+(1/24*11),"") ->  | D5: =IF(RC[-2]=1,RC[-3]+(1/24*23),"") -> 
A6: 2024-09-05T00:00:00.000 | B6: =IF(WEEKDAY(RC[-1])=4,2,1) -> 1 | C6: =IF(RC[-1]=1,RC[-2]+(1/24*11),"") -> 2024-09-05T11:00:00.000 | D6: =IF(RC[-2]=1,RC[-3]+(1/24*23),"") -> 2024-09-05T23:00:00.000
A7: 2024-09-06T00:00:00.000 | B7: =IF(WEEKDAY(RC[-1])=4,2,1) -> 1 | C7: =IF(RC[-1]=1,RC[-2]+(1/24*11),"") -> 2024-09-06T11:00:00.000 | D7: =IF(RC[-2]=1,RC[-3]+(1/24*23),"") -> 2024-09-06T23:00:00.000
A8: 2024-09-07T00:00:00.000 | B8: =IF(WEEKDAY(RC[-1])=4,2,1) -> 1 | C8: =IF(RC[-1]=1,RC[-2]+(1/24*11),"") -> 2024-09-07T11:00:00.000 | D8: =IF(RC[-2]=1,RC[-3]+(1/24*23),"") -> 2024-09-07T23:00:00.000
A9: 2024-09-08T00:00:00.000 | B9: =IF(WEEKDAY(RC[-1])=4,2,1) -> 1 | C9: =IF(RC[-1]=1,RC[-2]+(1/24*11),"") -> 2024-09-08T11:00:00.000 | D9: =IF(RC[-2]=1,RC[-3]+(1/24*23),"") -> 2024-09-08T23:00:00.000
A10: 2024-09-09T00:00:00.000 | B10: =IF(WEEKDAY(RC[-1])=4,2,1) -> 1 | C10: =IF(RC[-1]=1,RC[-2]+(1/24*11),"") -> 2024-09-09T11:00:00.000 | D10: =IF(RC[-2]=1,RC[-3]+(1/24*23),"") -> 2024-09-09T23:00:00.000
A11: 2024-09-10T00:00:00.000 | B11: =IF(WEEKDAY(RC[-1])=4,2,1) -> 1 | C11: =IF(RC[-1]=1,RC[-2]+(1/24*11),"") -> 2024-09-10T11:00:00.000 | D11: =IF(RC[-2]=1,RC[-3]+(1/24*23),"") -> 2024-09-10T23:00:00.000
A12: 2024-09-11T00:00:00.000 | B12: =IF(WEEKDAY(RC[-1])=4,2,1) -> 2 | C12: =IF(RC[-1]=1,RC[-2]+(1/24*11),"") ->  | D12: =IF(RC[-2]=1,RC[-3]+(1/24*23),"") -> 
A13: 2024-09-12T00:00:00.000 | B13: =IF(WEEKDAY(RC[-1])=4,2,1) -> 1 | C13: =IF(RC[-1]=1,RC[-2]+(1/24*11),"") -> 2024-09-12T11:00:00.000 | D13: =IF(RC[-2]=1,RC[-3]+(1/24*23),"") -> 2024-09-12T23:00:00.000
A14: 2024-09-13T00:00:00.000 | B14: =IF(WEEKDAY(RC[-1])=4,2,1) -> 1 | C14: =IF(RC[-1]=1,RC[-2]+(1/24*11),"") -> 2024-09-13T11:00:00.000 | D14: =IF(RC[-2]=1,RC[-3]+(1/24*23),"") -> 2024-09-13T23:00:00.000
A15: 2024-09-14T00:00:00.000 | B15: =IF(WEEKDAY(RC[-1])=4,2,1) -> 1 | C15: =IF(RC[-1]=1,RC[-2]+(1/24*11),"") -> 2024-09-14T11:00:00.000 | D15: =IF(RC[-2]=1,RC[-3]+(1/24*23),"") -> 2024-09-14T23:00:00.000
A16: 2024-09-15T00:00:00.000 | B16: =IF(WEEKDAY(RC[-1])=4,2,1) -> 1 | C16: =IF(RC[-1]=1,RC[-2]+(1/24*11),"") -> 2024-09-15T11:00:00.000 | D16: =IF(RC[-2]=1,RC[-3]+(1/24*23),"") -> 2024-09-15T23:00:00.000
A17: 2024-09-16T00:00:00.000 | B17: =IF(WEEKDAY(RC[-1])=4,2,1) -> 1 | C17: =IF(RC[-1]=1,RC[-2]+(1/24*11),"") -> 2024-09-16T11:00:00.000 | D17: =IF(RC[-2]=1,RC[-3]+(1/24*23),"") -> 2024-09-16T23:00:00.000
A18: 2024-09-17T00:00:00.000 | B18: =IF(WEEKDAY(RC[-1])=4,2,1) -> 1 | C18: =IF(RC[-1]=1,RC[-2]+(1/24*11),"") -> 2024-09-17T11:00:00.000 | D18: =IF(RC[-2]=1,RC[-3]+(1/24*23),"") -> 2024-09-17T23:00:00.000
A19: 2024-09-18T00:00:00.000 | B19: =IF(WEEKDAY(RC[-1])=4,2,1) -> 2 | C19: =IF(RC[-1]=1,RC[-2]+(1/24*11),"") ->  | D19: =IF(RC[-2]=1,RC[-3]+(1/24*23),"") -> 
A20: 2024-09-19T00:00:00.000 | B20: =IF(WEEKDAY(RC[-1])=4,2,1) -> 1 | C20: =IF(RC[-1]=1,RC[-2]+(1/24*11),"") -> 2024-09-19T11:00:00.000 | D20: =IF(RC[-2]=1,RC[-3]+(1/24*23),"") -> 2024-09-19T23:00:00.000
A21: 2024-09-20T00:00:00.000 | B21: =IF(WEEKDAY(RC[-1])=4,2,1) -> 1 | C21: =IF(RC[-1]=1,RC[-2]+(1/24*11),"") -> 2024-09-20T11:00:00.000 | D21: =IF(RC[-2]=1,RC[-3]+(1/24*23),"") -> 2024-09-20T23:00:00.000
A22: 2024-09-21T00:00:00.000 | B22: =IF(WEEKDAY(RC[-1])=4,2,1) -> 1 | C22: =IF(RC[-1]=1,RC[-2]+(1/24*11),"") -> 2024-09-21T11:00:00.000 | D22: =IF(RC[-2]=1,RC[-3]+(1/24*23),"") -> 2024-09-21T23:00:00.000
A23: 2024-09-22T00:00:00.000 | B23: =IF(WEEKDAY(RC[-1])=4,2,1) -> 1 | C23: =IF(RC[-1]=1,RC[-2]+(1/24*11),"") -> 2024-09-22T11:00:00.000 | D23: =IF(RC[-2]=1,RC[-3]+(1/24*23),"") -> 2024-09-22T23:00:00.000
A24: 2024-09-23T00:00:00.000 | B24: =IF(WEEKDAY(RC[-1])=4,2,1) -> 1 | C24: =IF(RC[-1]=1,RC[-2]+(1/24*11),"") -> 2024-09-23T11:00:00.000 | D24: =IF(RC[-2]=1,RC[-3]+(1/24*23),"") -> 2024-09-23T23:00:00.000
A25: 2024-09-24T00:00:00.000 | B25: =IF(WEEKDAY(RC[-1])=4,2,1) -> 1 | C25: =IF(RC[-1]=1,RC[-2]+(1/24*11),"") -> 2024-09-24T11:00:00.000 | D25: =IF(RC[-2]=1,RC[-3]+(1/24*23),"") -> 2024-09-24T23:00:00.000
A26: 2024-09-25T00:00:00.000 | B26: =IF(WEEKDAY(RC[-1])=4,2,1) -> 2 | C26: =IF(RC[-1]=1,RC[-2]+(1/24*11),"") ->  | D26: =IF(RC[-2]=1,RC[-3]+(1/24*23),"") -> 
A27: 2024-09-26T00:00:00.000 | B27: =IF(WEEKDAY(RC[-1])=4,2,1) -> 1 | C27: =IF(RC[-1]=1,RC[-2]+(1/24*11),"") -> 2024-09-26T11:00:00.000 | D27: =IF(RC[-2]=1,RC[-3]+(1/24*23),"") -> 2024-09-26T23:00:00.000
A28: 2024-09-27T00:00:00.000 | B28: =IF(WEEKDAY(RC[-1])=4,2,1) -> 1 | C28: =IF(RC[-1]=1,RC[-2]+(1/24*11),"") -> 2024-09-27T11:00:00.000 | D28: =IF(RC[-2]=1,RC[-3]+(1/24*23),"") -> 2024-09-27T23:00:00.000
A29: 2024-09-28T00:00:00.000 | B29: =IF(WEEKDAY(RC[-1])=4,2,1) -> 1 | C29: =IF(RC[-1]=1,RC[-2]+(1/24*11),"") -> 2024-09-28T11:00:00.000 | D29: =IF(RC[-2]=1,RC[-3]+(1/24*23),"") -> 2024-09-28T23:00:00.000
A30: 2024-09-29T00:00:00.000 | B30: =IF(WEEKDAY(RC[-1])=4,2,1) -> 1 | C30: =IF(RC[-1]=1,RC[-2]+(1/24*11),"") -> 2024-09-29T11:00:00.000 | D30: =IF(RC[-2]=1,RC[-3]+(1/24*23),"") -> 2024-09-29T23:00:00.000
A31: 2024-09-30T00:00:00.000 | B31: =IF(WEEKDAY(RC[-1])=4,2,1) -> 1 | C31: =IF(RC[-1]=1,RC[-2]+(1/24*11),"") -> 2024-09-30T11:00:00.000 | D31: =IF(RC[-2]=1,RC[-3]+(1/24*23),"") -> 2024-09-30T23:00:00.000
A32: 2024-10-01T00:00:00.000 | B32: =IF(WEEKDAY(RC[-1])=4,2,1) -> 1 | C32: =IF(RC[-1]=1,RC[-2]+(1/24*11),"") -> 2024-10-01T11:00:00.000 | D32: =IF(RC[-2]=1,RC[-3]+(1/24*23),"") -> 2024-10-01T23:00:00.000
A33: 2024-10-02T00:00:00.000 | B33: =IF(WEEKDAY(RC[-1])=4,2,1) -> 2 | C33: =IF(RC[-1]=1,RC[-2]+(1/24*11),"") ->  | D33: =IF(RC[-2]=1,RC[-3]+(1/24*23),"") -> 
A34: 2024-10-03T00:00:00.000 | B34: =IF(WEEKDAY(RC[-1])=4,2,1) -> 1 | C34: =IF(RC[-1]=1,RC[-2]+(1/24*11),"") -> 2024-10-03T11:00:00.000 | D34: =IF(RC[-2]=1,RC[-3]+(1/24*23),"") -> 2024-10-03T23:00:00.000
A35: 2024-10-04T00:00:00.000 | B35: =IF(WEEKDAY(RC[-1])=4,2,1) -> 1 | C35: =IF(RC[-1]=1,RC[-2]+(1/24*11),"") -> 2024-10-04T11:00:00.000 | D35: =IF(RC[-2]=1,RC[-3]+(1/24*23),"") -> 2024-10-04T23:00:00.000
A36: 2024-10-05T00:00:00.000 | B36: =IF(WEEKDAY(RC[-1])=4,2,1) -> 1 | C36: =IF(RC[-1]=1,RC[-2]+(1/24*11),"") -> 2024-10-05T11:00:00.000 | D36: =IF(RC[-2]=1,RC[-3]+(1/24*23),"") -> 2024-10-05T23:00:00.000
A37: 2024-10-06T00:00:00.000 | B37: =IF(WEEKDAY(RC[-1])=4,2,1) -> 1 | C37: =IF(RC[-1]=1,RC[-2]+(1/24*11),"") -> 2024-10-06T11:00:00.000 | D37: =IF(RC[-2]=1,RC[-3]+(1/24*23),"") -> 2024-10-06T23:00:00.000
A38: 2024-10-07T00:00:00.000 | B38: =IF(WEEKDAY(RC[-1])=4,2,1) -> 1 | C38: =IF(RC[-1]=1,RC[-2]+(1/24*11),"") -> 2024-10-07T11:00:00.000 | D38: =IF(RC[-2]=1,RC[-3]+(1/24*23),"") -> 2024-10-07T23:00:00.000
A39: 2024-10-08T00:00:00.000 | B39: =IF(WEEKDAY(RC[-1])=4,2,1) -> 1 | C39: =IF(RC[-1]=1,RC[-2]+(1/24*11),"") -> 2024-10-08T11:00:00.000 | D39: =IF(RC[-2]=1,RC[-3]+(1/24*23),"") -> 2024-10-08T23:00:00.000
A40: 2024-10-09T00:00:00.000 | B40: =IF(WEEKDAY(RC[-1])=4,2,1) -> 2 | C40: =IF(RC[-1]=1,RC[-2]+(1/24*11),"") ->  | D40: =IF(RC[-2]=1,RC[-3]+(1/24*23),"") -> 
A41: 2024-10-10T00:00:00.000 | B41: =IF(WEEKDAY(RC[-1])=4,2,1) -> 1 | C41: =IF(RC[-1]=1,RC[-2]+(1/24*11),"") -> 2024-10-10T11:00:00.000 | D41: =IF(RC[-2]=1,RC[-3]+(1/24*23),"") -> 2024-10-10T23:00:00.000
A42: 2024-10-11T00:00:00.000 | B42: =IF(WEEKDAY(RC[-1])=4,2,1) -> 1 | C42: =IF(RC[-1]=1,RC[-2]+(1/24*11),"") -> 2024-10-11T11:00:00.000 | D42: =IF(RC[-2]=1,RC[-3]+(1/24*23),"") -> 2024-10-11T23:00:00.000
A43: 2024-10-12T00:00:00.000 | B43: =IF(WEEKDAY(RC[-1])=4,2,1) -> 1 | C43: =IF(RC[-1]=1,RC[-2]+(1/24*11),"") -> 2024-10-12T11:00:00.000 | D43: =IF(RC[-2]=1,RC[-3]+(1/24*23),"") -> 2024-10-12T23:00:00.000
A44: 2024-10-13T00:00:00.000 | B44: =IF(WEEKDAY(RC[-1])=4,2,1) -> 1 | C44: =IF(RC[-1]=1,RC[-2]+(1/24*11),"") -> 2024-10-13T11:00:00.000 | D44: =IF(RC[-2]=1,RC[-3]+(1/24*23),"") -> 2024-10-13T23:00:00.000
A45: 2024-10-14T00:00:00.000 | B45: =IF(WEEKDAY(RC[-1])=4,2,1) -> 1 | C45: =IF(RC[-1]=1,RC[-2]+(1/24*11),"") -> 2024-10-14T11:00:00.000 | D45: =IF(RC[-2]=1,RC[-3]+(1/24*23),"") -> 2024-10-14T23:00:00.000
A46: 2024-10-15T00:00:00.000 | B46: =IF(WEEKDAY(RC[-1])=4,2,1) -> 1 | C46: =IF(RC[-1]=1,RC[-2]+(1/24*11),"") -> 2024-10-15T11:00:00.000 | D46: =IF(RC[-2]=1,RC[-3]+(1/24*23),"") -> 2024-10-15T23:00:00.000
A47: 2024-10-16T00:00:00.000 | B47: =IF(WEEKDAY(RC[-1])=4,2,1) -> 2 | C47: =IF(RC[-1]=1,RC[-2]+(1/24*11),"") ->  | D47: =IF(RC[-2]=1,RC[-3]+(1/24*23),"") -> 
A48: 2024-10-17T00:00:00.000 | B48: =IF(WEEKDAY(RC[-1])=4,2,1) -> 1 | C48: =IF(RC[-1]=1,RC[-2]+(1/24*11),"") -> 2024-10-17T11:00:00.000 | D48: =IF(RC[-2]=1,RC[-3]+(1/24*23),"") -> 2024-10-17T23:00:00.000
A49: 2024-10-18T00:00:00.000 | B49: =IF(WEEKDAY(RC[-1])=4,2,1) -> 1 | C49: =IF(RC[-1]=1,RC[-2]+(1/24*11),"") -> 2024-10-18T11:00:00.000 | D49: =IF(RC[-2]=1,RC[-3]+(1/24*23),"") -> 2024-10-18T23:00:00.000
A50: 2024-10-19T00:00:00.000 | B50: =IF(WEEKDAY(RC[-1])=4,2,1) -> 1 | C50: =IF(RC[-1]=1,RC[-2]+(1/24*11),"") -> 2024-10-19T11:00:00.000 | D50: =IF(RC[-2]=1,RC[-3]+(1/24*23),"") -> 2024-10-19T23:00:00.000
A51: 2024-10-20T00:00:00.000 | B51: =IF(WEEKDAY(RC[-1])=4,2,1) -> 1 | C51: =IF(RC[-1]=1,RC[-2]+(1/24*11),"") -> 2024-10-20T11:00:00.000 | D51: =IF(RC[-2]=1,RC[-3]+(1/24*23),"") -> 2024-10-20T23:00:00.000
A52: 2024-10-21T00:00:00.000 | B52: =IF(WEEKDAY(RC[-1])=4,2,1) -> 1 | C52: =IF(RC[-1]=1,RC[-2]+(1/24*11),"") -> 2024-10-21T11:00:00.000 | D52: =IF(RC[-2]=1,RC[-3]+(1/24*23),"") -> 2024-10-21T23:00:00.000
A53: 2024-10-22T00:00:00.000 | B53: =IF(WEEKDAY(RC[-1])=4,2,1) -> 1 | C53: =IF(RC[-1]=1,RC[-2]+(1/24*11),"") -> 2024-10-22T11:00:00.000 | D53: =IF(RC[-2]=1,RC[-3]+(1/24*23),"") -> 2024-10-22T23:00:00.000
A54: 2024-10-23T00:00:00.000 | B54: =IF(WEEKDAY(RC[-1])=4,2,1) -> 2 | C54: =IF(RC[-1]=1,RC[-2]+(1/24*11),"") ->  | D54: =IF(RC[-2]=1,RC[-3]+(1/24*23),"") -> 
A55: 2024-10-24T00:00:00.000 | B55: =IF(WEEKDAY(RC[-1])=4,2,1) -> 1 | C55: =IF(RC[-1]=1,RC[-2]+(1/24*11),"") -> 2024-10-24T11:00:00.000 | D55: =IF(RC[-2]=1,RC[-3]+(1/24*23),"") -> 2024-10-24T23:00:00.000
A56: 2024-10-25T00:00:00.000 | B56: =IF(WEEKDAY(RC[-1])=4,2,1) -> 1 | C56: =IF(RC[-1]=1,RC[-2]+(1/24*11),"") -> 2024-10-25T11:00:00.000 | D56: =IF(RC[-2]=1,RC[-3]+(1/24*23),"") -> 2024-10-25T23:00:00.000
A57: 2024-10-26T00:00:00.000 | B57: =IF(WEEKDAY(RC[-1])=4,2,1) -> 1 | C57: =IF(RC[-1]=1,RC[-2]+(1/24*11),"") -> 2024-10-26T11:00:00.000 | D57: =IF(RC[-2]=1,RC[-3]+(1/24*23),"") -> 2024-10-26T23:00:00.000
A58: 2024-10-27T00:00:00.000 | B58: =IF(WEEKDAY(RC[-1])=4,2,1) -> 1 | C58: =IF(RC[-1]=1,RC[-2]+(1/24*11),"") -> 2024-10-27T11:00:00.000 | D58: =IF(RC[-2]=1,RC[-3]+(1/24*23),"") -> 2024-10-27T23:00:00.000
A59: 2024-10-28T00:00:00.000 | B59: =IF(WEEKDAY(RC[-1])=4,2,1) -> 1 | C59: =IF(RC[-1]=1,RC[-2]+(1/24*11),"") -> 2024-10-28T11:00:00.000 | D59: =IF(RC[-2]=1,RC[-3]+(1/24*23),"") -> 2024-10-28T23:00:00.000
A60: 2024-10-29T00:00:00.000 | B60: =IF(WEEKDAY(RC[-1])=4,2,1) -> 1 | C60: =IF(RC[-1]=1,RC[-2]+(1/24*11),"") -> 2024-10-29T11:00:00.000 | D60: =IF(RC[-2]=1,RC[-3]+(1/24*23),"") -> 2024-10-29T23:00:00.000
A61: 2024-10-30T00:00:00.000 | B61: =IF(WEEKDAY(RC[-1])=4,2,1) -> 2 | C61: =IF(RC[-1]=1,RC[-2]+(1/24*11),"") ->  | D61: =IF(RC[-2]=1,RC[-3]+(1/24*23),"") -> 
A62: 2024-10-31T00:00:00.000 | B62: =IF(WEEKDAY(RC[-1])=4,2,1) -> 1 | C62: =IF(RC[-1]=1,RC[-2]+(1/24*11),"") -> 2024-10-31T11:00:00.000 | D62: =IF(RC[-2]=1,RC[-3]+(1/24*23),"") -> 2024-10-31T23:00:00.000
A63: 2024-11-01T00:00:00.000 | B63: =IF(WEEKDAY(RC[-1])=4,2,1) -> 1 | C63: =IF(RC[-1]=1,RC[-2]+(1/24*11),"") -> 2024-11-01T11:00:00.000 | D63: =IF(RC[-2]=1,RC[-3]+(1/24*23),"") -> 2024-11-01T23:00:00.000
A64: 2024-11-02T00:00:00.000 | B64: =IF(WEEKDAY(RC[-1])=4,2,1) -> 1 | C64: =IF(RC[-1]=1,RC[-2]+(1/24*11),"") -> 2024-11-02T11:00:00.000 | D64: =IF(RC[-2]=1,RC[-3]+(1/24*23),"") -> 2024-11-02T23:00:00.000
A65: 2024-11-03T00:00:00.000 | B65: =IF(WEEKDAY(RC[-1])=4,2,1) -> 1 | C65: =IF(RC[-1]=1,RC[-2]+(1/24*11),"") -> 2024-11-03T11:00:00.000 | D65: =IF(RC[-2]=1,RC[-3]+(1/24*23),"") -> 2024-11-03T23:00:00.000
A66: 2024-11-04T00:00:00.000 | B66: =IF(WEEKDAY(RC[-1])=4,2,1) -> 1 | C66: =IF(RC[-1]=1,RC[-2]+(1/24*11),"") -> 2024-11-04T11:00:00.000 | D66: =IF(RC[-2]=1,RC[-3]+(1/24*23),"") -> 2024-11-04T23:00:00.000
A67: 2024-11-05T00:00:00.000 | B67: =IF(WEEKDAY(RC[-1])=4,2,1) -> 1 | C67: =IF(RC[-1]=1,RC[-2]+(1/24*11),"") -> 2024-11-05T11:00:00.000 | D67: =IF(RC[-2]=1,RC[-3]+(1/24*23),"") -> 2024-11-05T23:00:00.000
A68: 2024-11-06T00:00:00.000 | B68: =IF(WEEKDAY(RC[-1])=4,2,1) -> 2 | C68: =IF(RC[-1]=1,RC[-2]+(1/24*11),"") ->  | D68: =IF(RC[-2]=1,RC[-3]+(1/24*23),"") -> 
A69: 2024-11-07T00:00:00.000 | B69: =IF(WEEKDAY(RC[-1])=4,2,1) -> 1 | C69: =IF(RC[-1]=1,RC[-2]+(1/24*11),"") -> 2024-11-07T11:00:00.000 | D69: =IF(RC[-2]=1,RC[-3]+(1/24*23),"") -> 2024-11-07T23:00:00.000
A70: 2024-11-08T00:00:00.000 | B70: =IF(WEEKDAY(RC[-1])=4,2,1) -> 1 | C70: =IF(RC[-1]=1,RC[-2]+(1/24*11),"") -> 2024-11-08T11:00:00.000 | D70: =IF(RC[-2]=1,RC[-3]+(1/24*23),"") -> 2024-11-08T23:00:00.000
A71: 2024-11-09T00:00:00.000 | B71: =IF(WEEKDAY(RC[-1])=4,2,1) -> 1 | C71: =IF(RC[-1]=1,RC[-2]+(1/24*11),"") -> 2024-11-09T11:00:00.000 | D71: =IF(RC[-2]=1,RC[-3]+(1/24*23),"") -> 2024-11-09T23:00:00.000
A72: 2024-11-10T00:00:00.000 | B72: =IF(WEEKDAY(RC[-1])=4,2,1) -> 1 | C72: =IF(RC[-1]=1,RC[-2]+(1/24*11),"") -> 2024-11-10T11:00:00.000 | D72: =IF(RC[-2]=1,RC[-3]+(1/24*23),"") -> 2024-11-10T23:00:00.000
A73: 2024-11-11T00:00:00.000 | B73: =IF(WEEKDAY(RC[-1])=4,2,1) -> 1 | C73: =IF(RC[-1]=1,RC[-2]+(1/24*11),"") -> 2024-11-11T11:00:00.000 | D73: =IF(RC[-2]=1,RC[-3]+(1/24*23),"") -> 2024-11-11T23:00:00.000
A74: 2024-11-12T00:00:00.000 | B74: =IF(WEEKDAY(RC[-1])=4,2,1) -> 1 | C74: =IF(RC[-1]=1,RC[-2]+(1/24*11),"") -> 2024-11-12T11:00:00.000 | D74: =IF(RC[-2]=1,RC[-3]+(1/24*23),"") -> 2024-11-12T23:00:00.000
A75: 2024-11-13T00:00:00.000 | B75: =IF(WEEKDAY(RC[-1])=4,2,1) -> 2 | C75: =IF(RC[-1]=1,RC[-2]+(1/24*11),"") ->  | D75: =IF(RC[-2]=1,RC[-3]+(1/24*23),"") -> 
A76: 2024-11-14T00:00:00.000 | B76: =IF(WEEKDAY(RC[-1])=4,2,1) -> 1 | C76: =IF(RC[-1]=1,RC[-2]+(1/24*11),"") -> 2024-11-14T11:00:00.000 | D76: =IF(RC[-2]=1,RC[-3]+(1/24*23),"") -> 2024-11-14T23:00:00.000
A77: 2024-11-15T00:00:00.000 | B77: =IF(WEEKDAY(RC[-1])=4,2,1) -> 1 | C77: =IF(RC[-1]=1,RC[-2]+(1/24*11),"") -> 2024-11-15T11:00:00.000 | D77: =IF(RC[-2]=1,RC[-3]+(1/24*23),"") -> 2024-11-15T23:00:00.000
A78: 2024-11-16T00:00:00.000 | B78: =IF(WEEKDAY(RC[-1])=4,2,1) -> 1 | C78: =IF(RC[-1]=1,RC[-2]+(1/24*11),"") -> 2024-11-16T11:00:00.000 | D78: =IF(RC[-2]=1,RC[-3]+(1/24*23),"") -> 2024-11-16T23:00:00.000
A79: 2024-11-17T00:00:00.000 | B79: =IF(WEEKDAY(RC[-1])=4,2,1) -> 1 | C79: =IF(RC[-1]=1,RC[-2]+(1/24*11),"") -> 2024-11-17T11:00:00.000 | D79: =IF(RC[-2]=1,RC[-3]+(1/24*23),"") -> 2024-11-17T23:00:00.000
A80: 2024-11-18T00:00:00.000 | B80: =IF(WEEKDAY(RC[-1])=4,2,1) -> 1 | C80: =IF(RC[-1]=1,RC[-2]+(1/24*11),"") -> 2024-11-18T11:00:00.000 | D80: =IF(RC[-2]=1,RC[-3]+(1/24*23),"") -> 2024-11-18T23:00:00.000
A81: 2024-11-19T00:00:00.000 | B81: =IF(WEEKDAY(RC[-1])=4,2,1) -> 1 | C81: =IF(RC[-1]=1,RC[-2]+(1/24*11),"") -> 2024-11-19T11:00:00.000 | D81: =IF(RC[-2]=1,RC[-3]+(1/24*23),"") -> 2024-11-19T23:00:00.000
A82: 2024-11-20T00:00:00.000 | B82: =IF(WEEKDAY(RC[-1])=4,2,1) -> 2 | C82: =IF(RC[-1]=1,RC[-2]+(1/24*11),"") ->  | D82: =IF(RC[-2]=1,RC[-3]+(1/24*23),"") -> 
A83: 2024-11-21T00:00:00.000 | B83: =IF(WEEKDAY(RC[-1])=4,2,1) -> 1 | C83: =IF(RC[-1]=1,RC[-2]+(1/24*11),"") -> 2024-11-21T11:00:00.000 | D83: =IF(RC[-2]=1,RC[-3]+(1/24*23),"") -> 2024-11-21T23:00:00.000
A84: 2024-11-22T00:00:00.000 | B84: =IF(WEEKDAY(RC[-1])=4,2,1) -> 1 | C84: =IF(RC[-1]=1,RC[-2]+(1/24*11),"") -> 2024-11-22T11:00:00.000 | D84: =IF(RC[-2]=1,RC[-3]+(1/24*23),"") -> 2024-11-22T23:00:00.000
A85: 2024-11-23T00:00:00.000 | B85: =IF(WEEKDAY(RC[-1])=4,2,1) -> 1 | C85: =IF(RC[-1]=1,RC[-2]+(1/24*11),"") -> 2024-11-23T11:00:00.000 | D85: =IF(RC[-2]=1,RC[-3]+(1/24*23),"") -> 2024-11-23T23:00:00.000
A86: 2024-11-24T00:00:00.000 | B86: =IF(WEEKDAY(RC[-1])=4,2,1) -> 1 | C86: =IF(RC[-1]=1,RC[-2]+(1/24*11),"") -> 2024-11-24T11:00:00.000 | D86: =IF(RC[-2]=1,RC[-3]+(1/24*23),"") -> 2024-11-24T23:00:00.000
A87: 2024-11-25T00:00:00.000 | B87: =IF(WEEKDAY(RC[-1])=4,2,1) -> 1 | C87: =IF(RC[-1]=1,RC[-2]+(1/24*11),"") -> 2024-11-25T11:00:00.000 | D87: =IF(RC[-2]=1,RC[-3]+(1/24*23),"") -> 2024-11-25T23:00:00.000
A88: 2024-11-26T00:00:00.000 | B88: =IF(WEEKDAY(RC[-1])=4,2,1) -> 1 | C88: =IF(RC[-1]=1,RC[-2]+(1/24*11),"") -> 2024-11-26T11:00:00.000 | D88: =IF(RC[-2]=1,RC[-3]+(1/24*23),"") -> 2024-11-26T23:00:00.000
A89: 2024-11-27T00:00:00.000 | B89: =IF(WEEKDAY(RC[-1])=4,2,1) -> 2 | C89: =IF(RC[-1]=1,RC[-2]+(1/24*11),"") ->  | D89: =IF(RC[-2]=1,RC[-3]+(1/24*23),"") -> 
A90: 2024-11-28T00:00:00.000 | B90: =IF(WEEKDAY(RC[-1])=4,2,1) -> 1 | C90: =IF(RC[-1]=1,RC[-2]+(1/24*11),"") -> 2024-11-28T11:00:00.000 | D90: =IF(RC[-2]=1,RC[-3]+(1/24*23),"") -> 2024-11-28T23:00:00.000
A91: 2024-11-29T00:00:00.000 | B91: =IF(WEEKDAY(RC[-1])=4,2,1) -> 1 | C91: =IF(RC[-1]=1,RC[-2]+(1/24*11),"") -> 2024-11-29T11:00:00.000 | D91: =IF(RC[-2]=1,RC[-3]+(1/24*23),"") -> 2024-11-29T23:00:00.000
A92: 2024-11-30T00:00:00.000 | B92: =IF(WEEKDAY(RC[-1])=4,2,1) -> 1 | C92: =IF(RC[-1]=1,RC[-2]+(1/24*11),"") -> 2024-11-30T11:00:00.000 | D92: =IF(RC[-2]=1,RC[-3]+(1/24*23),"") -> 2024-11-30T23:00:00.000
A93: 2024-12-01T00:00:00.000 | B93: =IF(WEEKDAY(RC[-1])=4,2,1) -> 1 | C93: =IF(RC[-1]=1,RC[-2]+(1/24*11),"") -> 2024-12-01T11:00:00.000 | D93: =IF(RC[-2]=1,RC[-3]+(1/24*23),"") -> 2024-12-01T23:00:00.000
A94: 2024-12-02T00:00:00.000 | B94: =IF(WEEKDAY(RC[-1])=4,2,1) -> 1 | C94: =IF(RC[-1]=1,RC[-2]+(1/24*11),"") -> 2024-12-02T11:00:00.000 | D94: =IF(RC[-2]=1,RC[-3]+(1/24*23),"") -> 2024-12-02T23:00:00.000
A95: 2024-12-03T00:00:00.000 | B95: =IF(WEEKDAY(RC[-1])=4,2,1) -> 1 | C95: =IF(RC[-1]=1,RC[-2]+(1/24*11),"") -> 2024-12-03T11:00:00.000 | D95: =IF(RC[-2]=1,RC[-3]+(1/24*23),"") -> 2024-12-03T23:00:00.000
A96: 2024-12-04T00:00:00.000 | B96: =IF(WEEKDAY(RC[-1])=4,2,1) -> 2 | C96: =IF(RC[-1]=1,RC[-2]+(1/24*11),"") ->  | D96: =IF(RC[-2]=1,RC[-3]+(1/24*23),"") -> 
A97: 2024-12-05T00:00:00.000 | B97: =IF(WEEKDAY(RC[-1])=4,2,1) -> 1 | C97: =IF(RC[-1]=1,RC[-2]+(1/24*11),"") -> 2024-12-05T11:00:00.000 | D97: =IF(RC[-2]=1,RC[-3]+(1/24*23),"") -> 2024-12-05T23:00:00.000
A98: 2024-12-06T00:00:00.000 | B98: =IF(WEEKDAY(RC[-1])=4,2,1) -> 1 | C98: =IF(RC[-1]=1,RC[-2]+(1/24*11),"") -> 2024-12-06T11:00:00.000 | D98: =IF(RC[-2]=1,RC[-3]+(1/24*23),"") -> 2024-12-06T23:00:00.000
A99: 2024-12-07T00:00:00.000 | B99: =IF(WEEKDAY(RC[-1])=4,2,1) -> 1 | C99: =IF(RC[-1]=1,RC[-2]+(1/24*11),"") -> 2024-12-07T11:00:00.000 | D99: =IF(RC[-2]=1,RC[-3]+(1/24*23),"") -> 2024-12-07T23:00:00.000
A100: 2024-12-08T00:00:00.000 | B100: =IF(WEEKDAY(RC[-1])=4,2,1) -> 1 | C100: =IF(RC[-1]=1,RC[-2]+(1/24*11),"") -> 2024-12-08T11:00:00.000 | D100: =IF(RC[-2]=1,RC[-3]+(1/24*23),"") -> 2024-12-08T23:00:00.000
A101: 2024-12-09T00:00:00.000 | B101: =IF(WEEKDAY(RC[-1])=4,2,1) -> 1 | C101: =IF(RC[-1]=1,RC[-2]+(1/24*11),"") -> 2024-12-09T11:00:00.000 | D101: =IF(RC[-2]=1,RC[-3]+(1/24*23),"") -> 2024-12-09T23:00:00.000
A102: 2024-12-10T00:00:00.000 | B102: =IF(WEEKDAY(RC[-1])=4,2,1) -> 1 | C102: =IF(RC[-1]=1,RC[-2]+(1/24*11),"") -> 2024-12-10T11:00:00.000 | D102: =IF(RC[-2]=1,RC[-3]+(1/24*23),"") -> 2024-12-10T23:00:00.000
A103: 2024-12-11T00:00:00.000 | B103: =IF(WEEKDAY(RC[-1])=4,2,1) -> 2 | C103: =IF(RC[-1]=1,RC[-2]+(1/24*11),"") ->  | D103: =IF(RC[-2]=1,RC[-3]+(1/24*23),"") -> 
A104: 2024-12-12T00:00:00.000 | B104: =IF(WEEKDAY(RC[-1])=4,2,1) -> 1 | C104: =IF(RC[-1]=1,RC[-2]+(1/24*11),"") -> 2024-12-12T11:00:00.000 | D104: =IF(RC[-2]=1,RC[-3]+(1/24*23),"") -> 2024-12-12T23:00:00.000
A105: 2024-12-13T00:00:00.000 | B105: =IF(WEEKDAY(RC[-1])=4,2,1) -> 1 | C105: =IF(RC[-1]=1,RC[-2]+(1/24*11),"") -> 2024-12-13T11:00:00.000 | D105: =IF(RC[-2]=1,RC[-3]+(1/24*23),"") -> 2024-12-13T23:00:00.000
A106: 2024-12-14T00:00:00.000 | B106: =IF(WEEKDAY(RC[-1])=4,2,1) -> 1 | C106: =IF(RC[-1]=1,RC[-2]+(1/24*11),"") -> 2024-12-14T11:00:00.000 | D106: =IF(RC[-2]=1,RC[-3]+(1/24*23),"") -> 2024-12-14T23:00:00.000
A107: 2024-12-15T00:00:00.000 | B107: =IF(WEEKDAY(RC[-1])=4,2,1) -> 1 | C107: =IF(RC[-1]=1,RC[-2]+(1/24*11),"") -> 2024-12-15T11:00:00.000 | D107: =IF(RC[-2]=1,RC[-3]+(1/24*23),"") -> 2024-12-15T23:00:00.000
A108: 2024-12-16T00:00:00.000 | B108: =IF(WEEKDAY(RC[-1])=4,2,1) -> 1 | C108: =IF(RC[-1]=1,RC[-2]+(1/24*11),"") -> 2024-12-16T11:00:00.000 | D108: =IF(RC[-2]=1,RC[-3]+(1/24*23),"") -> 2024-12-16T23:00:00.000
A109: 2024-12-17T00:00:00.000 | B109: =IF(WEEKDAY(RC[-1])=4,2,1) -> 1 | C109: =IF(RC[-1]=1,RC[-2]+(1/24*11),"") -> 2024-12-17T11:00:00.000 | D109: =IF(RC[-2]=1,RC[-3]+(1/24*23),"") -> 2024-12-17T23:00:00.000
A110: 2024-12-18T00:00:00.000 | B110: =IF(WEEKDAY(RC[-1])=4,2,1) -> 2 | C110: =IF(RC[-1]=1,RC[-2]+(1/24*11),"") ->  | D110: =IF(RC[-2]=1,RC[-3]+(1/24*23),"") -> 
A111: 2024-12-19T00:00:00.000 | B111: =IF(WEEKDAY(RC[-1])=4,2,1) -> 1 | C111: =IF(RC[-1]=1,RC[-2]+(1/24*11),"") -> 2024-12-19T11:00:00.000 | D111: =IF(RC[-2]=1,RC[-3]+(1/24*23),"") -> 2024-12-19T23:00:00.000
A112: 2024-12-20T00:00:00.000 | B112: =IF(WEEKDAY(RC[-1])=4,2,1) -> 1 | C112: =IF(RC[-1]=1,RC[-2]+(1/24*11),"") -> 2024-12-20T11:00:00.000 | D112: =IF(RC[-2]=1,RC[-3]+(1/24*23),"") -> 2024-12-20T23:00:00.000
A113: 2024-12-21T00:00:00.000 | B113: =IF(WEEKDAY(RC[-1])=4,2,1) -> 1 | C113: =IF(RC[-1]=1,RC[-2]+(1/24*11),"") -> 2024-12-21T11:00:00.000 | D113: =IF(RC[-2]=1,RC[-3]+(1/24*23),"") -> 2024-12-21T23:00:00.000
A114: 2024-12-22T00:00:00.000 | B114: =IF(WEEKDAY(RC[-1])=4,2,1) -> 1 | C114: =IF(RC[-1]=1,RC[-2]+(1/24*11),"") -> 2024-12-22T11:00:00.000 | D114: =IF(RC[-2]=1,RC[-3]+(1/24*23),"") -> 2024-12-22T23:00:00.000
A115: 2024-12-23T00:00:00.000 | B115: =IF(WEEKDAY(RC[-1])=4,2,1) -> 1 | C115: =IF(RC[-1]=1,RC[-2]+(1/24*11),"") -> 2024-12-23T11:00:00.000 | D115: =IF(RC[-2]=1,RC[-3]+(1/24*23),"") -> 2024-12-23T23:00:00.000
A116: 2024-12-24T00:00:00.000 | B116: =IF(WEEKDAY(RC[-1])=4,2,1) -> 1 | C116: =IF(RC[-1]=1,RC[-2]+(1/24*11),"") -> 2024-12-24T11:00:00.000 | D116: =IF(RC[-2]=1,RC[-3]+(1/24*23),"") -> 2024-12-24T23:00:00.000
A117: 2024-12-25T00:00:00.000 | B117: =IF(WEEKDAY(RC[-1])=4,2,1) -> 2 | C117: =IF(RC[-1]=1,RC[-2]+(1/24*11),"") ->  | D117: =IF(RC[-2]=1,RC[-3]+(1/24*23),"") -> 
A118: 2024-12-26T00:00:00.000 | B118: =IF(WEEKDAY(RC[-1])=4,2,1) -> 1 | C118: =IF(RC[-1]=1,RC[-2]+(1/24*11),"") -> 2024-12-26T11:00:00.000 | D118: =IF(RC[-2]=1,RC[-3]+(1/24*23),"") -> 2024-12-26T23:00:00.000
A119: 2024-12-27T00:00:00.000 | B119: =IF(WEEKDAY(RC[-1])=4,2,1) -> 1 | C119: =IF(RC[-1]=1,RC[-2]+(1/24*11),"") -> 2024-12-27T11:00:00.000 | D119: =IF(RC[-2]=1,RC[-3]+(1/24*23),"") -> 2024-12-27T23:00:00.000
A120: 2024-12-28T00:00:00.000 | B120: =IF(WEEKDAY(RC[-1])=4,2,1) -> 1 | C120: =IF(RC[-1]=1,RC[-2]+(1/24*11),"") -> 2024-12-28T11:00:00.000 | D120: =IF(RC[-2]=1,RC[-3]+(1/24*23),"") -> 2024-12-28T23:00:00.000
A121: 2024-12-29T00:00:00.000 | B121: =IF(WEEKDAY(RC[-1])=4,2,1) -> 1 | C121: =IF(RC[-1]=1,RC[-2]+(1/24*11),"") -> 2024-12-29T11:00:00.000 | D121: =IF(RC[-2]=1,RC[-3]+(1/24*23),"") -> 2024-12-29T23:00:00.000
A122: 2024-12-30T00:00:00.000 | B122: =IF(WEEKDAY(RC[-1])=4,2,1) -> 1 | C122: =IF(RC[-1]=1,RC[-2]+(1/24*11),"") -> 2024-12-30T11:00:00.000 | D122: =IF(RC[-2]=1,RC[-3]+(1/24*23),"") -> 2024-12-30T23:00:00.000

Sheet: staffs
A1: id | B1: contract_type_cd | C1: staff_first_name | D1: staff_last_name | E1: gender_cd | F1: staff_address | G1: staff_email_address | H1: staff_phone_number
A2: 1 | B2: 1 | C2: John | D2: Smith | E2: 1 | F2: 10-18 Geryon Montes | G2: john.s@example.com | H2: XXX-741-9881 | J2: =VLOOKUP(RC[-8],code!R2C1:R7C2,2,FALSE) -> Management position
A3: 2 | B3: 2 | C3: Mia | D3: Smith | E3: 2 | F3: 191-9 Ravi Vallis | G3: mia.s@example.com | H3: XXX-381-2595 | J3: =VLOOKUP(RC[-8],code!R2C1:R7C2,2,FALSE) -> Employee
A4: 3 | B4: 2 | C4: William | D4: Garcia | E4: 1 | F4: 56-12 Hypsas Vallis | G4: william.g@example.com | H4: XXX-416-6645 | J4: =VLOOKUP(RC[-8],code!R2C1:R7C2,2,FALSE) -> Employee
A5: 4 | B5: 2 | C5: Liam | D5: Davis | E5: 1 | F5: 135-1 Hermus Vallis | G5: liam.d@example.com | H5: XXX-526-3448 | J5: =VLOOKUP(RC[-8],code!R2C1:R7C2,2,FALSE) -> Employee
A6: 5 | B6: 2 | C6: Oliver | D6: Rodriguez | E6: 1 | F6: 35-3 Amenthes Planum | G6: oliver.r@example.com | H6: XXX-195-1135 | J6: =VLOOKUP(RC[-8],code!R2C1:R7C2,2,FALSE) -> Employee
A7: 6 | B7: 2 | C7: Sarah | D7: White | E7: 2 | F7: 242-3 Geryon Montes | G7: sarah.w@example.com | H7: XXX-800-7705 | J7: =VLOOKUP(RC[-8],code!R2C1:R7C2,2,FALSE) -> Employee
A8: 7 | B8: 5 | C8: Eleanor | D8: Taylor | E8: 2 | F8: 45-2 Verde Vallis | G8: eleanor.t@example.com | H8: XXX-218-4796 | J8: =VLOOKUP(RC[-8],code!R2C1:R7C2,2,FALSE) -> Part-time workers
A9: 8 | B9: 5 | C9: Gianna | D9: Brown | E9: 2 | F9: 282-9 Frento Vallis | G9: gianna.b@example.com | H9: XXX-869-2508 | J9: =VLOOKUP(RC[-8],code!R2C1:R7C2,2,FALSE) -> Part-time workers
A10: 9 | B10: 2 | C10: Ethan | D10: Moore | E10: 1 | F10: 93-11 Granicus Valles | G10: ethan.m@example.com | H10: XXX-060-4077 | J10: =VLOOKUP(RC[-8],code!R2C1:R7C2,2,FALSE) -> Employee
A11: 10 | B11: 5 | C11: Charles | D11: Hernandez | E11: 1 | F11: 81-15 Chalce Montes | G11: charles.h@example.com | H11: XXX-061-2330 | J11: =VLOOKUP(RC[-8],code!R2C1:R7C2,2,FALSE) -> Part-time workers
A12: 11 | B12: 5 | C12: Henry | D12: Smith | E12: 1 | F12: 204-18 Asopus Vallis | G12: henry.s@example.com | H12: XXX-313-2708 | J12: =VLOOKUP(RC[-8],code!R2C1:R7C2,2,FALSE) -> Part-time workers
A13: 12 | B13: 5 | C13: Mason | D13: Jones | E13: 1 | F13: 225-1 Maumee Valles | G13: mason.j@example.com | H13: XXX-837-9065 | J13: =VLOOKUP(RC[-8],code!R2C1:R7C2,2,FALSE) -> Part-time workers
A14: 13 | B14: 5 | C14: Harry | D14: Garcia | E14: 1 | F14: 236-5 Euripus Mons | G14: harry.g@example.com | H14: XXX-667-3862 | J14: =VLOOKUP(RC[-8],code!R2C1:R7C2,2,FALSE) -> Part-time workers
A15: 14 | B15: 5 | C15: Levi | D15: Brown | E15: 2 | F15: 293-8 Charitum Montes | G15: levi.b@example.com | H15: XXX-668-3943 | J15: =VLOOKUP(RC[-8],code!R2C1:R7C2,2,FALSE) -> Part-time workers

Sheet: rolls
A1: id | B1: roll_name
A2: 1 | B2: Manager
A3: 2 | B3: Administration
A4: 3 | B4: Cooking
A5: 4 | B5: Customer Service
A6: 5 | B6: Delivery

Sheet: staff_rolls
A1: id | B1: staff_id | C1: roll_id | D1: effective_date | E1: expiration_date
A2: 1 | B2: 1 | C2: 1 | D2: 2024-01-01T00:00:00.000 | G2: =VLOOKUP(RC[-5],staffs!C[-6]:C[-4],3,FALSE) -> John | H2: =VLOOKUP(RC[-6],staffs!C[-7]:C[-5],2,FALSE) -> 1 | I2: =VLOOKUP(RC[-6],rolls!C[-8]:C[-7],2,FALSE) -> Manager
A3: 2 | B3: 1 | C3: 3 | D3: 2024-01-01T00:00:00.000 | G3: =VLOOKUP(RC[-5],staffs!C[-6]:C[-4],3,FALSE) -> John | H3: =VLOOKUP(RC[-6],staffs!C[-7]:C[-5],2,FALSE) -> 1 | I3: =VLOOKUP(RC[-6],rolls!C[-8]:C[-7],2,FALSE) -> Cooking
A4: 3 | B4: 2 | C4: 2 | D4: 2024-01-01T00:00:00.000 | G4: =VLOOKUP(RC[-5],staffs!C[-6]:C[-4],3,FALSE) -> Mia | H4: =VLOOKUP(RC[-6],staffs!C[-7]:C[-5],2,FALSE) -> 2 | I4: =VLOOKUP(RC[-6],rolls!C[-8]:C[-7],2,FALSE) -> Administration
A5: 4 | B5: 2 | C5: 4 | D5: 2024-01-01T00:00:00.000 | G5: =VLOOKUP(RC[-5],staffs!C[-6]:C[-4],3,FALSE) -> Mia | H5: =VLOOKUP(RC[-6],staffs!C[-7]:C[-5],2,FALSE) -> 2 | I5: =VLOOKUP(RC[-6],rolls!C[-8]:C[-7],2,FALSE) -> Customer Service
A6: 5 | B6: 3 | C6: 3 | D6: 2024-01-01T00:00:00.000 | G6: =VLOOKUP(RC[-5],staffs!C[-6]:C[-4],3,FALSE) -> William | H6: =VLOOKUP(RC[-6],staffs!C[-7]:C[-5],2,FALSE) -> 2 | I6: =VLOOKUP(RC[-6],rolls!C[-8]:C[-7],2,FALSE) -> Cooking
A7: 6 | B7: 4 | C7: 3 | D7: 2024-01-01T00:00:00.000 | G7: =VLOOKUP(RC[-5],staffs!C[-6]:C[-4],3,FALSE) -> Liam | H7: =VLOOKUP(RC[-6],staffs!C[-7]:C[-5],2,FALSE) -> 2 | I7: =VLOOKUP(RC[-6],rolls!C[-8]:C[-7],2,FALSE) -> Cooking
A8: 7 | B8: 5 | C8: 3 | D8: 2024-01-01T00:00:00.000 | G8: =VLOOKUP(RC[-5],staffs!C[-6]:C[-4],3,FALSE) -> Oliver | H8: =VLOOKUP(RC[-6],staffs!C[-7]:C[-5],2,FALSE) -> 2 | I8: =VLOOKUP(RC[-6],rolls!C[-8]:C[-7],2,FALSE) -> Cooking
A9: 8 | B9: 6 | C9: 4 | D9: 2024-01-01T00:00:00.000 | G9: =VLOOKUP(RC[-5],staffs!C[-6]:C[-4],3,FALSE) -> Sarah | H9: =VLOOKUP(RC[-6],staffs!C[-7]:C[-5],2,FALSE) -> 2 | I9: =VLOOKUP(RC[-6],rolls!C[-8]:C[-7],2,FALSE) -> Customer Service
A10: 9 | B10: 7 | C10: 4 | D10: 2024-01-01T00:00:00.000 | G10: =VLOOKUP(RC[-5],staffs!C[-6]:C[-4],3,FALSE) -> Eleanor | H10: =VLOOKUP(RC[-6],staffs!C[-7]:C[-5],2,FALSE) -> 5 | I10: =VLOOKUP(RC[-6],rolls!C[-8]:C[-7],2,FALSE) -> Customer Service
A11: 10 | B11: 8 | C11: 4 | D11: 2024-01-01T00:00:00.000 | G11: =VLOOKUP(RC[-5],staffs!C[-6]:C[-4],3,FALSE) -> Gianna | H11: =VLOOKUP(RC[-6],staffs!C[-7]:C[-5],2,FALSE) -> 5 | I11: =VLOOKUP(RC[-6],rolls!C[-8]:C[-7],2,FALSE) -> Customer Service
A12: 11 | B12: 9 | C12: 5 | D12: 2024-01-01T00:00:00.000 | G12: =VLOOKUP(RC[-5],staffs!C[-6]:C[-4],3,FALSE) -> Ethan | H12: =VLOOKUP(RC[-6],staffs!C[-7]:C[-5],2,FALSE) -> 2 | I12: =VLOOKUP(RC[-6],rolls!C[-8]:C[-7],2,FALSE) -> Delivery
A13: 12 | B13: 10 | C13: 5 | D13: 2024-01-01T00:00:00.000 | G13: =VLOOKUP(RC[-5],staffs!C[-6]:C[-4],3,FALSE) -> Charles | H13: =VLOOKUP(RC[-6],staffs!C[-7]:C[-5],2,FALSE) -> 5 | I13: =VLOOKUP(RC[-6],rolls!C[-8]:C[-7],2,FALSE) -> Delivery
A14: 13 | B14: 11 | C14: 5 | D14: 2024-01-01T00:00:00.000 | G14: =VLOOKUP(RC[-5],staffs!C[-6]:C[-4],3,FALSE) -> Henry | H14: =VLOOKUP(RC[-6],staffs!C[-7]:C[-5],2,FALSE) -> 5 | I14: =VLOOKUP(RC[-6],rolls!C[-8]:C[-7],2,FALSE) -> Delivery
A15: 14 | B15: 12 | C15: 5 | D15: 2024-01-01T00:00:00.000 | G15: =VLOOKUP(RC[-5],staffs!C[-6]:C[-4],3,FALSE) -> Mason | H15: =VLOOKUP(RC[-6],staffs!C[-7]:C[-5],2,FALSE) -> 5 | I15: =VLOOKUP(RC[-6],rolls!C[-8]:C[-7],2,FALSE) -> Delivery
A16: 15 | B16: 13 | C16: 5 | D16: 2024-01-01T00:00:00.000 | G16: =VLOOKUP(RC[-5],staffs!C[-6]:C[-4],3,FALSE) -> Harry | H16: =VLOOKUP(RC[-6],staffs!C[-7]:C[-5],2,FALSE) -> 5 | I16: =VLOOKUP(RC[-6],rolls!C[-8]:C[-7],2,FALSE) -> Delivery
A17: 16 | B17: 14 | C17: 5 | D17: 2024-01-01T00:00:00.000 | G17: =VLOOKUP(RC[-5],staffs!C[-6]:C[-4],3,FALSE) -> Levi | H17: =VLOOKUP(RC[-6],staffs!C[-7]:C[-5],2,FALSE) -> 5 | I17: =VLOOKUP(RC[-6],rolls!C[-8]:C[-7],2,FALSE) -> Delivery

Sheet: gates
A1: id | B1: gate_name | C1: gate_type_cd
A2: 1 | B2: Store Entrance | C2: 2
A3: 2 | B3: Store Exit | C3: 5
A4: 3 | B4: Floor Entrance | C4: 2
A5: 4 | B5: Floor Exit | C5: 5
A6: 5 | B6: Staff Entrance | C6: 1
A7: 6 | B7: Staff Exit | C7: 5
A8: 7 | B8: Delivery Entrance | C8: 1
A9: 8 | B9: Delivery Exit | C9: 4

Sheet: products
A1: id | B1: product_name | C1: product_type_cd | D1: lead_time | E1: product_overview
A2: 1 | B2: Margherita Small | C2: 1 | D2: 10
A3: 2 | B3: Margherita Medium | C3: 1 | D3: 12
A4: 3 | B4: Margherita Large | C4: 1 | D4: 14
A5: 4 | B5: Margherita Extra Large | C5: 1 | D5: 16
A6: 5 | B6: Marinara Small | C6: 1 | D6: 10
A7: 6 | B7: Marinara Medium | C7: 1 | D7: 12
A8: 7 | B8: Marinara Large | C8: 1 | D8: 14
A9: 8 | B9: Marinara Extra Large | C9: 1 | D9: 16
A10: 9 | B10: Quattro Formaggi Small | C10: 1 | D10: 10
A11: 10 | B11: Quattro Formaggi Medium | C11: 1 | D11: 12
A12: 11 | B12: Quattro Formaggi Large | C12: 1 | D12: 14
A13: 12 | B13: Quattro Formaggi Extra Large | C13: 1 | D13: 16
A14: 13 | B14: Boscaiola Small | C14: 1 | D14: 12
A15: 14 | B15: Boscaiola Medium | C15: 1 | D15: 14
A16: 15 | B16: Boscaiola Large | C16: 1 | D16: 16
A17: 16 | B17: Boscaiola Extra Large | C17: 1 | D17: 18
A18: 17 | B18: Siciliana Small | C18: 1 | D18: 10
A19: 18 | B19: Siciliana Medium | C19: 1 | D19: 12
A20: 19 | B20: Siciliana Large | C20: 1 | D20: 14
A21: 20 | B21: Siciliana Extra Large | C21: 1 | D21: 16
A22: 21 | B22: Pescatore Small | C22: 1 | D22: 12
A23: 22 | B23: Pescatore Medium | C23: 1 | D23: 14
A24: 23 | B24: Pescatore Large | C24: 1 | D24: 16
A25: 24 | B25: Pescatore Extra Large | C25: 1 | D25: 18
A26: 25 | B26: Genovese Small | C26: 1 | D26: 10
A27: 26 | B27: Genovese Medium | C27: 1 | D27: 12
A28: 27 | B28: Genovese Large | C28: 1 | D28: 14
A29: 28 | B29: Genovese Extra Large | C29: 1 | D29: 16
A30: 29 | B30: Chicken wings | C30: 2 | D30: 5
A31: 30 | B31: Garlic bread | C31: 2 | D31: 5
A32: 31 | B32: Side salad | C32: 2 | D32: 1
A33: 32 | B33: French fries | C33: 2 | D33: 5
A34: 33 | B34: Green tea | C34: 3 | D34: 0
A35: 34 | B35: Black tea | C35: 3 | D35: 0
A36: 35 | B36: Coffee | C36: 3 | D36: 0
A37: 36 | B37: Coke | C37: 3 | D37: 0
A38: 37 | B38: Beer | C38: 3 | D38: 0
A39: 38 | B39: Oolong tea | C39: 3 | D39: 0
A40: 39 | B40: Ginger ale | C40: 3 | D40: 0
A41: 40 | B41: Chicken wings | C41: 3 | D41: 0
A42: 41 | B42: Garlic bread | C42: 3 | D42: 0
A43: 42 | B43: Fries | C43: 3 | D43: 0

Sheet: menus
A1: id | B1: menu_name | C1: menu_type_cd | D1: provide_cd | E1: menu_price | F1: menu_overview
A2: 1 | B2: Margherita Small | C2: 1 | D2: 1 | E2: 10
A3: 2 | B3: Margherita Medium | C3: 1 | D3: 1 | E3: 12
A4: 3 | B4: Margherita Large | C4: 1 | D4: 1 | E4: 14
A5: 4 | B5: Margherita Extra Large | C5: 1 | D5: 1 | E5: 16
A6: 5 | B6: Marinara Small | C6: 1 | D6: 1 | E6: 10
A7: 6 | B7: Marinara Medium | C7: 1 | D7: 1 | E7: 12
A8: 7 | B8: Marinara Large | C8: 1 | D8: 1 | E8: 14
A9: 8 | B9: Marinara Extra Large | C9: 1 | D9: 1 | E9: 16
A10: 9 | B10: Quattro Formaggi Small | C10: 1 | D10: 1 | E10: 10
A11: 10 | B11: Quattro Formaggi Medium | C11: 1 | D11: 1 | E11: 12
A12: 11 | B12: Quattro Formaggi Large | C12: 1 | D12: 1 | E12: 14
A13: 12 | B13: Quattro Formaggi Extra Large | C13: 1 | D13: 1 | E13: 16
A14: 13 | B14: Boscaiola Small | C14: 1 | D14: 1 | E14: 12
A15: 14 | B15: Boscaiola Medium | C15: 1 | D15: 1 | E15: 14
A16: 15 | B16: Boscaiola Large | C16: 1 | D16: 1 | E16: 16
A17: 16 | B17: Boscaiola Extra Large | C17: 1 | D17: 1 | E17: 18
A18: 17 | B18: Siciliana Small | C18: 1 | D18: 1 | E18: 10
A19: 18 | B19: Siciliana Medium | C19: 1 | D19: 1 | E19: 12
A20: 19 | B20: Siciliana Large | C20: 1 | D20: 1 | E20: 14
A21: 20 | B21: Siciliana Extra Large | C21: 1 | D21: 1 | E21: 16
A22: 21 | B22: Pescatore Small | C22: 1 | D22: 1 | E22: 12
A23: 22 | B23: Pescatore Medium | C23: 1 | D23: 1 | E23: 14
A24: 23 | B24: Pescatore Large | C24: 1 | D24: 1 | E24: 16
A25: 24 | B25: Pescatore Extra Large | C25: 1 | D25: 1 | E25: 18
A26: 25 | B26: Genovese Small | C26: 1 | D26: 1 | E26: 10
A27: 26 | B27: Genovese Medium | C27: 1 | D27: 1 | E27: 12
A28: 27 | B28: Genovese Large | C28: 1 | D28: 1 | E28: 14
A29: 28 | B29: Genovese Extra Large | C29: 1 | D29: 1 | E29: 16
A30: 29 | B30: Chicken wings | C30: 1 | D30: 1 | E30: 5
A31: 30 | B31: Garlic bread | C31: 1 | D31: 1 | E31: 5
A32: 31 | B32: Side salad | C32: 1 | D32: 1 | E32: 5
A33: 32 | B33: French fries | C33: 1 | D33: 1 | E33: 5
A34: 33 | B34: Green tea | C34: 1 | D34: 1 | E34: 2
A35: 34 | B35: Black tea | C35: 1 | D35: 1 | E35: 2
A36: 35 | B36: Coffee | C36: 1 | D36: 1 | E36: 2
A37: 36 | B37: Coke | C37: 1 | D37: 1 | E37: 2
A38: 37 | B38: Beer | C38: 1 | D38: 1 | E38: 3
A39: 38 | B39: Oolong tea | C39: 1 | D39: 1 | E39: 2
A40: 39 | B40: Ginger ale | C40: 1 | D40: 1 | E40: 2
A41: 40 | B41: Chicken wings | C41: 1 | D41: 1 | E41: 2
A42: 41 | B42: Garlic bread | C42: 1 | D42: 1 | E42: 2
A43: 42 | B43: Fries | C43: 1 | D43: 1 | E43: 2
A44: 43 | B44: Pepperoni | C44: 2 | D44: 1 | E44: 1
A45: 44 | B45: Mushrooms | C45: 2 | D45: 1 | E45: 1
A46: 45 | B46: Bell peppers | C46: 2 | D46: 1 | E46: 1
A47: 46 | B47: Onions | C47: 2 | D47: 1 | E47: 1
A48: 47 | B48: Olives | C48: 2 | D48: 1 | E48: 1
A49: 48 | B49: Sausage | C49: 2 | D49: 1 | E49: 1
A50: 49 | B50: Monterey Jack cheese | C50: 2 | D50: 1 | E50: 1
A51: 50 | B51: Cheddar cheese | C51: 2 | D51: 1 | E51: 1
A52: 51 | B52: Tomatoes | C52: 2 | D52: 1 | E52: 1
A53: 52 | B53: Bacon | C53: 2 | D53: 1 | E53: 1

Sheet: menu_products
A1: id | B1: menu_id | C1: product_id | D1: display_order
A2: 1 | B2: 1 | C2: 1 | D2: 1
A3: 2 | B3: 2 | C3: 2 | D3: 2
A4: 3 | B4: 3 | C4: 3 | D4: 3
A5: 4 | B5: 4 | C5: 4 | D5: 4
A6: 5 | B6: 5 | C6: 5 | D6: 5
A7: 6 | B7: 6 | C7: 6 | D7: 6
A8: 7 | B8: 7 | C8: 7 | D8: 7
A9: 8 | B9: 8 | C9: 8 | D9: 8
A10: 9 | B10: 9 | C10: 9 | D10: 9
A11: 10 | B11: 10 | C11: 10 | D11: 10
A12: 11 | B12: 11 | C12: 11 | D12: 11
A13: 12 | B13: 12 | C13: 12 | D13: 12
A14: 13 | B14: 13 | C14: 13 | D14: 13
A15: 14 | B15: 14 | C15: 14 | D15: 14
A16: 15 | B16: 15 | C16: 15 | D16: 15
A17: 16 | B17: 16 | C17: 16 | D17: 16
A18: 17 | B18: 17 | C18: 17 | D18: 17
A19: 18 | B19: 18 | C19: 18 | D19: 18
A20: 19 | B20: 19 | C20: 19 | D20: 19
A21: 20 | B21: 20 | C21: 20 | D21: 20
A22: 21 | B22: 21 | C22: 21 | D22: 21
A23: 22 | B23: 22 | C23: 22 | D23: 22
A24: 23 | B24: 23 | C24: 23 | D24: 23
A25: 24 | B25: 24 | C25: 24 | D25: 24
A26: 25 | B26: 25 | C26: 25 | D26: 25
A27: 26 | B27: 26 | C27: 26 | D27: 26
A28: 27 | B28: 27 | C28: 27 | D28: 27
A29: 28 | B29: 28 | C29: 28 | D29: 28
A30: 29 | B30: 29 | C30: 29 | D30: 29
A31: 30 | B31: 30 | C31: 30 | D31: 30
A32: 31 | B32: 31 | C32: 31 | D32: 31
A33: 32 | B33: 32 | C33: 32 | D33: 32
A34: 33 | B34: 33 | C34: 33 | D34: 33
A35: 34 | B35: 34 | C35: 34 | D35: 34
A36: 35 | B36: 35 | C36: 35 | D36: 35
A37: 36 | B37: 36 | C37: 36 | D37: 36
A38: 37 | B38: 37 | C38: 37 | D38: 37
A39: 38 | B39: 38 | C39: 38 | D39: 38
A40: 39 | B40: 39 | C40: 39 | D40: 39
A41: 40 | B41: 40 | C41: 40 | D41: 40
A42: 41 | B42: 41 | C42: 41 | D42: 41
A43: 42 | B43: 42 | C43: 42 | D43: 42

Sheet: shifts
A1: id | B1: staff_id | C1: shift_start_datetime | D1: shift_end_datetime | E1: shift_status_cd | F1: shift_comment | L1: 2024-09-01T00:00:00.000 | M1: =RC[-1]+1 -> 2024-09-02T00:00:00.000 | N1: =RC[-1]+1 -> 2024-09-03T00:00:00.000 | O1: =RC[-1]+1 -> 2024-09-04T00:00:00.000 | P1: =RC[-1]+1 -> 2024-09-05T00:00:00.000 | Q1: =RC[-1]+1 -> 2024-09-06T00:00:00.000 | R1: =RC[-1]+1 -> 2024-09-07T00:00:00.000 | S1: =RC[-1]+1 -> 2024-09-08T00:00:00.000 | T1: =RC[-1]+1 -> 2024-09-09T00:00:00.000 | U1: =RC[-1]+1 -> 2024-09-10T00:00:00.000 | V1: =RC[-1]+1 -> 2024-09-11T00:00:00.000 | W1: =RC[-1]+1 -> 2024-09-12T00:00:00.000 | X1: =RC[-1]+1 -> 2024-09-13T00:00:00.000 | Y1: =RC[-1]+1 -> 2024-09-14T00:00:00.000 | Z1: =RC[-1]+1 -> 2024-09-15T00:00:00.000 | AA1: =RC[-1]+1 -> 2024-09-16T00:00:00.000 | AB1: =RC[-1]+1 -> 2024-09-17T00:00:00.000 | AC1: =RC[-1]+1 -> 2024-09-18T00:00:00.000 | AD1: =RC[-1]+1 -> 2024-09-19T00:00:00.000 | AE1: =RC[-1]+1 -> 2024-09-20T00:00:00.000 | AF1: =RC[-1]+1 -> 2024-09-21T00:00:00.000 | AG1: =RC[-1]+1 -> 2024-09-22T00:00:00.000 | AH1: =RC[-1]+1 -> 2024-09-23T00:00:00.000 | AI1: =RC[-1]+1 -> 2024-09-24T00:00:00.000 | AJ1: =RC[-1]+1 -> 2024-09-25T00:00:00.000 | AK1: =RC[-1]+1 -> 2024-09-26T00:00:00.000 | AL1: =RC[-1]+1 -> 2024-09-27T00:00:00.000 | AM1: =RC[-1]+1 -> 2024-09-28T00:00:00.000 | AN1: =RC[-1]+1 -> 2024-09-29T00:00:00.000 | AO1: =RC[-1]+1 -> 2024-09-30T00:00:00.000 | AP1: =RC[-1]+1 -> 2024-10-01T00:00:00.000 | AQ1: =RC[-1]+1 -> 2024-10-02T00:00:00.000 | AR1: =RC[-1]+1 -> 2024-10-03T00:00:00.000 | AS1: =RC[-1]+1 -> 2024-10-04T00:00:00.000 | AT1: =RC[-1]+1 -> 2024-10-05T00:00:00.000 | AU1: =RC[-1]+1 -> 2024-10-06T00:00:00.000 | AV1: =RC[-1]+1 -> 2024-10-07T00:00:00.000 | AW1: =RC[-1]+1 -> 2024-10-08T00:00:00.000 | AX1: =RC[-1]+1 -> 2024-10-09T00:00:00.000 | AY1: =RC[-1]+1 -> 2024-10-10T00:00:00.000 | AZ1: =RC[-1]+1 -> 2024-10-11T00:00:00.000 | BA1: =RC[-1]+1 -> 2024-10-12T00:00:00.000 | BB1: =RC[-1]+1 -> 2024-10-13T00:00:00.000 | BC1: =RC[-1]+1 -> 2024-10-14T00:00:00.000 | BD1: =RC[-1]+1 -> 2024-10-15T00:00:00.000 | BE1: =RC[-1]+1 -> 2024-10-16T00:00:00.000 | BF1: =RC[-1]+1 -> 2024-10-17T00:00:00.000 | BG1: =RC[-1]+1 -> 2024-10-18T00:00:00.000 | BH1: =RC[-1]+1 -> 2024-10-19T00:00:00.000 | BI1: =RC[-1]+1 -> 2024-10-20T00:00:00.000 | BJ1: =RC[-1]+1 -> 2024-10-21T00:00:00.000 | BK1: =RC[-1]+1 -> 2024-10-22T00:00:00.000 | BL1: =RC[-1]+1 -> 2024-10-23T00:00:00.000 | BM1: =RC[-1]+1 -> 2024-10-24T00:00:00.000 | BN1: =RC[-1]+1 -> 2024-10-25T00:00:00.000 | BO1: =RC[-1]+1 -> 2024-10-26T00:00:00.000 | BP1: =RC[-1]+1 -> 2024-10-27T00:00:00.000 | BQ1: =RC[-1]+1 -> 2024-10-28T00:00:00.000 | BR1: =RC[-1]+1 -> 2024-10-29T00:00:00.000 | BS1: =RC[-1]+1 -> 2024-10-30T00:00:00.000 | BT1: =RC[-1]+1 -> 2024-10-31T00:00:00.000 | BU1: =RC[-1]+1 -> 2024-11-01T00:00:00.000 | BV1: =RC[-1]+1 -> 2024-11-02T00:00:00.000 | BW1: =RC[-1]+1 -> 2024-11-03T00:00:00.000 | BX1: =RC[-1]+1 -> 2024-11-04T00:00:00.000 | BY1: =RC[-1]+1 -> 2024-11-05T00:00:00.000 | BZ1: =RC[-1]+1 -> 2024-11-06T00:00:00.000 | CA1: =RC[-1]+1 -> 2024-11-07T00:00:00.000 | CB1: =RC[-1]+1 -> 2024-11-08T00:00:00.000 | CC1: =RC[-1]+1 -> 2024-11-09T00:00:00.000 | CD1: =RC[-1]+1 -> 2024-11-10T00:00:00.000 | CE1: =RC[-1]+1 -> 2024-11-11T00:00:00.000 | CF1: =RC[-1]+1 -> 2024-11-12T00:00:00.000 | CG1: =RC[-1]+1 -> 2024-11-13T00:00:00.000 | CH1: =RC[-1]+1 -> 2024-11-14T00:00:00.000 | CI1: =RC[-1]+1 -> 2024-11-15T00:00:00.000 | CJ1: =RC[-1]+1 -> 2024-11-16T00:00:00.000 | CK1: =RC[-1]+1 -> 2024-11-17T00:00:00.000 | CL1: =RC[-1]+1 -> 2024-11-18T00:00:00.000 | CM1: =RC[-1]+1 -> 2024-11-19T00:00:00.000 | CN1: =RC[-1]+1 -> 2024-11-20T00:00:00.000 | CO1: =RC[-1]+1 -> 2024-11-21T00:00:00.000 | CP1: =RC[-1]+1 -> 2024-11-22T00:00:00.000 | CQ1: =RC[-1]+1 -> 2024-11-23T00:00:00.000 | CR1: =RC[-1]+1 -> 2024-11-24T00:00:00.000 | CS1: =RC[-1]+1 -> 2024-11-25T00:00:00.000 | CT1: =RC[-1]+1 -> 2024-11-26T00:00:00.000 | CU1: =RC[-1]+1 -> 2024-11-27T00:00:00.000 | CV1: =RC[-1]+1 -> 2024-11-28T00:00:00.000 | CW1: =RC[-1]+1 -> 2024-11-29T00:00:00.000 | CX1: =RC[-1]+1 -> 2024-11-30T00:00:00.000 | CY1: =RC[-1]+1 -> 2024-12-01T00:00:00.000 | CZ1: =RC[-1]+1 -> 2024-12-02T00:00:00.000 | DA1: =RC[-1]+1 -> 2024-12-03T00:00:00.000 | DB1: =RC[-1]+1 -> 2024-12-04T00:00:00.000 | DC1: =RC[-1]+1 -> 2024-12-05T00:00:00.000 | DD1: =RC[-1]+1 -> 2024-12-06T00:00:00.000 | DE1: =RC[-1]+1 -> 2024-12-07T00:00:00.000 | DF1: =RC[-1]+1 -> 2024-12-08T00:00:00.000 | DG1: =RC[-1]+1 -> 2024-12-09T00:00:00.000 | DH1: =RC[-1]+1 -> 2024-12-10T00:00:00.000 | DI1: =RC[-1]+1 -> 2024-12-11T00:00:00.000 | DJ1: =RC[-1]+1 -> 2024-12-12T00:00:00.000 | DK1: =RC[-1]+1 -> 2024-12-13T00:00:00.000 | DL1: =RC[-1]+1 -> 2024-12-14T00:00:00.000 | DM1: =RC[-1]+1 -> 2024-12-15T00:00:00.000 | DN1: =RC[-1]+1 -> 2024-12-16T00:00:00.000 | DO1: =RC[-1]+1 -> 2024-12-17T00:00:00.000 | DP1: =RC[-1]+1 -> 2024-12-18T00:00:00.000 | DQ1: =RC[-1]+1 -> 2024-12-19T00:00:00.000 | DR1: =RC[-1]+1 -> 2024-12-20T00:00:00.000 | DS1: =RC[-1]+1 -> 2024-12-21T00:00:00.000 | DT1: =RC[-1]+1 -> 2024-12-22T00:00:00.000 | DU1: =RC[-1]+1 -> 2024-12-23T00:00:00.000 | DV1: =RC[-1]+1 -> 2024-12-24T00:00:00.000 | DW1: =RC[-1]+1 -> 2024-12-25T00:00:00.000 | DX1: =RC[-1]+1 -> 2024-12-26T00:00:00.000 | DY1: =RC[-1]+1 -> 2024-12-27T00:00:00.000 | DZ1: =RC[-1]+1 -> 2024-12-28T00:00:00.000 | EA1: =RC[-1]+1 -> 2024-12-29T00:00:00.000 | EB1: =RC[-1]+1 -> 2024-12-30T00:00:00.000 | EC1: =RC[-1]+1 -> 2024-12-31T00:00:00.000 | ED1: =RC[-1]+1 -> 2025-01-01T00:00:00.000 | EE1: =RC[-1]+1 -> 2025-01-02T00:00:00.000 | EF1: =RC[-1]+1 -> 2025-01-03T00:00:00.000 | EG1: =RC[-1]+1 -> 2025-01-04T00:00:00.000 | EH1: =RC[-1]+1 -> 2025-01-05T00:00:00.000 | EI1: =RC[-1]+1 -> 2025-01-06T00:00:00.000 | EJ1: =RC[-1]+1 -> 2025-01-07T00:00:00.000 | EK1: =RC[-1]+1 -> 2025-01-08T00:00:00.000 | EL1: =RC[-1]+1 -> 2025-01-09T00:00:00.000 | EM1: =RC[-1]+1 -> 2025-01-10T00:00:00.000 | EN1: =RC[-1]+1 -> 2025-01-11T00:00:00.000 | EO1: =RC[-1]+1 -> 2025-01-12T00:00:00.000 | EP1: =RC[-1]+1 -> 2025-01-13T00:00:00.000 | EQ1: =RC[-1]+1 -> 2025-01-14T00:00:00.000 | ER1: =RC[-1]+1 -> 2025-01-15T00:00:00.000 | ES1: =RC[-1]+1 -> 2025-01-16T00:00:00.000 | ET1: =RC[-1]+1 -> 2025-01-17T00:00:00.000 | EU1: =RC[-1]+1 -> 2025-01-18T00:00:00.000 | EV1: =RC[-1]+1 -> 2025-01-19T00:00:00.000 | EW1: =RC[-1]+1 -> 2025-01-20T00:00:00.000 | EX1: =RC[-1]+1 -> 2025-01-21T00:00:00.000 | EY1: =RC[-1]+1 -> 2025-01-22T00:00:00.000 | EZ1: =RC[-1]+1 -> 2025-01-23T00:00:00.000 | FA1: =RC[-1]+1 -> 2025-01-24T00:00:00.000 | FB1: =RC[-1]+1 -> 2025-01-25T00:00:00.000 | FC1: =RC[-1]+1 -> 2025-01-26T00:00:00.000 | FD1: =RC[-1]+1 -> 2025-01-27T00:00:00.000 | FE1: =RC[-1]+1 -> 2025-01-28T00:00:00.000 | FF1: =RC[-1]+1 -> 2025-01-29T00:00:00.000 | FG1: =RC[-1]+1 -> 2025-01-30T00:00:00.000 | FH1: =RC[-1]+1 -> 2025-01-31T00:00:00.000 | FI1: =RC[-1]+1 -> 2025-02-01T00:00:00.000 | FJ1: =RC[-1]+1 -> 2025-02-02T00:00:00.000 | FK1: =RC[-1]+1 -> 2025-02-03T00:00:00.000 | FL1: =RC[-1]+1 -> 2025-02-04T00:00:00.000 | FM1: =RC[-1]+1 -> 2025-02-05T00:00:00.000 | FN1: =RC[-1]+1 -> 2025-02-06T00:00:00.000 | FO1: =RC[-1]+1 -> 2025-02-07T00:00:00.000 | FP1: =RC[-1]+1 -> 2025-02-08T00:00:00.000 | FQ1: =RC[-1]+1 -> 2025-02-09T00:00:00.000 | FR1: =RC[-1]+1 -> 2025-02-10T00:00:00.000 | FS1: =RC[-1]+1 -> 2025-02-11T00:00:00.000 | FT1: =RC[-1]+1 -> 2025-02-12T00:00:00.000 | FU1: =RC[-1]+1 -> 2025-02-13T00:00:00.000 | FV1: =RC[-1]+1 -> 2025-02-14T00:00:00.000 | FW1: =RC[-1]+1 -> 2025-02-15T00:00:00.000 | FX1: =RC[-1]+1 -> 2025-02-16T00:00:00.000 | FY1: =RC[-1]+1 -> 2025-02-17T00:00:00.000 | FZ1: =RC[-1]+1 -> 2025-02-18T00:00:00.000 | GA1: =RC[-1]+1 -> 2025-02-19T00:00:00.000 | GB1: =RC[-1]+1 -> 2025-02-20T00:00:00.000 | GC1: =RC[-1]+1 -> 2025-02-21T00:00:00.000 | GD1: =RC[-1]+1 -> 2025-02-22T00:00:00.000 | GE1: =RC[-1]+1 -> 2025-02-23T00:00:00.000 | GF1: =RC[-1]+1 -> 2025-02-24T00:00:00.000 | GG1: =RC[-1]+1 -> 2025-02-25T00:00:00.000 | GH1: =RC[-1]+1 -> 2025-02-26T00:00:00.000 | GI1: =RC[-1]+1 -> 2025-02-27T00:00:00.000 | GJ1: =RC[-1]+1 -> 2025-02-28T00:00:00.000 | GK1: =RC[-1]+1 -> 2025-03-01T00:00:00.000 | GL1: =RC[-1]+1 -> 2025-03-02T00:00:00.000 | GM1: =RC[-1]+1 -> 2025-03-03T00:00:00.000 | GN1: =RC[-1]+1 -> 2025-03-04T00:00:00.000 | GO1: =RC[-1]+1 -> 2025-03-05T00:00:00.000 | GP1: =RC[-1]+1 -> 2025-03-06T00:00:00.000 | GQ1: =RC[-1]+1 -> 2025-03-07T00:00:00.000 | GR1: =RC[-1]+1 -> 2025-03-08T00:00:00.000 | GS1: =RC[-1]+1 -> 2025-03-09T00:00:00.000 | GT1: =RC[-1]+1 -> 2025-03-10T00:00:00.000 | GU1: =RC[-1]+1 -> 2025-03-11T00:00:00.000 | GV1: =RC[-1]+1 -> 2025-03-12T00:00:00.000 | GW1: =RC[-1]+1 -> 2025-03-13T00:00:00.000 | GX1: =RC[-1]+1 -> 2025-03-14T00:00:00.000 | GY1: =RC[-1]+1 -> 2025-03-15T00:00:00.000 | GZ1: =RC[-1]+1 -> 2025-03-16T00:00:00.000 | HA1: =RC[-1]+1 -> 2025-03-17T00:00:00.000 | HB1: =RC[-1]+1 -> 2025-03-18T00:00:00.000 | HC1: =RC[-1]+1 -> 2025-03-19T00:00:00.000 | HD1: =RC[-1]+1 -> 2025-03-20T00:00:00.000 | HE1: =RC[-1]+1 -> 2025-03-21T00:00:00.000 | HF1: =RC[-1]+1 -> 2025-03-22T00:00:00.000 | HG1: =RC[-1]+1 -> 2025-03-23T00:00:00.000 | HH1: =RC[-1]+1 -> 2025-03-24T00:00:00.000 | HI1: =RC[-1]+1 -> 2025-03-25T00:00:00.000 | HJ1: =RC[-1]+1 -> 2025-03-26T00:00:00.000 | HK1: =RC[-1]+1 -> 2025-03-27T00:00:00.000 | HL1: =RC[-1]+1 -> 2025-03-28T00:00:00.000 | HM1: =RC[-1]+1 -> 2025-03-29T00:00:00.000 | HN1: =RC[-1]+1 -> 2025-03-30T00:00:00.000 | HO1: =RC[-1]+1 -> 2025-03-31T00:00:00.000 | HP1: =RC[-1]+1 -> 2025-04-01T00:00:00.000 | HQ1: =RC[-1]+1 -> 2025-04-02T00:00:00.000 | HR1: =RC[-1]+1 -> 2025-04-03T00:00:00.000 | HS1: =RC[-1]+1 -> 2025-04-04T00:00:00.000 | HT1: =RC[-1]+1 -> 2025-04-05T00:00:00.000 | HU1: =RC[-1]+1 -> 2025-04-06T00:00:00.000 | HV1: =RC[-1]+1 -> 2025-04-07T00:00:00.000 | HW1: =RC[-1]+1 -> 2025-04-08T00:00:00.000 | HX1: =RC[-1]+1 -> 2025-04-09T00:00:00.000 | HY1: =RC[-1]+1 -> 2025-04-10T00:00:00.000 | HZ1: =RC[-1]+1 -> 2025-04-11T00:00:00.000 | IA1: =RC[-1]+1 -> 2025-04-12T00:00:00.000 | IB1: =RC[-1]+1 -> 2025-04-13T00:00:00.000 | IC1: =RC[-1]+1 -> 2025-04-14T00:00:00.000 | ID1: =RC[-1]+1 -> 2025-04-15T00:00:00.000 | IE1: =RC[-1]+1 -> 2025-04-16T00:00:00.000 | IF1: =RC[-1]+1 -> 2025-04-17T00:00:00.000 | IG1: =RC[-1]+1 -> 2025-04-18T00:00:00.000 | IH1: =RC[-1]+1 -> 2025-04-19T00:00:00.000 | II1: =RC[-1]+1 -> 2025-04-20T00:00:00.000 | IJ1: =RC[-1]+1 -> 2025-04-21T00:00:00.000 | IK1: =RC[-1]+1 -> 2025-04-22T00:00:00.000 | IL1: =RC[-1]+1 -> 2025-04-23T00:00:00.000 | IM1: =RC[-1]+1 -> 2025-04-24T00:00:00.000 | IN1: =RC[-1]+1 -> 2025-04-25T00:00:00.000 | IO1: =RC[-1]+1 -> 2025-04-26T00:00:00.000 | IP1: =RC[-1]+1 -> 2025-04-27T00:00:00.000 | IQ1: =RC[-1]+1 -> 2025-04-28T00:00:00.000 | IR1: =RC[-1]+1 -> 2025-04-29T00:00:00.000 | IS1: =RC[-1]+1 -> 2025-04-30T00:00:00.000 | IT1: =RC[-1]+1 -> 2025-05-01T00:00:00.000 | IU1: =RC[-1]+1 -> 2025-05-02T00:00:00.000 | IV1: =RC[-1]+1 -> 2025-05-03T00:00:00.000 | IW1: =RC[-1]+1 -> 2025-05-04T00:00:00.000 | IX1: =RC[-1]+1 -> 2025-05-05T00:00:00.000 | IY1: =RC[-1]+1 -> 2025-05-06T00:00:00.000 | IZ1: =RC[-1]+1 -> 2025-05-07T00:00:00.000 | JA1: =RC[-1]+1 -> 2025-05-08T00:00:00.000 | JB1: =RC[-1]+1 -> 2025-05-09T00:00:00.000 | JC1: =RC[-1]+1 -> 2025-05-10T00:00:00.000 | JD1: =RC[-1]+1 -> 2025-05-11T00:00:00.000 | JE1: =RC[-1]+1 -> 2025-05-12T00:00:00.000 | JF1: =RC[-1]+1 -> 2025-05-13T00:00:00.000 | JG1: =RC[-1]+1 -> 2025-05-14T00:00:00.000 | JH1: =RC[-1]+1 -> 2025-05-15T00:00:00.000 | JI1: =RC[-1]+1 -> 2025-05-16T00:00:00.000 | JJ1: =RC[-1]+1 -> 2025-05-17T00:00:00.000 | JK1: =RC[-1]+1 -> 2025-05-18T00:00:00.000 | JL1: =RC[-1]+1 -> 2025-05-19T00:00:00.000 | JM1: =RC[-1]+1 -> 2025-05-20T00:00:00.000 | JN1: =RC[-1]+1 -> 2025-05-21T00:00:00.000 | JO1: =RC[-1]+1 -> 2025-05-22T00:00:00.000 | JP1: =RC[-1]+1 -> 2025-05-23T00:00:00.000 | JQ1: =RC[-1]+1 -> 2025-05-24T00:00:00.000 | JR1: =RC[-1]+1 -> 2025-05-25T00:00:00.000 | JS1: =RC[-1]+1 -> 2025-05-26T00:00:00.000 | JT1: =RC[-1]+1 -> 2025-05-27T00:00:00.000 | JU1: =RC[-1]+1 -> 2025-05-28T00:00:00.000 | JV1: =RC[-1]+1 -> 2025-05-29T00:00:00.000 | JW1: =RC[-1]+1 -> 2025-05-30T00:00:00.000 | JX1: =RC[-1]+1 -> 2025-05-31T00:00:00.000 | JY1: =RC[-1]+1 -> 2025-06-01T00:00:00.000 | JZ1: =RC[-1]+1 -> 2025-06-02T00:00:00.000 | KA1: =RC[-1]+1 -> 2025-06-03T00:00:00.000 | KB1: =RC[-1]+1 -> 2025-06-04T00:00:00.000 | KC1: =RC[-1]+1 -> 2025-06-05T00:00:00.000 | KD1: =RC[-1]+1 -> 2025-06-06T00:00:00.000 | KE1: =RC[-1]+1 -> 2025-06-07T00:00:00.000 | KF1: =RC[-1]+1 -> 2025-06-08T00:00:00.000 | KG1: =RC[-1]+1 -> 2025-06-09T00:00:00.000 | KH1: =RC[-1]+1 -> 2025-06-10T00:00:00.000 | KI1: =RC[-1]+1 -> 2025-06-11T00:00:00.000 | KJ1: =RC[-1]+1 -> 2025-06-12T00:00:00.000 | KK1: =RC[-1]+1 -> 2025-06-13T00:00:00.000 | KL1: =RC[-1]+1 -> 2025-06-14T00:00:00.000 | KM1: =RC[-1]+1 -> 2025-06-15T00:00:00.000 | KN1: =RC[-1]+1 -> 2025-06-16T00:00:00.000 | KO1: =RC[-1]+1 -> 2025-06-17T00:00:00.000 | KP1: =RC[-1]+1 -> 2025-06-18T00:00:00.000 | KQ1: =RC[-1]+1 -> 2025-06-19T00:00:00.000 | KR1: =RC[-1]+1 -> 2025-06-20T00:00:00.000 | KS1: =RC[-1]+1 -> 2025-06-21T00:00:00.000 | KT1: =RC[-1]+1 -> 2025-06-22T00:00:00.000 | KU1: =RC[-1]+1 -> 2025-06-23T00:00:00.000 | KV1: =RC[-1]+1 -> 2025-06-24T00:00:00.000 | KW1: =RC[-1]+1 -> 2025-06-25T00:00:00.000 | KX1: =RC[-1]+1 -> 2025-06-26T00:00:00.000 | KY1: =RC[-1]+1 -> 2025-06-27T00:00:00.000 | KZ1: =RC[-1]+1 -> 2025-06-28T00:00:00.000 | LA1: =RC[-1]+1 -> 2025-06-29T00:00:00.000 | LB1: =RC[-1]+1 -> 2025-06-30T00:00:00.000 | LC1: =RC[-1]+1 -> 2025-07-01T00:00:00.000 | LD1: =RC[-1]+1 -> 2025-07-02T00:00:00.000 | LE1: =RC[-1]+1 -> 2025-07-03T00:00:00.000 | LF1: =RC[-1]+1 -> 2025-07-04T00:00:00.000 | LG1: =RC[-1]+1 -> 2025-07-05T00:00:00.000 | LH1: =RC[-1]+1 -> 2025-07-06T00:00:00.000 | LI1: =RC[-1]+1 -> 2025-07-07T00:00:00.000 | LJ1: =RC[-1]+1 -> 2025-07-08T00:00:00.000 | LK1: =RC[-1]+1 -> 2025-07-09T00:00:00.000 | LL1: =RC[-1]+1 -> 2025-07-10T00:00:00.000 | LM1: =RC[-1]+1 -> 2025-07-11T00:00:00.000 | LN1: =RC[-1]+1 -> 2025-07-12T00:00:00.000 | LO1: =RC[-1]+1 -> 2025-07-13T00:00:00.000 | LP1: =RC[-1]+1 -> 2025-07-14T00:00:00.000 | LQ1: =RC[-1]+1 -> 2025-07-15T00:00:00.000 | LR1: =RC[-1]+1 -> 2025-07-16T00:00:00.000 | LS1: =RC[-1]+1 -> 2025-07-17T00:00:00.000 | LT1: =RC[-1]+1 -> 2025-07-18T00:00:00.000 | LU1: =RC[-1]+1 -> 2025-07-19T00:00:00.000 | LV1: =RC[-1]+1 -> 2025-07-20T00:00:00.000 | LW1: =RC[-1]+1 -> 2025-07-21T00:00:00.000 | LX1: =RC[-1]+1 -> 2025-07-22T00:00:00.000 | LY1: =RC[-1]+1 -> 2025-07-23T00:00:00.000 | LZ1: =RC[-1]+1 -> 2025-07-24T00:00:00.000 | MA1: =RC[-1]+1 -> 2025-07-25T00:00:00.000 | MB1: =RC[-1]+1 -> 2025-07-26T00:00:00.000 | MC1: =RC[-1]+1 -> 2025-07-27T00:00:00.000 | MD1: =RC[-1]+1 -> 2025-07-28T00:00:00.000 | ME1: =RC[-1]+1 -> 2025-07-29T00:00:00.000 | MF1: =RC[-1]+1 -> 2025-07-30T00:00:00.000 | MG1: =RC[-1]+1 -> 2025-07-31T00:00:00.000 | MH1: =RC[-1]+1 -> 2025-08-01T00:00:00.000 | MI1: =RC[-1]+1 -> 2025-08-02T00:00:00.000 | MJ1: =RC[-1]+1 -> 2025-08-03T00:00:00.000 | MK1: =RC[-1]+1 -> 2025-08-04T00:00:00.000 | ML1: =RC[-1]+1 -> 2025-08-05T00:00:00.000 | MM1: =RC[-1]+1 -> 2025-08-06T00:00:00.000 | MN1: =RC[-1]+1 -> 2025-08-07T00:00:00.000 | MO1: =RC[-1]+1 -> 2025-08-08T00:00:00.000 | MP1: =RC[-1]+1 -> 2025-08-09T00:00:00.000 | MQ1: =RC[-1]+1 -> 2025-08-10T00:00:00.000 | MR1: =RC[-1]+1 -> 2025-08-11T00:00:00.000 | MS1: =RC[-1]+1 -> 2025-08-12T00:00:00.000 | MT1: =RC[-1]+1 -> 2025-08-13T00:00:00.000 | MU1: =RC[-1]+1 -> 2025-08-14T00:00:00.000 | MV1: =RC[-1]+1 -> 2025-08-15T00:00:00.000 | MW1: =RC[-1]+1 -> 2025-08-16T00:00:00.000 | MX1: =RC[-1]+1 -> 2025-08-17T00:00:00.000 | MY1: =RC[-1]+1 -> 2025-08-18T00:00:00.000 | MZ1: =RC[-1]+1 -> 2025-08-19T00:00:00.000 | NA1: =RC[-1]+1 -> 2025-08-20T00:00:00.000 | NB1: =RC[-1]+1 -> 2025-08-21T00:00:00.000 | NC1: =RC[-1]+1 -> 2025-08-22T00:00:00.000 | ND1: =RC[-1]+1 -> 2025-08-23T00:00:00.000 | NE1: =RC[-1]+1 -> 2025-08-24T00:00:00.000 | NF1: =RC[-1]+1 -> 2025-08-25T00:00:00.000 | NG1: =RC[-1]+1 -> 2025-08-26T00:00:00.000 | NH1: =RC[-1]+1 -> 2025-08-27T00:00:00.000 | NI1: =RC[-1]+1 -> 2025-08-28T00:00:00.000 | NJ1: =RC[-1]+1 -> 2025-08-29T00:00:00.000 | NK1: =RC[-1]+1 -> 2025-08-30T00:00:00.000 | NL1: =RC[-1]+1 -> 2025-08-31T00:00:00.000 | NM1: =RC[-1]+1 -> 2025-09-01T00:00:00.000
A2: 1 | B2: 1 | C2: 2024-09-01T16:00:00.000 | D2: 2024-09-02T00:00:00.000 | H2: =VLOOKUP(RC[-6],staffs!C[-7]:C[-5],3,FALSE) -> John | I2: =(RC[-5]-RC[-6])*(24)-1 -> 7.0000000000582077 | J2: =WEEKDAY(RC[-7],1) -> 1
A3: 2 | B3: 3 | C3: 2024-09-01T09:00:00.000 | D3: 2024-09-01T17:00:00.000 | H3: =VLOOKUP(RC[-6],staffs!C[-7]:C[-5],3,FALSE) -> William | I3: =(RC[-5]-RC[-6])*(24)-1 -> 7.0000000000582077 | J3: =WEEKDAY(RC[-7],1) -> 1
A4: 3 | B4: 4 | C4: 2024-09-01T16:00:00.000 | D4: 2024-09-02T00:00:00.000 | H4: =VLOOKUP(RC[-6],staffs!C[-7]:C[-5],3,FALSE) -> Liam | I4: =(RC[-5]-RC[-6])*(24)-1 -> 7.0000000000582077 | J4: =WEEKDAY(RC[-7],1) -> 1
A5: 4 | B5: 5 | C5: 2024-09-01T09:00:00.000 | D5: 2024-09-01T17:00:00.000 | H5: =VLOOKUP(RC[-6],staffs!C[-7]:C[-5],3,FALSE) -> Oliver | I5: =(RC[-5]-RC[-6])*(24)-1 -> 7.0000000000582077 | J5: =WEEKDAY(RC[-7],1) -> 1
A6: 5 | B6: 2 | C6: 2024-09-01T10:00:00.000 | D6: 2024-09-01T17:00:00.000 | H6: =VLOOKUP(RC[-6],staffs!C[-7]:C[-5],3,FALSE) -> Mia | I6: =(RC[-5]-RC[-6])*(24)-1 -> 6.0000000001164153 | J6: =WEEKDAY(RC[-7],1) -> 1
A7: 6 | B7: 7 | C7: 2024-09-01T16:00:00.000 | D7: 2024-09-02T00:00:00.000 | H7: =VLOOKUP(RC[-6],staffs!C[-7]:C[-5],3,FALSE) -> Eleanor | I7: =(RC[-5]-RC[-6])*(24)-1 -> 7.0000000000582077 | J7: =WEEKDAY(RC[-7],1) -> 1
A8: 7 | B8: 6 | C8: 2024-09-01T10:00:00.000 | D8: 2024-09-01T17:00:00.000 | H8: =VLOOKUP(RC[-6],staffs!C[-7]:C[-5],3,FALSE) -> Sarah | I8: =(RC[-5]-RC[-6])*(24)-1 -> 6.0000000001164153 | J8: =WEEKDAY(RC[-7],1) -> 1
A9: 8 | B9: 8 | C9: 2024-09-01T16:00:00.000 | D9: 2024-09-02T00:00:00.000 | H9: =VLOOKUP(RC[-6],staffs!C[-7]:C[-5],3,FALSE) -> Gianna | I9: =(RC[-5]-RC[-6])*(24)-1 -> 7.0000000000582077 | J9: =WEEKDAY(RC[-7],1) -> 1
A10: 9 | B10: 9 | C10: 2024-09-01T10:00:00.000 | D10: 2024-09-01T17:00:00.000 | H10: =VLOOKUP(RC[-6],staffs!C[-7]:C[-5],3,FALSE) -> Ethan | I10: =(RC[-5]-RC[-6])*(24)-1 -> 6.0000000001164153 | J10: =WEEKDAY(RC[-7],1) -> 1
A11: 10 | B11: 10 | C11: 2024-09-01T10:00:00.000 | D11: 2024-09-01T17:00:00.000 | H11: =VLOOKUP(RC[-6],staffs!C[-7]:C[-5],3,FALSE) -> Charles | I11: =(RC[-5]-RC[-6])*(24)-1 -> 6.0000000001164153 | J11: =WEEKDAY(RC[-7],1) -> 1
A12: 11 | B12: 11 | C12: 2024-09-01T10:00:00.000 | D12: 2024-09-01T17:00:00.000 | H12: =VLOOKUP(RC[-6],staffs!C[-7]:C[-5],3,FALSE) -> Henry | I12: =(RC[-5]-RC[-6])*(24)-1 -> 6.0000000001164153 | J12: =WEEKDAY(RC[-7],1) -> 1
A13: 12 | B13: 12 | C13: 2024-09-01T16:00:00.000 | D13: 2024-09-01T23:00:00.000 | H13: =VLOOKUP(RC[-6],staffs!C[-7]:C[-5],3,FALSE) -> Mason | I13: =(RC[-5]-RC[-6])*(24)-1 -> 6.0000000001164153 | J13: =WEEKDAY(RC[-7],1) -> 1
A14: 13 | B14: 13 | C14: 2024-09-01T16:00:00.000 | D14: 2024-09-01T23:00:00.000 | H14: =VLOOKUP(RC[-6],staffs!C[-7]:C[-5],3,FALSE) -> Harry | I14: =(RC[-5]-RC[-6])*(24)-1 -> 6.0000000001164153 | J14: =WEEKDAY(RC[-7],1) -> 1
A15: 14 | B15: 14 | C15: 2024-09-01T16:00:00.000 | D15: 2024-09-01T23:00:00.000 | H15: =VLOOKUP(RC[-6],staffs!C[-7]:C[-5],3,FALSE) -> Levi | I15: =(RC[-5]-RC[-6])*(24)-1 -> 6.0000000001164153 | J15: =WEEKDAY(RC[-7],1) -> 1
A16: 15 | B16: 1 | C16: 2024-09-02T16:00:00.000 | D16: 2024-09-03T00:00:00.000 | H16: =VLOOKUP(RC[-6],staffs!C[-7]:C[-5],3,FALSE) -> John | I16: =(RC[-5]-RC[-6])*(24)-1 -> 7.0000000000582077 | J16: =WEEKDAY(RC[-7],1) -> 2
A17: 16 | B17: 3 | C17: 2024-09-02T09:00:00.000 | D17: 2024-09-02T17:00:00.000 | H17: =VLOOKUP(RC[-6],staffs!C[-7]:C[-5],3,FALSE) -> William | I17: =(RC[-5]-RC[-6])*(24)-1 -> 7.0000000000582077 | J17: =WEEKDAY(RC[-7],1) -> 2
A18: 17 | B18: 4 | C18: 2024-09-02T16:00:00.000 | D18: 2024-09-03T00:00:00.000 | H18: =VLOOKUP(RC[-6],staffs!C[-7]:C[-5],3,FALSE) -> Liam | I18: =(RC[-5]-RC[-6])*(24)-1 -> 7.0000000000582077 | J18: =WEEKDAY(RC[-7],1) -> 2
A19: 18 | B19: 5 | C19: 2024-09-02T09:00:00.000 | D19: 2024-09-02T17:00:00.000 | H19: =VLOOKUP(RC[-6],staffs!C[-7]:C[-5],3,FALSE) -> Oliver | I19: =(RC[-5]-RC[-6])*(24)-1 -> 7.0000000000582077 | J19: =WEEKDAY(RC[-7],1) -> 2
A20: 19 | B20: 2 | C20: 2024-09-02T10:00:00.000 | D20: 2024-09-02T17:00:00.000 | H20: =VLOOKUP(RC[-6],staffs!C[-7]:C[-5],3,FALSE) -> Mia | I20: =(RC[-5]-RC[-6])*(24)-1 -> 6.0000000001164153 | J20: =WEEKDAY(RC[-7],1) -> 2
A21: 20 | B21: 7 | C21: 2024-09-02T16:00:00.000 | D21: 2024-09-03T00:00:00.000 | H21: =VLOOKUP(RC[-6],staffs!C[-7]:C[-5],3,FALSE) -> Eleanor | I21: =(RC[-5]-RC[-6])*(24)-1 -> 7.0000000000582077 | J21: =WEEKDAY(RC[-7],1) -> 2
A22: 21 | B22: 6 | C22: 2024-09-02T10:00:00.000 | D22: 2024-09-02T17:00:00.000 | H22: =VLOOKUP(RC[-6],staffs!C[-7]:C[-5],3,FALSE) -> Sarah | I22: =(RC[-5]-RC[-6])*(24)-1 -> 6.0000000001164153 | J22: =WEEKDAY(RC[-7],1) -> 2
A23: 22 | B23: 8 | C23: 2024-09-02T16:00:00.000 | D23: 2024-09-03T00:00:00.000 | H23: =VLOOKUP(RC[-6],staffs!C[-7]:C[-5],3,FALSE) -> Gianna | I23: =(RC[-5]-RC[-6])*(24)-1 -> 7.0000000000582077 | J23: =WEEKDAY(RC[-7],1) -> 2
A24: 23 | B24: 9 | C24: 2024-09-02T10:00:00.000 | D24: 2024-09-02T17:00:00.000 | H24: =VLOOKUP(RC[-6],staffs!C[-7]:C[-5],3,FALSE) -> Ethan | I24: =(RC[-5]-RC[-6])*(24)-1 -> 6.0000000001164153 | J24: =WEEKDAY(RC[-7],1) -> 2
A25: 24 | B25: 10 | C25: 2024-09-02T10:00:00.000 | D25: 2024-09-02T17:00:00.000 | H25: =VLOOKUP(RC[-6],staffs!C[-7]:C[-5],3,FALSE) -> Charles | I25: =(RC[-5]-RC[-6])*(24)-1 -> 6.0000000001164153 | J25: =WEEKDAY(RC[-7],1) -> 2
A26: 25 | B26: 11 | C26: 2024-09-02T10:00:00.000 | D26: 2024-09-02T17:00:00.000 | H26: =VLOOKUP(RC[-6],staffs!C[-7]:C[-5],3,FALSE) -> Henry | I26: =(RC[-5]-RC[-6])*(24)-1 -> 6.0000000001164153 | J26: =WEEKDAY(RC[-7],1) -> 2
A27: 26 | B27: 12 | C27: 2024-09-02T16:00:00.000 | D27: 2024-09-02T23:00:00.000 | H27: =VLOOKUP(RC[-6],staffs!C[-7]:C[-5],3,FALSE) -> Mason | I27: =(RC[-5]-RC[-6])*(24)-1 -> 6.0000000001164153 | J27: =WEEKDAY(RC[-7],1) -> 2
A28: 27 | B28: 13 | C28: 2024-09-02T16:00:00.000 | D28: 2024-09-02T23:00:00.000 | H28: =VLOOKUP(RC[-6],staffs!C[-7]:C[-5],3,FALSE) -> Harry | I28: =(RC[-5]-RC[-6])*(24)-1 -> 6.0000000001164153 | J28: =WEEKDAY(RC[-7],1) -> 2
A29: 28 | B29: 14 | C29: 2024-09-02T16:00:00.000 | D29: 2024-09-02T23:00:00.000 | H29: =VLOOKUP(RC[-6],staffs!C[-7]:C[-5],3,FALSE) -> Levi | I29: =(RC[-5]-RC[-6])*(24)-1 -> 6.0000000001164153 | J29: =WEEKDAY(RC[-7],1) -> 2
A30: 29 | B30: 1 | C30: 2024-09-03T16:00:00.000 | D30: 2024-09-04T00:00:00.000 | H30: =VLOOKUP(RC[-6],staffs!C[-7]:C[-5],3,FALSE) -> John | I30: =(RC[-5]-RC[-6])*(24)-1 -> 7.0000000000582077 | J30: =WEEKDAY(RC[-7],1) -> 3
A31: 30 | B31: 3 | C31: 2024-09-03T09:00:00.000 | D31: 2024-09-03T17:00:00.000 | H31: =VLOOKUP(RC[-6],staffs!C[-7]:C[-5],3,FALSE) -> William | I31: =(RC[-5]-RC[-6])*(24)-1 -> 7.0000000000582077 | J31: =WEEKDAY(RC[-7],1) -> 3
A32: 31 | B32: 4 | C32: 2024-09-03T16:00:00.000 | D32: 2024-09-04T00:00:00.000 | H32: =VLOOKUP(RC[-6],staffs!C[-7]:C[-5],3,FALSE) -> Liam | I32: =(RC[-5]-RC[-6])*(24)-1 -> 7.0000000000582077 | J32: =WEEKDAY(RC[-7],1) -> 3
A33: 32 | B33: 5 | C33: 2024-09-03T09:00:00.000 | D33: 2024-09-03T17:00:00.000 | H33: =VLOOKUP(RC[-6],staffs!C[-7]:C[-5],3,FALSE) -> Oliver | I33: =(RC[-5]-RC[-6])*(24)-1 -> 7.0000000000582077 | J33: =WEEKDAY(RC[-7],1) -> 3
A34: 33 | B34: 2 | C34: 2024-09-03T10:00:00.000 | D34: 2024-09-03T17:00:00.000 | H34: =VLOOKUP(RC[-6],staffs!C[-7]:C[-5],3,FALSE) -> Mia | I34: =(RC[-5]-RC[-6])*(24)-1 -> 6.0000000001164153 | J34: =WEEKDAY(RC[-7],1) -> 3
A35: 34 | B35: 7 | C35: 2024-09-03T16:00:00.000 | D35: 2024-09-04T00:00:00.000 | H35: =VLOOKUP(RC[-6],staffs!C[-7]:C[-5],3,FALSE) -> Eleanor | I35: =(RC[-5]-RC[-6])*(24)-1 -> 7.0000000000582077 | J35: =WEEKDAY(RC[-7],1) -> 3
A36: 35 | B36: 6 | C36: 2024-09-03T10:00:00.000 | D36: 2024-09-03T17:00:00.000 | H36: =VLOOKUP(RC[-6],staffs!C[-7]:C[-5],3,FALSE) -> Sarah | I36: =(RC[-5]-RC[-6])*(24)-1 -> 6.0000000001164153 | J36: =WEEKDAY(RC[-7],1) -> 3
A37: 36 | B37: 8 | C37: 2024-09-03T16:00:00.000 | D37: 2024-09-04T00:00:00.000 | H37: =VLOOKUP(RC[-6],staffs!C[-7]:C[-5],3,FALSE) -> Gianna | I37: =(RC[-5]-RC[-6])*(24)-1 -> 7.0000000000582077 | J37: =WEEKDAY(RC[-7],1) -> 3
A38: 37 | B38: 9 | C38: 2024-09-03T10:00:00.000 | D38: 2024-09-03T17:00:00.000 | H38: =VLOOKUP(RC[-6],staffs!C[-7]:C[-5],3,FALSE) -> Ethan | I38: =(RC[-5]-RC[-6])*(24)-1 -> 6.0000000001164153 | J38: =WEEKDAY(RC[-7],1) -> 3
A39: 38 | B39: 10 | C39: 2024-09-03T10:00:00.000 | D39: 2024-09-03T17:00:00.000 | H39: =VLOOKUP(RC[-6],staffs!C[-7]:C[-5],3,FALSE) -> Charles | I39: =(RC[-5]-RC[-6])*(24)-1 -> 6.0000000001164153 | J39: =WEEKDAY(RC[-7],1) -> 3
A40: 39 | B40: 11 | C40: 2024-09-03T10:00:00.000 | D40: 2024-09-03T17:00:00.000 | H40: =VLOOKUP(RC[-6],staffs!C[-7]:C[-5],3,FALSE) -> Henry | I40: =(RC[-5]-RC[-6])*(24)-1 -> 6.0000000001164153 | J40: =WEEKDAY(RC[-7],1) -> 3
A41: 40 | B41: 12 | C41: 2024-09-03T16:00:00.000 | D41: 2024-09-03T23:00:00.000 | H41: =VLOOKUP(RC[-6],staffs!C[-7]:C[-5],3,FALSE) -> Mason | I41: =(RC[-5]-RC[-6])*(24)-1 -> 6.0000000001164153 | J41: =WEEKDAY(RC[-7],1) -> 3
A42: 41 | B42: 13 | C42: 2024-09-03T16:00:00.000 | D42: 2024-09-03T23:00:00.000 | H42: =VLOOKUP(RC[-6],staffs!C[-7]:C[-5],3,FALSE) -> Harry | I42: =(RC[-5]-RC[-6])*(24)-1 -> 6.0000000001164153 | J42: =WEEKDAY(RC[-7],1) -> 3
A43: 42 | B43: 14 | C43: 2024-09-03T16:00:00.000 | D43: 2024-09-03T23:00:00.000 | H43: =VLOOKUP(RC[-6],staffs!C[-7]:C[-5],3,FALSE) -> Levi | I43: =(RC[-5]-RC[-6])*(24)-1 -> 6.0000000001164153 | J43: =WEEKDAY(RC[-7],1) -> 3
A44: 43 | B44: 1 | C44: 2024-09-05T16:00:00.000 | D44: 2024-09-06T00:00:00.000 | H44: =VLOOKUP(RC[-6],staffs!C[-7]:C[-5],3,FALSE) -> John | I44: =(RC[-5]-RC[-6])*(24)-1 -> 7.0000000000582077 | J44: =WEEKDAY(RC[-7],1) -> 5
A45: 44 | B45: 3 | C45: 2024-09-05T09:00:00.000 | D45: 2024-09-05T17:00:00.000 | H45: =VLOOKUP(RC[-6],staffs!C[-7]:C[-5],3,FALSE) -> William | I45: =(RC[-5]-RC[-6])*(24)-1 -> 7.0000000000582077 | J45: =WEEKDAY(RC[-7],1) -> 5
A46: 45 | B46: 4 | C46: 2024-09-05T16:00:00.000 | D46: 2024-09-06T00:00:00.000 | H46: =VLOOKUP(RC[-6],staffs!C[-7]:C[-5],3,FALSE) -> Liam | I46: =(RC[-5]-RC[-6])*(24)-1 -> 7.0000000000582077 | J46: =WEEKDAY(RC[-7],1) -> 5
A47: 46 | B47: 5 | C47: 2024-09-05T09:00:00.000 | D47: 2024-09-05T17:00:00.000 | H47: =VLOOKUP(RC[-6],staffs!C[-7]:C[-5],3,FALSE) -> Oliver | I47: =(RC[-5]-RC[-6])*(24)-1 -> 7.0000000000582077 | J47: =WEEKDAY(RC[-7],1) -> 5
A48: 47 | B48: 2 | C48: 2024-09-05T10:00:00.000 | D48: 2024-09-05T17:00:00.000 | H48: =VLOOKUP(RC[-6],staffs!C[-7]:C[-5],3,FALSE) -> Mia | I48: =(RC[-5]-RC[-6])*(24)-1 -> 6.0000000001164153 | J48: =WEEKDAY(RC[-7],1) -> 5
A49: 48 | B49: 7 | C49: 2024-09-05T16:00:00.000 | D49: 2024-09-06T00:00:00.000 | H49: =VLOOKUP(RC[-6],staffs!C[-7]:C[-5],3,FALSE) -> Eleanor | I49: =(RC[-5]-RC[-6])*(24)-1 -> 7.0000000000582077 | J49: =WEEKDAY(RC[-7],1) -> 5
A50: 49 | B50: 6 | C50: 2024-09-05T10:00:00.000 | D50: 2024-09-05T17:00:00.000 | H50: =VLOOKUP(RC[-6],staffs!C[-7]:C[-5],3,FALSE) -> Sarah | I50: =(RC[-5]-RC[-6])*(24)-1 -> 6.0000000001164153 | J50: =WEEKDAY(RC[-7],1) -> 5
A51: 50 | B51: 8 | C51: 2024-09-05T16:00:00.000 | D51: 2024-09-06T00:00:00.000 | H51: =VLOOKUP(RC[-6],staffs!C[-7]:C[-5],3,FALSE) -> Gianna | I51: =(RC[-5]-RC[-6])*(24)-1 -> 7.0000000000582077 | J51: =WEEKDAY(RC[-7],1) -> 5
A52: 51 | B52: 9 | C52: 2024-09-05T10:00:00.000 | D52: 2024-09-05T17:00:00.000 | H52: =VLOOKUP(RC[-6],staffs!C[-7]:C[-5],3,FALSE) -> Ethan | I52: =(RC[-5]-RC[-6])*(24)-1 -> 6.0000000001164153 | J52: =WEEKDAY(RC[-7],1) -> 5
A53: 52 | B53: 10 | C53: 2024-09-05T10:00:00.000 | D53: 2024-09-05T17:00:00.000 | H53: =VLOOKUP(RC[-6],staffs!C[-7]:C[-5],3,FALSE) -> Charles | I53: =(RC[-5]-RC[-6])*(24)-1 -> 6.0000000001164153 | J53: =WEEKDAY(RC[-7],1) -> 5
A54: 53 | B54: 11 | C54: 2024-09-05T10:00:00.000 | D54: 2024-09-05T17:00:00.000 | H54: =VLOOKUP(RC[-6],staffs!C[-7]:C[-5],3,FALSE) -> Henry | I54: =(RC[-5]-RC[-6])*(24)-1 -> 6.0000000001164153 | J54: =WEEKDAY(RC[-7],1) -> 5
A55: 54 | B55: 12 | C55: 2024-09-05T16:00:00.000 | D55: 2024-09-05T23:00:00.000 | H55: =VLOOKUP(RC[-6],staffs!C[-7]:C[-5],3,FALSE) -> Mason | I55: =(RC[-5]-RC[-6])*(24)-1 -> 6.0000000001164153 | J55: =WEEKDAY(RC[-7],1) -> 5
A56: 55 | B56: 13 | C56: 2024-09-05T16:00:00.000 | D56: 2024-09-05T23:00:00.000 | H56: =VLOOKUP(RC[-6],staffs!C[-7]:C[-5],3,FALSE) -> Harry | I56: =(RC[-5]-RC[-6])*(24)-1 -> 6.0000000001164153 | J56: =WEEKDAY(RC[-7],1) -> 5
A57: 56 | B57: 14 | C57: 2024-09-05T16:00:00.000 | D57: 2024-09-05T23:00:00.000 | H57: =VLOOKUP(RC[-6],staffs!C[-7]:C[-5],3,FALSE) -> Levi | I57: =(RC[-5]-RC[-6])*(24)-1 -> 6.0000000001164153 | J57: =WEEKDAY(RC[-7],1) -> 5
A58: 57 | B58: 1 | C58: 2024-09-06T16:00:00.000 | D58: 2024-09-07T00:00:00.000 | H58: =VLOOKUP(RC[-6],staffs!C[-7]:C[-5],3,FALSE) -> John | I58: =(RC[-5]-RC[-6])*(24)-1 -> 7.0000000000582077 | J58: =WEEKDAY(RC[-7],1) -> 6
A59: 58 | B59: 3 | C59: 2024-09-06T09:00:00.000 | D59: 2024-09-06T17:00:00.000 | H59: =VLOOKUP(RC[-6],staffs!C[-7]:C[-5],3,FALSE) -> William | I59: =(RC[-5]-RC[-6])*(24)-1 -> 7.0000000000582077 | J59: =WEEKDAY(RC[-7],1) -> 6
A60: 59 | B60: 4 | C60: 2024-09-06T16:00:00.000 | D60: 2024-09-07T00:00:00.000 | H60: =VLOOKUP(RC[-6],staffs!C[-7]:C[-5],3,FALSE) -> Liam | I60: =(RC[-5]-RC[-6])*(24)-1 -> 7.0000000000582077 | J60: =WEEKDAY(RC[-7],1) -> 6
A61: 60 | B61: 5 | C61: 2024-09-06T09:00:00.000 | D61: 2024-09-06T17:00:00.000 | H61: =VLOOKUP(RC[-6],staffs!C[-7]:C[-5],3,FALSE) -> Oliver | I61: =(RC[-5]-RC[-6])*(24)-1 -> 7.0000000000582077 | J61: =WEEKDAY(RC[-7],1) -> 6
A62: 61 | B62: 2 | C62: 2024-09-06T10:00:00.000 | D62: 2024-09-06T17:00:00.000 | H62: =VLOOKUP(RC[-6],staffs!C[-7]:C[-5],3,FALSE) -> Mia | I62: =(RC[-5]-RC[-6])*(24)-1 -> 6.0000000001164153 | J62: =WEEKDAY(RC[-7],1) -> 6
A63: 62 | B63: 7 | C63: 2024-09-06T16:00:00.000 | D63: 2024-09-07T00:00:00.000 | H63: =VLOOKUP(RC[-6],staffs!C[-7]:C[-5],3,FALSE) -> Eleanor | I63: =(RC[-5]-RC[-6])*(24)-1 -> 7.0000000000582077 | J63: =WEEKDAY(RC[-7],1) -> 6
A64: 63 | B64: 6 | C64: 2024-09-06T10:00:00.000 | D64: 2024-09-06T17:00:00.000 | H64: =VLOOKUP(RC[-6],staffs!C[-7]:C[-5],3,FALSE) -> Sarah | I64: =(RC[-5]-RC[-6])*(24)-1 -> 6.0000000001164153 | J64: =WEEKDAY(RC[-7],1) -> 6
A65: 64 | B65: 8 | C65: 2024-09-06T16:00:00.000 | D65: 2024-09-07T00:00:00.000 | H65: =VLOOKUP(RC[-6],staffs!C[-7]:C[-5],3,FALSE) -> Gianna | I65: =(RC[-5]-RC[-6])*(24)-1 -> 7.0000000000582077 | J65: =WEEKDAY(RC[-7],1) -> 6
A66: 65 | B66: 9 | C66: 2024-09-06T10:00:00.000 | D66: 2024-09-06T17:00:00.000 | H66: =VLOOKUP(RC[-6],staffs!C[-7]:C[-5],3,FALSE) -> Ethan | I66: =(RC[-5]-RC[-6])*(24)-1 -> 6.0000000001164153 | J66: =WEEKDAY(RC[-7],1) -> 6
A67: 66 | B67: 10 | C67: 2024-09-06T10:00:00.000 | D67: 2024-09-06T17:00:00.000 | H67: =VLOOKUP(RC[-6],staffs!C[-7]:C[-5],3,FALSE) -> Charles | I67: =(RC[-5]-RC[-6])*(24)-1 -> 6.0000000001164153 | J67: =WEEKDAY(RC[-7],1) -> 6
A68: 67 | B68: 11 | C68: 2024-09-06T10:00:00.000 | D68: 2024-09-06T17:00:00.000 | H68: =VLOOKUP(RC[-6],staffs!C[-7]:C[-5],3,FALSE) -> Henry | I68: =(RC[-5]-RC[-6])*(24)-1 -> 6.0000000001164153 | J68: =WEEKDAY(RC[-7],1) -> 6
A69: 68 | B69: 12 | C69: 2024-09-06T16:00:00.000 | D69: 2024-09-06T23:00:00.000 | H69: =VLOOKUP(RC[-6],staffs!C[-7]:C[-5],3,FALSE) -> Mason | I69: =(RC[-5]-RC[-6])*(24)-1 -> 6.0000000001164153 | J69: =WEEKDAY(RC[-7],1) -> 6
A70: 69 | B70: 13 | C70: 2024-09-06T16:00:00.000 | D70: 2024-09-06T23:00:00.000 | H70: =VLOOKUP(RC[-6],staffs!C[-7]:C[-5],3,FALSE) -> Harry | I70: =(RC[-5]-RC[-6])*(24)-1 -> 6.0000000001164153 | J70: =WEEKDAY(RC[-7],1) -> 6
A71: 70 | B71: 14 | C71: 2024-09-06T16:00:00.000 | D71: 2024-09-06T23:00:00.000 | H71: =VLOOKUP(RC[-6],staffs!C[-7]:C[-5],3,FALSE) -> Levi | I71: =(RC[-5]-RC[-6])*(24)-1 -> 6.0000000001164153 | J71: =WEEKDAY(RC[-7],1) -> 6
A72: 71 | B72: 1 | C72: 2024-09-07T16:00:00.000 | D72: 2024-09-08T00:00:00.000 | H72: =VLOOKUP(RC[-6],staffs!C[-7]:C[-5],3,FALSE) -> John | I72: =(RC[-5]-RC[-6])*(24)-1 -> 7.0000000000582077 | J72: =WEEKDAY(RC[-7],1) -> 7
A73: 72 | B73: 3 | C73: 2024-09-07T09:00:00.000 | D73: 2024-09-07T17:00:00.000 | H73: =VLOOKUP(RC[-6],staffs!C[-7]:C[-5],3,FALSE) -> William | I73: =(RC[-5]-RC[-6])*(24)-1 -> 7.0000000000582077 | J73: =WEEKDAY(RC[-7],1) -> 7
A74: 73 | B74: 4 | C74: 2024-09-07T16:00:00.000 | D74: 2024-09-08T00:00:00.000 | H74: =VLOOKUP(RC[-6],staffs!C[-7]:C[-5],3,FALSE) -> Liam | I74: =(RC[-5]-RC[-6])*(24)-1 -> 7.0000000000582077 | J74: =WEEKDAY(RC[-7],1) -> 7
A75: 74 | B75: 5 | C75: 2024-09-07T09:00:00.000 | D75: 2024-09-07T17:00:00.000 | H75: =VLOOKUP(RC[-6],staffs!C[-7]:C[-5],3,FALSE) -> Oliver | I75: =(RC[-5]-RC[-6])*(24)-1 -> 7.0000000000582077 | J75: =WEEKDAY(RC[-7],1) -> 7
A76: 75 | B76: 2 | C76: 2024-09-07T10:00:00.000 | D76: 2024-09-07T17:00:00.000 | H76: =VLOOKUP(RC[-6],staffs!C[-7]:C[-5],3,FALSE) -> Mia | I76: =(RC[-5]-RC[-6])*(24)-1 -> 6.0000000001164153 | J76: =WEEKDAY(RC[-7],1) -> 7
A77: 76 | B77: 7 | C77: 2024-09-07T16:00:00.000 | D77: 2024-09-08T00:00:00.000 | H77: =VLOOKUP(RC[-6],staffs!C[-7]:C[-5],3,FALSE) -> Eleanor | I77: =(RC[-5]-RC[-6])*(24)-1 -> 7.0000000000582077 | J77: =WEEKDAY(RC[-7],1) -> 7
A78: 77 | B78: 6 | C78: 2024-09-07T10:00:00.000 | D78: 2024-09-07T17:00:00.000 | H78: =VLOOKUP(RC[-6],staffs!C[-7]:C[-5],3,FALSE) -> Sarah | I78: =(RC[-5]-RC[-6])*(24)-1 -> 6.0000000001164153 | J78: =WEEKDAY(RC[-7],1) -> 7
A79: 78 | B79: 8 | C79: 2024-09-07T16:00:00.000 | D79: 2024-09-08T00:00:00.000 | H79: =VLOOKUP(RC[-6],staffs!C[-7]:C[-5],3,FALSE) -> Gianna | I79: =(RC[-5]-RC[-6])*(24)-1 -> 7.0000000000582077 | J79: =WEEKDAY(RC[-7],1) -> 7
A80: 79 | B80: 9 | C80: 2024-09-07T10:00:00.000 | D80: 2024-09-07T17:00:00.000 | H80: =VLOOKUP(RC[-6],staffs!C[-7]:C[-5],3,FALSE) -> Ethan | I80: =(RC[-5]-RC[-6])*(24)-1 -> 6.0000000001164153 | J80: =WEEKDAY(RC[-7],1) -> 7
A81: 80 | B81: 10 | C81: 2024-09-07T10:00:00.000 | D81: 2024-09-07T17:00:00.000 | H81: =VLOOKUP(RC[-6],staffs!C[-7]:C[-5],3,FALSE) -> Charles | I81: =(RC[-5]-RC[-6])*(24)-1 -> 6.0000000001164153 | J81: =WEEKDAY(RC[-7],1) -> 7
A82: 81 | B82: 11 | C82: 2024-09-07T10:00:00.000 | D82: 2024-09-07T17:00:00.000 | H82: =VLOOKUP(RC[-6],staffs!C[-7]:C[-5],3,FALSE) -> Henry | I82: =(RC[-5]-RC[-6])*(24)-1 -> 6.0000000001164153 | J82: =WEEKDAY(RC[-7],1) -> 7
A83: 82 | B83: 12 | C83: 2024-09-07T16:00:00.000 | D83: 2024-09-07T23:00:00.000 | H83: =VLOOKUP(RC[-6],staffs!C[-7]:C[-5],3,FALSE) -> Mason | I83: =(RC[-5]-RC[-6])*(24)-1 -> 6.0000000001164153 | J83: =WEEKDAY(RC[-7],1) -> 7
A84: 83 | B84: 13 | C84: 2024-09-07T16:00:00.000 | D84: 2024-09-07T23:00:00.000 | H84: =VLOOKUP(RC[-6],staffs!C[-7]:C[-5],3,FALSE) -> Harry | I84: =(RC[-5]-RC[-6])*(24)-1 -> 6.0000000001164153 | J84: =WEEKDAY(RC[-7],1) -> 7
A85: 84 | B85: 14 | C85: 2024-09-07T16:00:00.000 | D85: 2024-09-07T23:00:00.000 | H85: =VLOOKUP(RC[-6],staffs!C[-7]:C[-5],3,FALSE) -> Levi | I85: =(RC[-5]-RC[-6])*(24)-1 -> 6.0000000001164153 | J85: =WEEKDAY(RC[-7],1) -> 7
A86: 85 | B86: 1 | C86: 2024-09-08T16:00:00.000 | D86: 2024-09-09T00:00:00.000 | H86: =VLOOKUP(RC[-6],staffs!C[-7]:C[-5],3,FALSE) -> John | I86: =(RC[-5]-RC[-6])*(24)-1 -> 7.0000000000582077 | J86: =WEEKDAY(RC[-7],1) -> 1
A87: 86 | B87: 3 | C87: 2024-09-08T09:00:00.000 | D87: 2024-09-08T17:00:00.000 | H87: =VLOOKUP(RC[-6],staffs!C[-7]:C[-5],3,FALSE) -> William | I87: =(RC[-5]-RC[-6])*(24)-1 -> 7.0000000000582077 | J87: =WEEKDAY(RC[-7],1) -> 1
A88: 87 | B88: 4 | C88: 2024-09-08T16:00:00.000 | D88: 2024-09-09T00:00:00.000 | H88: =VLOOKUP(RC[-6],staffs!C[-7]:C[-5],3,FALSE) -> Liam | I88: =(RC[-5]-RC[-6])*(24)-1 -> 7.0000000000582077 | J88: =WEEKDAY(RC[-7],1) -> 1
A89: 88 | B89: 5 | C89: 2024-09-08T09:00:00.000 | D89: 2024-09-08T17:00:00.000 | H89: =VLOOKUP(RC[-6],staffs!C[-7]:C[-5],3,FALSE) -> Oliver | I89: =(RC[-5]-RC[-6])*(24)-1 -> 7.0000000000582077 | J89: =WEEKDAY(RC[-7],1) -> 1
A90: 89 | B90: 2 | C90: 2024-09-08T10:00:00.000 | D90: 2024-09-08T17:00:00.000 | H90: =VLOOKUP(RC[-6],staffs!C[-7]:C[-5],3,FALSE) -> Mia | I90: =(RC[-5]-RC[-6])*(24)-1 -> 6.0000000001164153 | J90: =WEEKDAY(RC[-7],1) -> 1
A91: 90 | B91: 7 | C91: 2024-09-08T16:00:00.000 | D91: 2024-09-09T00:00:00.000 | H91: =VLOOKUP(RC[-6],staffs!C[-7]:C[-5],3,FALSE) -> Eleanor | I91: =(RC[-5]-RC[-6])*(24)-1 -> 7.0000000000582077 | J91: =WEEKDAY(RC[-7],1) -> 1
A92: 91 | B92: 6 | C92: 2024-09-08T10:00:00.000 | D92: 2024-09-08T17:00:00.000 | H92: =VLOOKUP(RC[-6],staffs!C[-7]:C[-5],3,FALSE) -> Sarah | I92: =(RC[-5]-RC[-6])*(24)-1 -> 6.0000000001164153 | J92: =WEEKDAY(RC[-7],1) -> 1
A93: 92 | B93: 8 | C93: 2024-09-08T16:00:00.000 | D93: 2024-09-09T00:00:00.000 | H93: =VLOOKUP(RC[-6],staffs!C[-7]:C[-5],3,FALSE) -> Gianna | I93: =(RC[-5]-RC[-6])*(24)-1 -> 7.0000000000582077 | J93: =WEEKDAY(RC[-7],1) -> 1
A94: 93 | B94: 9 | C94: 2024-09-08T10:00:00.000 | D94: 2024-09-08T17:00:00.000 | H94: =VLOOKUP(RC[-6],staffs!C[-7]:C[-5],3,FALSE) -> Ethan | I94: =(RC[-5]-RC[-6])*(24)-1 -> 6.0000000001164153 | J94: =WEEKDAY(RC[-7],1) -> 1
A95: 94 | B95: 10 | C95: 2024-09-08T10:00:00.000 | D95: 2024-09-08T17:00:00.000 | H95: =VLOOKUP(RC[-6],staffs!C[-7]:C[-5],3,FALSE) -> Charles | I95: =(RC[-5]-RC[-6])*(24)-1 -> 6.0000000001164153 | J95: =WEEKDAY(RC[-7],1) -> 1
A96: 95 | B96: 11 | C96: 2024-09-08T10:00:00.000 | D96: 2024-09-08T17:00:00.000 | H96: =VLOOKUP(RC[-6],staffs!C[-7]:C[-5],3,FALSE) -> Henry | I96: =(RC[-5]-RC[-6])*(24)-1 -> 6.0000000001164153 | J96: =WEEKDAY(RC[-7],1) -> 1
A97: 96 | B97: 12 | C97: 2024-09-08T16:00:00.000 | D97: 2024-09-08T23:00:00.000 | H97: =VLOOKUP(RC[-6],staffs!C[-7]:C[-5],3,FALSE) -> Mason | I97: =(RC[-5]-RC[-6])*(24)-1 -> 6.0000000001164153 | J97: =WEEKDAY(RC[-7],1) -> 1
A98: 97 | B98: 13 | C98: 2024-09-08T16:00:00.000 | D98: 2024-09-08T23:00:00.000 | H98: =VLOOKUP(RC[-6],staffs!C[-7]:C[-5],3,FALSE) -> Harry | I98: =(RC[-5]-RC[-6])*(24)-1 -> 6.0000000001164153 | J98: =WEEKDAY(RC[-7],1) -> 1
A99: 98 | B99: 14 | C99: 2024-09-08T16:00:00.000 | D99: 2024-09-08T23:00:00.000 | H99: =VLOOKUP(RC[-6],staffs!C[-7]:C[-5],3,FALSE) -> Levi | I99: =(RC[-5]-RC[-6])*(24)-1 -> 6.0000000001164153 | J99: =WEEKDAY(RC[-7],1) -> 1
A100: 99 | B100: 1 | C100: 2024-09-09T16:00:00.000 | D100: 2024-09-10T00:00:00.000 | H100: =VLOOKUP(RC[-6],staffs!C[-7]:C[-5],3,FALSE) -> John | I100: =(RC[-5]-RC[-6])*(24)-1 -> 7.0000000000582077 | J100: =WEEKDAY(RC[-7],1) -> 2
A101: 100 | B101: 3 | C101: 2024-09-09T09:00:00.000 | D101: 2024-09-09T17:00:00.000 | H101: =VLOOKUP(RC[-6],staffs!C[-7]:C[-5],3,FALSE) -> William | I101: =(RC[-5]-RC[-6])*(24)-1 -> 7.0000000000582077 | J101: =WEEKDAY(RC[-7],1) -> 2
A102: 101 | B102: 4 | C102: 2024-09-09T16:00:00.000 | D102: 2024-09-10T00:00:00.000 | H102: =VLOOKUP(RC[-6],staffs!C[-7]:C[-5],3,FALSE) -> Liam | I102: =(RC[-5]-RC[-6])*(24)-1 -> 7.0000000000582077 | J102: =WEEKDAY(RC[-7],1) -> 2
A103: 102 | B103: 5 | C103: 2024-09-09T09:00:00.000 | D103: 2024-09-09T17:00:00.000 | H103: =VLOOKUP(RC[-6],staffs!C[-7]:C[-5],3,FALSE) -> Oliver | I103: =(RC[-5]-RC[-6])*(24)-1 -> 7.0000000000582077 | J103: =WEEKDAY(RC[-7],1) -> 2
A104: 103 | B104: 2 | C104: 2024-09-09T10:00:00.000 | D104: 2024-09-09T17:00:00.000 | H104: =VLOOKUP(RC[-6],staffs!C[-7]:C[-5],3,FALSE) -> Mia | I104: =(RC[-5]-RC[-6])*(24)-1 -> 6.0000000001164153 | J104: =WEEKDAY(RC[-7],1) -> 2
A105: 104 | B105: 7 | C105: 2024-09-09T16:00:00.000 | D105: 2024-09-10T00:00:00.000 | H105: =VLOOKUP(RC[-6],staffs!C[-7]:C[-5],3,FALSE) -> Eleanor | I105: =(RC[-5]-RC[-6])*(24)-1 -> 7.0000000000582077 | J105: =WEEKDAY(RC[-7],1) -> 2
A106: 105 | B106: 6 | C106: 2024-09-09T10:00:00.000 | D106: 2024-09-09T17:00:00.000 | H106: =VLOOKUP(RC[-6],staffs!C[-7]:C[-5],3,FALSE) -> Sarah | I106: =(RC[-5]-RC[-6])*(24)-1 -> 6.0000000001164153 | J106: =WEEKDAY(RC[-7],1) -> 2
A107: 106 | B107: 8 | C107: 2024-09-09T16:00:00.000 | D107: 2024-09-10T00:00:00.000 | H107: =VLOOKUP(RC[-6],staffs!C[-7]:C[-5],3,FALSE) -> Gianna | I107: =(RC[-5]-RC[-6])*(24)-1 -> 7.0000000000582077 | J107: =WEEKDAY(RC[-7],1) -> 2
A108: 107 | B108: 9 | C108: 2024-09-09T10:00:00.000 | D108: 2024-09-09T17:00:00.000 | H108: =VLOOKUP(RC[-6],staffs!C[-7]:C[-5],3,FALSE) -> Ethan | I108: =(RC[-5]-RC[-6])*(24)-1 -> 6.0000000001164153 | J108: =WEEKDAY(RC[-7],1) -> 2
A109: 108 | B109: 10 | C109: 2024-09-09T10:00:00.000 | D109: 2024-09-09T17:00:00.000 | H109: =VLOOKUP(RC[-6],staffs!C[-7]:C[-5],3,FALSE) -> Charles | I109: =(RC[-5]-RC[-6])*(24)-1 -> 6.0000000001164153 | J109: =WEEKDAY(RC[-7],1) -> 2
A110: 109 | B110: 11 | C110: 2024-09-09T10:00:00.000 | D110: 2024-09-09T17:00:00.000 | H110: =VLOOKUP(RC[-6],staffs!C[-7]:C[-5],3,FALSE) -> Henry | I110: =(RC[-5]-RC[-6])*(24)-1 -> 6.0000000001164153 | J110: =WEEKDAY(RC[-7],1) -> 2
A111: 110 | B111: 12 | C111: 2024-09-09T16:00:00.000 | D111: 2024-09-09T23:00:00.000 | H111: =VLOOKUP(RC[-6],staffs!C[-7]:C[-5],3,FALSE) -> Mason | I111: =(RC[-5]-RC[-6])*(24)-1 -> 6.0000000001164153 | J111: =WEEKDAY(RC[-7],1) -> 2
A112: 111 | B112: 13 | C112: 2024-09-09T16:00:00.000 | D112: 2024-09-09T23:00:00.000 | H112: =VLOOKUP(RC[-6],staffs!C[-7]:C[-5],3,FALSE) -> Harry | I112: =(RC[-5]-RC[-6])*(24)-1 -> 6.0000000001164153 | J112: =WEEKDAY(RC[-7],1) -> 2
A113: 112 | B113: 14 | C113: 2024-09-09T16:00:00.000 | D113: 2024-09-09T23:00:00.000 | H113: =VLOOKUP(RC[-6],staffs!C[-7]:C[-5],3,FALSE) -> Levi | I113: =(RC[-5]-RC[-6])*(24)-1 -> 6.0000000001164153 | J113: =WEEKDAY(RC[-7],1) -> 2
A114: 113 | B114: 1 | C114: 2024-09-10T16:00:00.000 | D114: 2024-09-11T00:00:00.000 | H114: =VLOOKUP(RC[-6],staffs!C[-7]:C[-5],3,FALSE) -> John | I114: =(RC[-5]-RC[-6])*(24)-1 -> 7.0000000000582077 | J114: =WEEKDAY(RC[-7],1) -> 3
A115: 114 | B115: 3 | C115: 2024-09-10T09:00:00.000 | D115: 2024-09-10T17:00:00.000 | H115: =VLOOKUP(RC[-6],staffs!C[-7]:C[-5],3,FALSE) -> William | I115: =(RC[-5]-RC[-6])*(24)-1 -> 7.0000000000582077 | J115: =WEEKDAY(RC[-7],1) -> 3
A116: 115 | B116: 4 | C116: 2024-09-10T16:00:00.000 | D116: 2024-09-11T00:00:00.000 | H116: =VLOOKUP(RC[-6],staffs!C[-7]:C[-5],3,FALSE) -> Liam | I116: =(RC[-5]-RC[-6])*(24)-1 -> 7.0000000000582077 | J116: =WEEKDAY(RC[-7],1) -> 3
A117: 116 | B117: 5 | C117: 2024-09-10T09:00:00.000 | D117: 2024-09-10T17:00:00.000 | H117: =VLOOKUP(RC[-6],staffs!C[-7]:C[-5],3,FALSE) -> Oliver | I117: =(RC[-5]-RC[-6])*(24)-1 -> 7.0000000000582077 | J117: =WEEKDAY(RC[-7],1) -> 3
A118: 117 | B118: 2 | C118: 2024-09-10T10:00:00.000 | D118: 2024-09-10T17:00:00.000 | H118: =VLOOKUP(RC[-6],staffs!C[-7]:C[-5],3,FALSE) -> Mia | I118: =(RC[-5]-RC[-6])*(24)-1 -> 6.0000000001164153 | J118: =WEEKDAY(RC[-7],1) -> 3
A119: 118 | B119: 7 | C119: 2024-09-10T16:00:00.000 | D119: 2024-09-11T00:00:00.000 | H119: =VLOOKUP(RC[-6],staffs!C[-7]:C[-5],3,FALSE) -> Eleanor | I119: =(RC[-5]-RC[-6])*(24)-1 -> 7.0000000000582077 | J119: =WEEKDAY(RC[-7],1) -> 3
A120: 119 | B120: 6 | C120: 2024-09-10T10:00:00.000 | D120: 2024-09-10T17:00:00.000 | H120: =VLOOKUP(RC[-6],staffs!C[-7]:C[-5],3,FALSE) -> Sarah | I120: =(RC[-5]-RC[-6])*(24)-1 -> 6.0000000001164153 | J120: =WEEKDAY(RC[-7],1) -> 3
A121: 120 | B121: 8 | C121: 2024-09-10T16:00:00.000 | D121: 2024-09-11T00:00:00.000 | H121: =VLOOKUP(RC[-6],staffs!C[-7]:C[-5],3,FALSE) -> Gianna | I121: =(RC[-5]-RC[-6])*(24)-1 -> 7.0000000000582077 | J121: =WEEKDAY(RC[-7],1) -> 3
A122: 121 | B122: 9 | C122: 2024-09-10T10:00:00.000 | D122: 2024-09-10T17:00:00.000 | H122: =VLOOKUP(RC[-6],staffs!C[-7]:C[-5],3,FALSE) -> Ethan | I122: =(RC[-5]-RC[-6])*(24)-1 -> 6.0000000001164153 | J122: =WEEKDAY(RC[-7],1) -> 3
A123: 122 | B123: 10 | C123: 2024-09-10T10:00:00.000 | D123: 2024-09-10T17:00:00.000 | H123: =VLOOKUP(RC[-6],staffs!C[-7]:C[-5],3,FALSE) -> Charles | I123: =(RC[-5]-RC[-6])*(24)-1 -> 6.0000000001164153 | J123: =WEEKDAY(RC[-7],1) -> 3
A124: 123 | B124: 11 | C124: 2024-09-10T10:00:00.000 | D124: 2024-09-10T17:00:00.000 | H124: =VLOOKUP(RC[-6],staffs!C[-7]:C[-5],3,FALSE) -> Henry | I124: =(RC[-5]-RC[-6])*(24)-1 -> 6.0000000001164153 | J124: =WEEKDAY(RC[-7],1) -> 3
A125: 124 | B125: 12 | C125: 2024-09-10T16:00:00.000 | D125: 2024-09-10T23:00:00.000 | H125: =VLOOKUP(RC[-6],staffs!C[-7]:C[-5],3,FALSE) -> Mason | I125: =(RC[-5]-RC[-6])*(24)-1 -> 6.0000000001164153 | J125: =WEEKDAY(RC[-7],1) -> 3
A126: 125 | B126: 13 | C126: 2024-09-10T16:00:00.000 | D126: 2024-09-10T23:00:00.000 | H126: =VLOOKUP(RC[-6],staffs!C[-7]:C[-5],3,FALSE) -> Harry | I126: =(RC[-5]-RC[-6])*(24)-1 -> 6.0000000001164153 | J126: =WEEKDAY(RC[-7],1) -> 3
A127: 126 | B127: 14 | C127: 2024-09-10T16:00:00.000 | D127: 2024-09-10T23:00:00.000 | H127: =VLOOKUP(RC[-6],staffs!C[-7]:C[-5],3,FALSE) -> Levi | I127: =(RC[-5]-RC[-6])*(24)-1 -> 6.0000000001164153 | J127: =WEEKDAY(RC[-7],1) -> 3
A128: 127 | B128: 1 | C128: 2024-09-12T16:00:00.000 | D128: 2024-09-13T00:00:00.000 | H128: =VLOOKUP(RC[-6],staffs!C[-7]:C[-5],3,FALSE) -> John | I128: =(RC[-5]-RC[-6])*(24)-1 -> 7.0000000000582077 | J128: =WEEKDAY(RC[-7],1) -> 5
A129: 128 | B129: 3 | C129: 2024-09-12T09:00:00.000 | D129: 2024-09-12T17:00:00.000 | H129: =VLOOKUP(RC[-6],staffs!C[-7]:C[-5],3,FALSE) -> William | I129: =(RC[-5]-RC[-6])*(24)-1 -> 7.0000000000582077 | J129: =WEEKDAY(RC[-7],1) -> 5
A130: 129 | B130: 4 | C130: 2024-09-12T16:00:00.000 | D130: 2024-09-13T00:00:00.000 | H130: =VLOOKUP(RC[-6],staffs!C[-7]:C[-5],3,FALSE) -> Liam | I130: =(RC[-5]-RC[-6])*(24)-1 -> 7.0000000000582077 | J130: =WEEKDAY(RC[-7],1) -> 5
A131: 130 | B131: 5 | C131: 2024-09-12T09:00:00.000 | D131: 2024-09-12T17:00:00.000 | H131: =VLOOKUP(RC[-6],staffs!C[-7]:C[-5],3,FALSE) -> Oliver | I131: =(RC[-5]-RC[-6])*(24)-1 -> 7.0000000000582077 | J131: =WEEKDAY(RC[-7],1) -> 5
A132: 131 | B132: 2 | C132: 2024-09-12T10:00:00.000 | D132: 2024-09-12T17:00:00.000 | H132: =VLOOKUP(RC[-6],staffs!C[-7]:C[-5],3,FALSE) -> Mia | I132: =(RC[-5]-RC[-6])*(24)-1 -> 6.0000000001164153 | J132: =WEEKDAY(RC[-7],1) -> 5
A133: 132 | B133: 7 | C133: 2024-09-12T16:00:00.000 | D133: 2024-09-13T00:00:00.000 | H133: =VLOOKUP(RC[-6],staffs!C[-7]:C[-5],3,FALSE) -> Eleanor | I133: =(RC[-5]-RC[-6])*(24)-1 -> 7.0000000000582077 | J133: =WEEKDAY(RC[-7],1) -> 5
A134: 133 | B134: 6 | C134: 2024-09-12T10:00:00.000 | D134: 2024-09-12T17:00:00.000 | H134: =VLOOKUP(RC[-6],staffs!C[-7]:C[-5],3,FALSE) -> Sarah | I134: =(RC[-5]-RC[-6])*(24)-1 -> 6.0000000001164153 | J134: =WEEKDAY(RC[-7],1) -> 5
A135: 134 | B135: 8 | C135: 2024-09-12T16:00:00.000 | D135: 2024-09-13T00:00:00.000 | H135: =VLOOKUP(RC[-6],staffs!C[-7]:C[-5],3,FALSE) -> Gianna | I135: =(RC[-5]-RC[-6])*(24)-1 -> 7.0000000000582077 | J135: =WEEKDAY(RC[-7],1) -> 5
A136: 135 | B136: 9 | C136: 2024-09-12T10:00:00.000 | D136: 2024-09-12T17:00:00.000 | H136: =VLOOKUP(RC[-6],staffs!C[-7]:C[-5],3,FALSE) -> Ethan | I136: =(RC[-5]-RC[-6])*(24)-1 -> 6.0000000001164153 | J136: =WEEKDAY(RC[-7],1) -> 5
A137: 136 | B137: 10 | C137: 2024-09-12T10:00:00.000 | D137: 2024-09-12T17:00:00.000 | H137: =VLOOKUP(RC[-6],staffs!C[-7]:C[-5],3,FALSE) -> Charles | I137: =(RC[-5]-RC[-6])*(24)-1 -> 6.0000000001164153 | J137: =WEEKDAY(RC[-7],1) -> 5
A138: 137 | B138: 11 | C138: 2024-09-12T10:00:00.000 | D138: 2024-09-12T17:00:00.000 | H138: =VLOOKUP(RC[-6],staffs!C[-7]:C[-5],3,FALSE) -> Henry | I138: =(RC[-5]-RC[-6])*(24)-1 -> 6.0000000001164153 | J138: =WEEKDAY(RC[-7],1) -> 5
A139: 138 | B139: 12 | C139: 2024-09-12T16:00:00.000 | D139: 2024-09-12T23:00:00.000 | H139: =VLOOKUP(RC[-6],staffs!C[-7]:C[-5],3,FALSE) -> Mason | I139: =(RC[-5]-RC[-6])*(24)-1 -> 6.0000000001164153 | J139: =WEEKDAY(RC[-7],1) -> 5
A140: 139 | B140: 13 | C140: 2024-09-12T16:00:00.000 | D140: 2024-09-12T23:00:00.000 | H140: =VLOOKUP(RC[-6],staffs!C[-7]:C[-5],3,FALSE) -> Harry | I140: =(RC[-5]-RC[-6])*(24)-1 -> 6.0000000001164153 | J140: =WEEKDAY(RC[-7],1) -> 5
A141: 140 | B141: 14 | C141: 2024-09-12T16:00:00.000 | D141: 2024-09-12T23:00:00.000 | H141: =VLOOKUP(RC[-6],staffs!C[-7]:C[-5],3,FALSE) -> Levi | I141: =(RC[-5]-RC[-6])*(24)-1 -> 6.0000000001164153 | J141: =WEEKDAY(RC[-7],1) -> 5
A142: 141 | B142: 1 | C142: 2024-09-13T16:00:00.000 | D142: 2024-09-14T00:00:00.000 | H142: =VLOOKUP(RC[-6],staffs!C[-7]:C[-5],3,FALSE) -> John | I142: =(RC[-5]-RC[-6])*(24)-1 -> 7.0000000000582077 | J142: =WEEKDAY(RC[-7],1) -> 6
A143: 142 | B143: 3 | C143: 2024-09-13T09:00:00.000 | D143: 2024-09-13T17:00:00.000 | H143: =VLOOKUP(RC[-6],staffs!C[-7]:C[-5],3,FALSE) -> William | I143: =(RC[-5]-RC[-6])*(24)-1 -> 7.0000000000582077 | J143: =WEEKDAY(RC[-7],1) -> 6
A144: 143 | B144: 4 | C144: 2024-09-13T16:00:00.000 | D144: 2024-09-14T00:00:00.000 | H144: =VLOOKUP(RC[-6],staffs!C[-7]:C[-5],3,FALSE) -> Liam | I144: =(RC[-5]-RC[-6])*(24)-1 -> 7.0000000000582077 | J144: =WEEKDAY(RC[-7],1) -> 6
A145: 144 | B145: 5 | C145: 2024-09-13T09:00:00.000 | D145: 2024-09-13T17:00:00.000 | H145: =VLOOKUP(RC[-6],staffs!C[-7]:C[-5],3,FALSE) -> Oliver | I145: =(RC[-5]-RC[-6])*(24)-1 -> 7.0000000000582077 | J145: =WEEKDAY(RC[-7],1) -> 6
A146: 145 | B146: 2 | C146: 2024-09-13T10:00:00.000 | D146: 2024-09-13T17:00:00.000 | H146: =VLOOKUP(RC[-6],staffs!C[-7]:C[-5],3,FALSE) -> Mia | I146: =(RC[-5]-RC[-6])*(24)-1 -> 6.0000000001164153 | J146: =WEEKDAY(RC[-7],1) -> 6
A147: 146 | B147: 7 | C147: 2024-09-13T16:00:00.000 | D147: 2024-09-14T00:00:00.000 | H147: =VLOOKUP(RC[-6],staffs!C[-7]:C[-5],3,FALSE) -> Eleanor | I147: =(RC[-5]-RC[-6])*(24)-1 -> 7.0000000000582077 | J147: =WEEKDAY(RC[-7],1) -> 6
A148: 147 | B148: 6 | C148: 2024-09-13T10:00:00.000 | D148: 2024-09-13T17:00:00.000 | H148: =VLOOKUP(RC[-6],staffs!C[-7]:C[-5],3,FALSE) -> Sarah | I148: =(RC[-5]-RC[-6])*(24)-1 -> 6.0000000001164153 | J148: =WEEKDAY(RC[-7],1) -> 6
A149: 148 | B149: 8 | C149: 2024-09-13T16:00:00.000 | D149: 2024-09-14T00:00:00.000 | H149: =VLOOKUP(RC[-6],staffs!C[-7]:C[-5],3,FALSE) -> Gianna | I149: =(RC[-5]-RC[-6])*(24)-1 -> 7.0000000000582077 | J149: =WEEKDAY(RC[-7],1) -> 6
A150: 149 | B150: 9 | C150: 2024-09-13T10:00:00.000 | D150: 2024-09-13T17:00:00.000 | H150: =VLOOKUP(RC[-6],staffs!C[-7]:C[-5],3,FALSE) -> Ethan | I150: =(RC[-5]-RC[-6])*(24)-1 -> 6.0000000001164153 | J150: =WEEKDAY(RC[-7],1) -> 6
A151: 150 | B151: 10 | C151: 2024-09-13T10:00:00.000 | D151: 2024-09-13T17:00:00.000 | H151: =VLOOKUP(RC[-6],staffs!C[-7]:C[-5],3,FALSE) -> Charles | I151: =(RC[-5]-RC[-6])*(24)-1 -> 6.0000000001164153 | J151: =WEEKDAY(RC[-7],1) -> 6
A152: 151 | B152: 11 | C152: 2024-09-13T10:00:00.000 | D152: 2024-09-13T17:00:00.000 | H152: =VLOOKUP(RC[-6],staffs!C[-7]:C[-5],3,FALSE) -> Henry | I152: =(RC[-5]-RC[-6])*(24)-1 -> 6.0000000001164153 | J152: =WEEKDAY(RC[-7],1) -> 6
A153: 152 | B153: 12 | C153: 2024-09-13T16:00:00.000 | D153: 2024-09-13T23:00:00.000 | H153: =VLOOKUP(RC[-6],staffs!C[-7]:C[-5],3,FALSE) -> Mason | I153: =(RC[-5]-RC[-6])*(24)-1 -> 6.0000000001164153 | J153: =WEEKDAY(RC[-7],1) -> 6
A154: 153 | B154: 13 | C154: 2024-09-13T16:00:00.000 | D154: 2024-09-13T23:00:00.000 | H154: =VLOOKUP(RC[-6],staffs!C[-7]:C[-5],3,FALSE) -> Harry | I154: =(RC[-5]-RC[-6])*(24)-1 -> 6.0000000001164153 | J154: =WEEKDAY(RC[-7],1) -> 6
A155: 154 | B155: 14 | C155: 2024-09-13T16:00:00.000 | D155: 2024-09-13T23:00:00.000 | H155: =VLOOKUP(RC[-6],staffs!C[-7]:C[-5],3,FALSE) -> Levi | I155: =(RC[-5]-RC[-6])*(24)-1 -> 6.0000000001164153 | J155: =WEEKDAY(RC[-7],1) -> 6
A156: 155 | B156: 1 | C156: 2024-09-14T16:00:00.000 | D156: 2024-09-15T00:00:00.000 | H156: =VLOOKUP(RC[-6],staffs!C[-7]:C[-5],3,FALSE) -> John | I156: =(RC[-5]-RC[-6])*(24)-1 -> 7.0000000000582077 | J156: =WEEKDAY(RC[-7],1) -> 7
A157: 156 | B157: 3 | C157: 2024-09-14T09:00:00.000 | D157: 2024-09-14T17:00:00.000 | H157: =VLOOKUP(RC[-6],staffs!C[-7]:C[-5],3,FALSE) -> William | I157: =(RC[-5]-RC[-6])*(24)-1 -> 7.0000000000582077 | J157: =WEEKDAY(RC[-7],1) -> 7
A158: 157 | B158: 4 | C158: 2024-09-14T16:00:00.000 | D158: 2024-09-15T00:00:00.000 | H158: =VLOOKUP(RC[-6],staffs!C[-7]:C[-5],3,FALSE) -> Liam | I158: =(RC[-5]-RC[-6])*(24)-1 -> 7.0000000000582077 | J158: =WEEKDAY(RC[-7],1) -> 7
A159: 158 | B159: 5 | C159: 2024-09-14T09:00:00.000 | D159: 2024-09-14T17:00:00.000 | H159: =VLOOKUP(RC[-6],staffs!C[-7]:C[-5],3,FALSE) -> Oliver | I159: =(RC[-5]-RC[-6])*(24)-1 -> 7.0000000000582077 | J159: =WEEKDAY(RC[-7],1) -> 7
A160: 159 | B160: 2 | C160: 2024-09-14T10:00:00.000 | D160: 2024-09-14T17:00:00.000 | H160: =VLOOKUP(RC[-6],staffs!C[-7]:C[-5],3,FALSE) -> Mia | I160: =(RC[-5]-RC[-6])*(24)-1 -> 6.0000000001164153 | J160: =WEEKDAY(RC[-7],1) -> 7
A161: 160 | B161: 7 | C161: 2024-09-14T16:00:00.000 | D161: 2024-09-15T00:00:00.000 | H161: =VLOOKUP(RC[-6],staffs!C[-7]:C[-5],3,FALSE) -> Eleanor | I161: =(RC[-5]-RC[-6])*(24)-1 -> 7.0000000000582077 | J161: =WEEKDAY(RC[-7],1) -> 7
A162: 161 | B162: 6 | C162: 2024-09-14T10:00:00.000 | D162: 2024-09-14T17:00:00.000 | H162: =VLOOKUP(RC[-6],staffs!C[-7]:C[-5],3,FALSE) -> Sarah | I162: =(RC[-5]-RC[-6])*(24)-1 -> 6.0000000001164153 | J162: =WEEKDAY(RC[-7],1) -> 7
A163: 162 | B163: 8 | C163: 2024-09-14T16:00:00.000 | D163: 2024-09-15T00:00:00.000 | H163: =VLOOKUP(RC[-6],staffs!C[-7]:C[-5],3,FALSE) -> Gianna | I163: =(RC[-5]-RC[-6])*(24)-1 -> 7.0000000000582077 | J163: =WEEKDAY(RC[-7],1) -> 7
A164: 163 | B164: 9 | C164: 2024-09-14T10:00:00.000 | D164: 2024-09-14T17:00:00.000 | H164: =VLOOKUP(RC[-6],staffs!C[-7]:C[-5],3,FALSE) -> Ethan | I164: =(RC[-5]-RC[-6])*(24)-1 -> 6.0000000001164153 | J164: =WEEKDAY(RC[-7],1) -> 7
A165: 164 | B165: 10 | C165: 2024-09-14T10:00:00.000 | D165: 2024-09-14T17:00:00.000 | H165: =VLOOKUP(RC[-6],staffs!C[-7]:C[-5],3,FALSE) -> Charles | I165: =(RC[-5]-RC[-6])*(24)-1 -> 6.0000000001164153 | J165: =WEEKDAY(RC[-7],1) -> 7
A166: 165 | B166: 11 | C166: 2024-09-14T10:00:00.000 | D166: 2024-09-14T17:00:00.000 | H166: =VLOOKUP(RC[-6],staffs!C[-7]:C[-5],3,FALSE) -> Henry | I166: =(RC[-5]-RC[-6])*(24)-1 -> 6.0000000001164153 | J166: =WEEKDAY(RC[-7],1) -> 7
A167: 166 | B167: 12 | C167: 2024-09-14T16:00:00.000 | D167: 2024-09-14T23:00:00.000 | H167: =VLOOKUP(RC[-6],staffs!C[-7]:C[-5],3,FALSE) -> Mason | I167: =(RC[-5]-RC[-6])*(24)-1 -> 6.0000000001164153 | J167: =WEEKDAY(RC[-7],1) -> 7
A168: 167 | B168: 13 | C168: 2024-09-14T16:00:00.000 | D168: 2024-09-14T23:00:00.000 | H168: =VLOOKUP(RC[-6],staffs!C[-7]:C[-5],3,FALSE) -> Harry | I168: =(RC[-5]-RC[-6])*(24)-1 -> 6.0000000001164153 | J168: =WEEKDAY(RC[-7],1) -> 7
A169: 168 | B169: 14 | C169: 2024-09-14T16:00:00.000 | D169: 2024-09-14T23:00:00.000 | H169: =VLOOKUP(RC[-6],staffs!C[-7]:C[-5],3,FALSE) -> Levi | I169: =(RC[-5]-RC[-6])*(24)-1 -> 6.0000000001164153 | J169: =WEEKDAY(RC[-7],1) -> 7
A170: 169 | B170: 1 | C170: 2024-09-15T16:00:00.000 | D170: 2024-09-16T00:00:00.000 | H170: =VLOOKUP(RC[-6],staffs!C[-7]:C[-5],3,FALSE) -> John | I170: =(RC[-5]-RC[-6])*(24)-1 -> 7.0000000000582077 | J170: =WEEKDAY(RC[-7],1) -> 1
A171: 170 | B171: 3 | C171: 2024-09-15T09:00:00.000 | D171: 2024-09-15T17:00:00.000 | H171: =VLOOKUP(RC[-6],staffs!C[-7]:C[-5],3,FALSE) -> William | I171: =(RC[-5]-RC[-6])*(24)-1 -> 7.0000000000582077 | J171: =WEEKDAY(RC[-7],1) -> 1
A172: 171 | B172: 4 | C172: 2024-09-15T16:00:00.000 | D172: 2024-09-16T00:00:00.000 | H172: =VLOOKUP(RC[-6],staffs!C[-7]:C[-5],3,FALSE) -> Liam | I172: =(RC[-5]-RC[-6])*(24)-1 -> 7.0000000000582077 | J172: =WEEKDAY(RC[-7],1) -> 1
A173: 172 | B173: 5 | C173: 2024-09-15T09:00:00.000 | D173: 2024-09-15T17:00:00.000 | H173: =VLOOKUP(RC[-6],staffs!C[-7]:C[-5],3,FALSE) -> Oliver | I173: =(RC[-5]-RC[-6])*(24)-1 -> 7.0000000000582077 | J173: =WEEKDAY(RC[-7],1) -> 1
A174: 173 | B174: 2 | C174: 2024-09-15T10:00:00.000 | D174: 2024-09-15T17:00:00.000 | H174: =VLOOKUP(RC[-6],staffs!C[-7]:C[-5],3,FALSE) -> Mia | I174: =(RC[-5]-RC[-6])*(24)-1 -> 6.0000000001164153 | J174: =WEEKDAY(RC[-7],1) -> 1
A175: 174 | B175: 7 | C175: 2024-09-15T16:00:00.000 | D175: 2024-09-16T00:00:00.000 | H175: =VLOOKUP(RC[-6],staffs!C[-7]:C[-5],3,FALSE) -> Eleanor | I175: =(RC[-5]-RC[-6])*(24)-1 -> 7.0000000000582077 | J175: =WEEKDAY(RC[-7],1) -> 1
A176: 175 | B176: 6 | C176: 2024-09-15T10:00:00.000 | D176: 2024-09-15T17:00:00.000 | H176: =VLOOKUP(RC[-6],staffs!C[-7]:C[-5],3,FALSE) -> Sarah | I176: =(RC[-5]-RC[-6])*(24)-1 -> 6.0000000001164153 | J176: =WEEKDAY(RC[-7],1) -> 1
A177: 176 | B177: 8 | C177: 2024-09-15T16:00:00.000 | D177: 2024-09-16T00:00:00.000 | H177: =VLOOKUP(RC[-6],staffs!C[-7]:C[-5],3,FALSE) -> Gianna | I177: =(RC[-5]-RC[-6])*(24)-1 -> 7.0000000000582077 | J177: =WEEKDAY(RC[-7],1) -> 1
A178: 177 | B178: 9 | C178: 2024-09-15T10:00:00.000 | D178: 2024-09-15T17:00:00.000 | H178: =VLOOKUP(RC[-6],staffs!C[-7]:C[-5],3,FALSE) -> Ethan | I178: =(RC[-5]-RC[-6])*(24)-1 -> 6.0000000001164153 | J178: =WEEKDAY(RC[-7],1) -> 1
A179: 178 | B179: 10 | C179: 2024-09-15T10:00:00.000 | D179: 2024-09-15T17:00:00.000 | H179: =VLOOKUP(RC[-6],staffs!C[-7]:C[-5],3,FALSE) -> Charles | I179: =(RC[-5]-RC[-6])*(24)-1 -> 6.0000000001164153 | J179: =WEEKDAY(RC[-7],1) -> 1
A180: 179 | B180: 11 | C180: 2024-09-15T10:00:00.000 | D180: 2024-09-15T17:00:00.000 | H180: =VLOOKUP(RC[-6],staffs!C[-7]:C[-5],3,FALSE) -> Henry | I180: =(RC[-5]-RC[-6])*(24)-1 -> 6.0000000001164153 | J180: =WEEKDAY(RC[-7],1) -> 1
A181: 180 | B181: 12 | C181: 2024-09-15T16:00:00.000 | D181: 2024-09-15T23:00:00.000 | H181: =VLOOKUP(RC[-6],staffs!C[-7]:C[-5],3,FALSE) -> Mason | I181: =(RC[-5]-RC[-6])*(24)-1 -> 6.0000000001164153 | J181: =WEEKDAY(RC[-7],1) -> 1
A182: 181 | B182: 13 | C182: 2024-09-15T16:00:00.000 | D182: 2024-09-15T23:00:00.000 | H182: =VLOOKUP(RC[-6],staffs!C[-7]:C[-5],3,FALSE) -> Harry | I182: =(RC[-5]-RC[-6])*(24)-1 -> 6.0000000001164153 | J182: =WEEKDAY(RC[-7],1) -> 1
A183: 182 | B183: 14 | C183: 2024-09-15T16:00:00.000 | D183: 2024-09-15T23:00:00.000 | H183: =VLOOKUP(RC[-6],staffs!C[-7]:C[-5],3,FALSE) -> Levi | I183: =(RC[-5]-RC[-6])*(24)-1 -> 6.0000000001164153 | J183: =WEEKDAY(RC[-7],1) -> 1
A184: 183 | B184: 1 | C184: 2024-09-16T16:00:00.000 | D184: 2024-09-17T00:00:00.000 | H184: =VLOOKUP(RC[-6],staffs!C[-7]:C[-5],3,FALSE) -> John | I184: =(RC[-5]-RC[-6])*(24)-1 -> 7.0000000000582077 | J184: =WEEKDAY(RC[-7],1) -> 2
A185: 184 | B185: 3 | C185: 2024-09-16T09:00:00.000 | D185: 2024-09-16T17:00:00.000 | H185: =VLOOKUP(RC[-6],staffs!C[-7]:C[-5],3,FALSE) -> William | I185: =(RC[-5]-RC[-6])*(24)-1 -> 7.0000000000582077 | J185: =WEEKDAY(RC[-7],1) -> 2
A186: 185 | B186: 4 | C186: 2024-09-16T16:00:00.000 | D186: 2024-09-17T00:00:00.000 | H186: =VLOOKUP(RC[-6],staffs!C[-7]:C[-5],3,FALSE) -> Liam | I186: =(RC[-5]-RC[-6])*(24)-1 -> 7.0000000000582077 | J186: =WEEKDAY(RC[-7],1) -> 2
A187: 186 | B187: 5 | C187: 2024-09-16T09:00:00.000 | D187: 2024-09-16T17:00:00.000 | H187: =VLOOKUP(RC[-6],staffs!C[-7]:C[-5],3,FALSE) -> Oliver | I187: =(RC[-5]-RC[-6])*(24)-1 -> 7.0000000000582077 | J187: =WEEKDAY(RC[-7],1) -> 2
A188: 187 | B188: 2 | C188: 2024-09-16T10:00:00.000 | D188: 2024-09-16T17:00:00.000 | H188: =VLOOKUP(RC[-6],staffs!C[-7]:C[-5],3,FALSE) -> Mia | I188: =(RC[-5]-RC[-6])*(24)-1 -> 6.0000000001164153 | J188: =WEEKDAY(RC[-7],1) -> 2
A189: 188 | B189: 7 | C189: 2024-09-16T16:00:00.000 | D189: 2024-09-17T00:00:00.000 | H189: =VLOOKUP(RC[-6],staffs!C[-7]:C[-5],3,FALSE) -> Eleanor | I189: =(RC[-5]-RC[-6])*(24)-1 -> 7.0000000000582077 | J189: =WEEKDAY(RC[-7],1) -> 2
A190: 189 | B190: 6 | C190: 2024-09-16T10:00:00.000 | D190: 2024-09-16T17:00:00.000 | H190: =VLOOKUP(RC[-6],staffs!C[-7]:C[-5],3,FALSE) -> Sarah | I190: =(RC[-5]-RC[-6])*(24)-1 -> 6.0000000001164153 | J190: =WEEKDAY(RC[-7],1) -> 2
A191: 190 | B191: 8 | C191: 2024-09-16T16:00:00.000 | D191: 2024-09-17T00:00:00.000 | H191: =VLOOKUP(RC[-6],staffs!C[-7]:C[-5],3,FALSE) -> Gianna | I191: =(RC[-5]-RC[-6])*(24)-1 -> 7.0000000000582077 | J191: =WEEKDAY(RC[-7],1) -> 2
A192: 191 | B192: 9 | C192: 2024-09-16T10:00:00.000 | D192: 2024-09-16T17:00:00.000 | H192: =VLOOKUP(RC[-6],staffs!C[-7]:C[-5],3,FALSE) -> Ethan | I192: =(RC[-5]-RC[-6])*(24)-1 -> 6.0000000001164153 | J192: =WEEKDAY(RC[-7],1) -> 2
A193: 192 | B193: 10 | C193: 2024-09-16T10:00:00.000 | D193: 2024-09-16T17:00:00.000 | H193: =VLOOKUP(RC[-6],staffs!C[-7]:C[-5],3,FALSE) -> Charles | I193: =(RC[-5]-RC[-6])*(24)-1 -> 6.0000000001164153 | J193: =WEEKDAY(RC[-7],1) -> 2
A194: 193 | B194: 11 | C194: 2024-09-16T10:00:00.000 | D194: 2024-09-16T17:00:00.000 | H194: =VLOOKUP(RC[-6],staffs!C[-7]:C[-5],3,FALSE) -> Henry | I194: =(RC[-5]-RC[-6])*(24)-1 -> 6.0000000001164153 | J194: =WEEKDAY(RC[-7],1) -> 2
A195: 194 | B195: 12 | C195: 2024-09-16T16:00:00.000 | D195: 2024-09-16T23:00:00.000 | H195: =VLOOKUP(RC[-6],staffs!C[-7]:C[-5],3,FALSE) -> Mason | I195: =(RC[-5]-RC[-6])*(24)-1 -> 6.0000000001164153 | J195: =WEEKDAY(RC[-7],1) -> 2
A196: 195 | B196: 13 | C196: 2024-09-16T16:00:00.000 | D196: 2024-09-16T23:00:00.000 | H196: =VLOOKUP(RC[-6],staffs!C[-7]:C[-5],3,FALSE) -> Harry | I196: =(RC[-5]-RC[-6])*(24)-1 -> 6.0000000001164153 | J196: =WEEKDAY(RC[-7],1) -> 2
A197: 196 | B197: 14 | C197: 2024-09-16T16:00:00.000 | D197: 2024-09-16T23:00:00.000 | H197: =VLOOKUP(RC[-6],staffs!C[-7]:C[-5],3,FALSE) -> Levi | I197: =(RC[-5]-RC[-6])*(24)-1 -> 6.0000000001164153 | J197: =WEEKDAY(RC[-7],1) -> 2
A198: 197 | B198: 1 | C198: 2024-09-17T16:00:00.000 | D198: 2024-09-18T00:00:00.000 | H198: =VLOOKUP(RC[-6],staffs!C[-7]:C[-5],3,FALSE) -> John | I198: =(RC[-5]-RC[-6])*(24)-1 -> 7.0000000000582077 | J198: =WEEKDAY(RC[-7],1) -> 3
A199: 198 | B199: 3 | C199: 2024-09-17T09:00:00.000 | D199: 2024-09-17T17:00:00.000 | H199: =VLOOKUP(RC[-6],staffs!C[-7]:C[-5],3,FALSE) -> William | I199: =(RC[-5]-RC[-6])*(24)-1 -> 7.0000000000582077 | J199: =WEEKDAY(RC[-7],1) -> 3
A200: 199 | B200: 4 | C200: 2024-09-17T16:00:00.000 | D200: 2024-09-18T00:00:00.000 | H200: =VLOOKUP(RC[-6],staffs!C[-7]:C[-5],3,FALSE) -> Liam | I200: =(RC[-5]-RC[-6])*(24)-1 -> 7.0000000000582077 | J200: =WEEKDAY(RC[-7],1) -> 3
A201: 200 | B201: 5 | C201: 2024-09-17T09:00:00.000 | D201: 2024-09-17T17:00:00.000 | H201: =VLOOKUP(RC[-6],staffs!C[-7]:C[-5],3,FALSE) -> Oliver | I201: =(RC[-5]-RC[-6])*(24)-1 -> 7.0000000000582077 | J201: =WEEKDAY(RC[-7],1) -> 3
A202: 201 | B202: 2 | C202: 2024-09-17T10:00:00.000 | D202: 2024-09-17T17:00:00.000 | H202: =VLOOKUP(RC[-6],staffs!C[-7]:C[-5],3,FALSE) -> Mia | I202: =(RC[-5]-RC[-6])*(24)-1 -> 6.0000000001164153 | J202: =WEEKDAY(RC[-7],1) -> 3
A203: 202 | B203: 7 | C203: 2024-09-17T16:00:00.000 | D203: 2024-09-18T00:00:00.000 | H203: =VLOOKUP(RC[-6],staffs!C[-7]:C[-5],3,FALSE) -> Eleanor | I203: =(RC[-5]-RC[-6])*(24)-1 -> 7.0000000000582077 | J203: =WEEKDAY(RC[-7],1) -> 3
A204: 203 | B204: 6 | C204: 2024-09-17T10:00:00.000 | D204: 2024-09-17T17:00:00.000 | H204: =VLOOKUP(RC[-6],staffs!C[-7]:C[-5],3,FALSE) -> Sarah | I204: =(RC[-5]-RC[-6])*(24)-1 -> 6.0000000001164153 | J204: =WEEKDAY(RC[-7],1) -> 3
A205: 204 | B205: 8 | C205: 2024-09-17T16:00:00.000 | D205: 2024-09-18T00:00:00.000 | H205: =VLOOKUP(RC[-6],staffs!C[-7]:C[-5],3,FALSE) -> Gianna | I205: =(RC[-5]-RC[-6])*(24)-1 -> 7.0000000000582077 | J205: =WEEKDAY(RC[-7],1) -> 3
A206: 205 | B206: 9 | C206: 2024-09-17T10:00:00.000 | D206: 2024-09-17T17:00:00.000 | H206: =VLOOKUP(RC[-6],staffs!C[-7]:C[-5],3,FALSE) -> Ethan | I206: =(RC[-5]-RC[-6])*(24)-1 -> 6.0000000001164153 | J206: =WEEKDAY(RC[-7],1) -> 3
A207: 206 | B207: 10 | C207: 2024-09-17T10:00:00.000 | D207: 2024-09-17T17:00:00.000 | H207: =VLOOKUP(RC[-6],staffs!C[-7]:C[-5],3,FALSE) -> Charles | I207: =(RC[-5]-RC[-6])*(24)-1 -> 6.0000000001164153 | J207: =WEEKDAY(RC[-7],1) -> 3
A208: 207 | B208: 11 | C208: 2024-09-17T10:00:00.000 | D208: 2024-09-17T17:00:00.000 | H208: =VLOOKUP(RC[-6],staffs!C[-7]:C[-5],3,FALSE) -> Henry | I208: =(RC[-5]-RC[-6])*(24)-1 -> 6.0000000001164153 | J208: =WEEKDAY(RC[-7],1) -> 3
A209: 208 | B209: 12 | C209: 2024-09-17T16:00:00.000 | D209: 2024-09-17T23:00:00.000 | H209: =VLOOKUP(RC[-6],staffs!C[-7]:C[-5],3,FALSE) -> Mason | I209: =(RC[-5]-RC[-6])*(24)-1 -> 6.0000000001164153 | J209: =WEEKDAY(RC[-7],1) -> 3
A210: 209 | B210: 13 | C210: 2024-09-17T16:00:00.000 | D210: 2024-09-17T23:00:00.000 | H210: =VLOOKUP(RC[-6],staffs!C[-7]:C[-5],3,FALSE) -> Harry | I210: =(RC[-5]-RC[-6])*(24)-1 -> 6.0000000001164153 | J210: =WEEKDAY(RC[-7],1) -> 3
A211: 210 | B211: 14 | C211: 2024-09-17T16:00:00.000 | D211: 2024-09-17T23:00:00.000 | H211: =VLOOKUP(RC[-6],staffs!C[-7]:C[-5],3,FALSE) -> Levi | I211: =(RC[-5]-RC[-6])*(24)-1 -> 6.0000000001164153 | J211: =WEEKDAY(RC[-7],1) -> 3
A212: 211 | B212: 1 | C212: 2024-09-19T16:00:00.000 | D212: 2024-09-20T00:00:00.000 | H212: =VLOOKUP(RC[-6],staffs!C[-7]:C[-5],3,FALSE) -> John | I212: =(RC[-5]-RC[-6])*(24)-1 -> 7.0000000000582077 | J212: =WEEKDAY(RC[-7],1) -> 5
A213: 212 | B213: 3 | C213: 2024-09-19T09:00:00.000 | D213: 2024-09-19T17:00:00.000 | H213: =VLOOKUP(RC[-6],staffs!C[-7]:C[-5],3,FALSE) -> William | I213: =(RC[-5]-RC[-6])*(24)-1 -> 7.0000000000582077 | J213: =WEEKDAY(RC[-7],1) -> 5
A214: 213 | B214: 4 | C214: 2024-09-19T16:00:00.000 | D214: 2024-09-20T00:00:00.000 | H214: =VLOOKUP(RC[-6],staffs!C[-7]:C[-5],3,FALSE) -> Liam | I214: =(RC[-5]-RC[-6])*(24)-1 -> 7.0000000000582077 | J214: =WEEKDAY(RC[-7],1) -> 5
A215: 214 | B215: 5 | C215: 2024-09-19T09:00:00.000 | D215: 2024-09-19T17:00:00.000 | H215: =VLOOKUP(RC[-6],staffs!C[-7]:C[-5],3,FALSE) -> Oliver | I215: =(RC[-5]-RC[-6])*(24)-1 -> 7.0000000000582077 | J215: =WEEKDAY(RC[-7],1) -> 5
A216: 215 | B216: 2 | C216: 2024-09-19T10:00:00.000 | D216: 2024-09-19T17:00:00.000 | H216: =VLOOKUP(RC[-6],staffs!C[-7]:C[-5],3,FALSE) -> Mia | I216: =(RC[-5]-RC[-6])*(24)-1 -> 6.0000000001164153 | J216: =WEEKDAY(RC[-7],1) -> 5
A217: 216 | B217: 7 | C217: 2024-09-19T16:00:00.000 | D217: 2024-09-20T00:00:00.000 | H217: =VLOOKUP(RC[-6],staffs!C[-7]:C[-5],3,FALSE) -> Eleanor | I217: =(RC[-5]-RC[-6])*(24)-1 -> 7.0000000000582077 | J217: =WEEKDAY(RC[-7],1) -> 5
A218: 217 | B218: 6 | C218: 2024-09-19T10:00:00.000 | D218: 2024-09-19T17:00:00.000 | H218: =VLOOKUP(RC[-6],staffs!C[-7]:C[-5],3,FALSE) -> Sarah | I218: =(RC[-5]-RC[-6])*(24)-1 -> 6.0000000001164153 | J218: =WEEKDAY(RC[-7],1) -> 5
A219: 218 | B219: 8 | C219: 2024-09-19T16:00:00.000 | D219: 2024-09-20T00:00:00.000 | H219: =VLOOKUP(RC[-6],staffs!C[-7]:C[-5],3,FALSE) -> Gianna | I219: =(RC[-5]-RC[-6])*(24)-1 -> 7.0000000000582077 | J219: =WEEKDAY(RC[-7],1) -> 5
A220: 219 | B220: 9 | C220: 2024-09-19T10:00:00.000 | D220: 2024-09-19T17:00:00.000 | H220: =VLOOKUP(RC[-6],staffs!C[-7]:C[-5],3,FALSE) -> Ethan | I220: =(RC[-5]-RC[-6])*(24)-1 -> 6.0000000001164153 | J220: =WEEKDAY(RC[-7],1) -> 5
A221: 220 | B221: 10 | C221: 2024-09-19T10:00:00.000 | D221: 2024-09-19T17:00:00.000 | H221: =VLOOKUP(RC[-6],staffs!C[-7]:C[-5],3,FALSE) -> Charles | I221: =(RC[-5]-RC[-6])*(24)-1 -> 6.0000000001164153 | J221: =WEEKDAY(RC[-7],1) -> 5
A222: 221 | B222: 11 | C222: 2024-09-19T10:00:00.000 | D222: 2024-09-19T17:00:00.000 | H222: =VLOOKUP(RC[-6],staffs!C[-7]:C[-5],3,FALSE) -> Henry | I222: =(RC[-5]-RC[-6])*(24)-1 -> 6.0000000001164153 | J222: =WEEKDAY(RC[-7],1) -> 5
A223: 222 | B223: 12 | C223: 2024-09-19T16:00:00.000 | D223: 2024-09-19T23:00:00.000 | H223: =VLOOKUP(RC[-6],staffs!C[-7]:C[-5],3,FALSE) -> Mason | I223: =(RC[-5]-RC[-6])*(24)-1 -> 6.0000000001164153 | J223: =WEEKDAY(RC[-7],1) -> 5
A224: 223 | B224: 13 | C224: 2024-09-19T16:00:00.000 | D224: 2024-09-19T23:00:00.000 | H224: =VLOOKUP(RC[-6],staffs!C[-7]:C[-5],3,FALSE) -> Harry | I224: =(RC[-5]-RC[-6])*(24)-1 -> 6.0000000001164153 | J224: =WEEKDAY(RC[-7],1) -> 5
A225: 224 | B225: 14 | C225: 2024-09-19T16:00:00.000 | D225: 2024-09-19T23:00:00.000 | H225: =VLOOKUP(RC[-6],staffs!C[-7]:C[-5],3,FALSE) -> Levi | I225: =(RC[-5]-RC[-6])*(24)-1 -> 6.0000000001164153 | J225: =WEEKDAY(RC[-7],1) -> 5
A226: 225 | B226: 1 | C226: 2024-09-20T16:00:00.000 | D226: 2024-09-21T00:00:00.000 | H226: =VLOOKUP(RC[-6],staffs!C[-7]:C[-5],3,FALSE) -> John | I226: =(RC[-5]-RC[-6])*(24)-1 -> 7.0000000000582077 | J226: =WEEKDAY(RC[-7],1) -> 6
A227: 226 | B227: 3 | C227: 2024-09-20T09:00:00.000 | D227: 2024-09-20T17:00:00.000 | H227: =VLOOKUP(RC[-6],staffs!C[-7]:C[-5],3,FALSE) -> William | I227: =(RC[-5]-RC[-6])*(24)-1 -> 7.0000000000582077 | J227: =WEEKDAY(RC[-7],1) -> 6
A228: 227 | B228: 4 | C228: 2024-09-20T16:00:00.000 | D228: 2024-09-21T00:00:00.000 | H228: =VLOOKUP(RC[-6],staffs!C[-7]:C[-5],3,FALSE) -> Liam | I228: =(RC[-5]-RC[-6])*(24)-1 -> 7.0000000000582077 | J228: =WEEKDAY(RC[-7],1) -> 6
A229: 228 | B229: 5 | C229: 2024-09-20T09:00:00.000 | D229: 2024-09-20T17:00:00.000 | H229: =VLOOKUP(RC[-6],staffs!C[-7]:C[-5],3,FALSE) -> Oliver | I229: =(RC[-5]-RC[-6])*(24)-1 -> 7.0000000000582077 | J229: =WEEKDAY(RC[-7],1) -> 6
A230: 229 | B230: 2 | C230: 2024-09-20T10:00:00.000 | D230: 2024-09-20T17:00:00.000 | H230: =VLOOKUP(RC[-6],staffs!C[-7]:C[-5],3,FALSE) -> Mia | I230: =(RC[-5]-RC[-6])*(24)-1 -> 6.0000000001164153 | J230: =WEEKDAY(RC[-7],1) -> 6
A231: 230 | B231: 7 | C231: 2024-09-20T16:00:00.000 | D231: 2024-09-21T00:00:00.000 | H231: =VLOOKUP(RC[-6],staffs!C[-7]:C[-5],3,FALSE) -> Eleanor | I231: =(RC[-5]-RC[-6])*(24)-1 -> 7.0000000000582077 | J231: =WEEKDAY(RC[-7],1) -> 6
A232: 231 | B232: 6 | C232: 2024-09-20T10:00:00.000 | D232: 2024-09-20T17:00:00.000 | H232: =VLOOKUP(RC[-6],staffs!C[-7]:C[-5],3,FALSE) -> Sarah | I232: =(RC[-5]-RC[-6])*(24)-1 -> 6.0000000001164153 | J232: =WEEKDAY(RC[-7],1) -> 6
A233: 232 | B233: 8 | C233: 2024-09-20T16:00:00.000 | D233: 2024-09-21T00:00:00.000 | H233: =VLOOKUP(RC[-6],staffs!C[-7]:C[-5],3,FALSE) -> Gianna | I233: =(RC[-5]-RC[-6])*(24)-1 -> 7.0000000000582077 | J233: =WEEKDAY(RC[-7],1) -> 6
A234: 233 | B234: 9 | C234: 2024-09-20T10:00:00.000 | D234: 2024-09-20T17:00:00.000 | H234: =VLOOKUP(RC[-6],staffs!C[-7]:C[-5],3,FALSE) -> Ethan | I234: =(RC[-5]-RC[-6])*(24)-1 -> 6.0000000001164153 | J234: =WEEKDAY(RC[-7],1) -> 6
A235: 234 | B235: 10 | C235: 2024-09-20T10:00:00.000 | D235: 2024-09-20T17:00:00.000 | H235: =VLOOKUP(RC[-6],staffs!C[-7]:C[-5],3,FALSE) -> Charles | I235: =(RC[-5]-RC[-6])*(24)-1 -> 6.0000000001164153 | J235: =WEEKDAY(RC[-7],1) -> 6
A236: 235 | B236: 11 | C236: 2024-09-20T10:00:00.000 | D236: 2024-09-20T17:00:00.000 | H236: =VLOOKUP(RC[-6],staffs!C[-7]:C[-5],3,FALSE) -> Henry | I236: =(RC[-5]-RC[-6])*(24)-1 -> 6.0000000001164153 | J236: =WEEKDAY(RC[-7],1) -> 6
A237: 236 | B237: 12 | C237: 2024-09-20T16:00:00.000 | D237: 2024-09-20T23:00:00.000 | H237: =VLOOKUP(RC[-6],staffs!C[-7]:C[-5],3,FALSE) -> Mason | I237: =(RC[-5]-RC[-6])*(24)-1 -> 6.0000000001164153 | J237: =WEEKDAY(RC[-7],1) -> 6
A238: 237 | B238: 13 | C238: 2024-09-20T16:00:00.000 | D238: 2024-09-20T23:00:00.000 | H238: =VLOOKUP(RC[-6],staffs!C[-7]:C[-5],3,FALSE) -> Harry | I238: =(RC[-5]-RC[-6])*(24)-1 -> 6.0000000001164153 | J238: =WEEKDAY(RC[-7],1) -> 6
A239: 238 | B239: 14 | C239: 2024-09-20T16:00:00.000 | D239: 2024-09-20T23:00:00.000 | H239: =VLOOKUP(RC[-6],staffs!C[-7]:C[-5],3,FALSE) -> Levi | I239: =(RC[-5]-RC[-6])*(24)-1 -> 6.0000000001164153 | J239: =WEEKDAY(RC[-7],1) -> 6
A240: 239 | B240: 1 | C240: 2024-09-21T16:00:00.000 | D240: 2024-09-22T00:00:00.000 | H240: =VLOOKUP(RC[-6],staffs!C[-7]:C[-5],3,FALSE) -> John | I240: =(RC[-5]-RC[-6])*(24)-1 -> 7.0000000000582077 | J240: =WEEKDAY(RC[-7],1) -> 7
A241: 240 | B241: 3 | C241: 2024-09-21T09:00:00.000 | D241: 2024-09-21T17:00:00.000 | H241: =VLOOKUP(RC[-6],staffs!C[-7]:C[-5],3,FALSE) -> William | I241: =(RC[-5]-RC[-6])*(24)-1 -> 7.0000000000582077 | J241: =WEEKDAY(RC[-7],1) -> 7
A242: 241 | B242: 4 | C242: 2024-09-21T16:00:00.000 | D242: 2024-09-22T00:00:00.000 | H242: =VLOOKUP(RC[-6],staffs!C[-7]:C[-5],3,FALSE) -> Liam | I242: =(RC[-5]-RC[-6])*(24)-1 -> 7.0000000000582077 | J242: =WEEKDAY(RC[-7],1) -> 7
A243: 242 | B243: 5 | C243: 2024-09-21T09:00:00.000 | D243: 2024-09-21T17:00:00.000 | H243: =VLOOKUP(RC[-6],staffs!C[-7]:C[-5],3,FALSE) -> Oliver | I243: =(RC[-5]-RC[-6])*(24)-1 -> 7.0000000000582077 | J243: =WEEKDAY(RC[-7],1) -> 7
A244: 243 | B244: 2 | C244: 2024-09-21T10:00:00.000 | D244: 2024-09-21T17:00:00.000 | H244: =VLOOKUP(RC[-6],staffs!C[-7]:C[-5],3,FALSE) -> Mia | I244: =(RC[-5]-RC[-6])*(24)-1 -> 6.0000000001164153 | J244: =WEEKDAY(RC[-7],1) -> 7
A245: 244 | B245: 7 | C245: 2024-09-21T16:00:00.000 | D245: 2024-09-22T00:00:00.000 | H245: =VLOOKUP(RC[-6],staffs!C[-7]:C[-5],3,FALSE) -> Eleanor | I245: =(RC[-5]-RC[-6])*(24)-1 -> 7.0000000000582077 | J245: =WEEKDAY(RC[-7],1) -> 7
A246: 245 | B246: 6 | C246: 2024-09-21T10:00:00.000 | D246: 2024-09-21T17:00:00.000 | H246: =VLOOKUP(RC[-6],staffs!C[-7]:C[-5],3,FALSE) -> Sarah | I246: =(RC[-5]-RC[-6])*(24)-1 -> 6.0000000001164153 | J246: =WEEKDAY(RC[-7],1) -> 7
A247: 246 | B247: 8 | C247: 2024-09-21T16:00:00.000 | D247: 2024-09-22T00:00:00.000 | H247: =VLOOKUP(RC[-6],staffs!C[-7]:C[-5],3,FALSE) -> Gianna | I247: =(RC[-5]-RC[-6])*(24)-1 -> 7.0000000000582077 | J247: =WEEKDAY(RC[-7],1) -> 7
A248: 247 | B248: 9 | C248: 2024-09-21T10:00:00.000 | D248: 2024-09-21T17:00:00.000 | H248: =VLOOKUP(RC[-6],staffs!C[-7]:C[-5],3,FALSE) -> Ethan | I248: =(RC[-5]-RC[-6])*(24)-1 -> 6.0000000001164153 | J248: =WEEKDAY(RC[-7],1) -> 7
A249: 248 | B249: 10 | C249: 2024-09-21T10:00:00.000 | D249: 2024-09-21T17:00:00.000 | H249: =VLOOKUP(RC[-6],staffs!C[-7]:C[-5],3,FALSE) -> Charles | I249: =(RC[-5]-RC[-6])*(24)-1 -> 6.0000000001164153 | J249: =WEEKDAY(RC[-7],1) -> 7
A250: 249 | B250: 11 | C250: 2024-09-21T10:00:00.000 | D250: 2024-09-21T17:00:00.000 | H250: =VLOOKUP(RC[-6],staffs!C[-7]:C[-5],3,FALSE) -> Henry | I250: =(RC[-5]-RC[-6])*(24)-1 -> 6.0000000001164153 | J250: =WEEKDAY(RC[-7],1) -> 7
A251: 250 | B251: 12 | C251: 2024-09-21T16:00:00.000 | D251: 2024-09-21T23:00:00.000 | H251: =VLOOKUP(RC[-6],staffs!C[-7]:C[-5],3,FALSE) -> Mason | I251: =(RC[-5]-RC[-6])*(24)-1 -> 6.0000000001164153 | J251: =WEEKDAY(RC[-7],1) -> 7
A252: 251 | B252: 13 | C252: 2024-09-21T16:00:00.000 | D252: 2024-09-21T23:00:00.000 | H252: =VLOOKUP(RC[-6],staffs!C[-7]:C[-5],3,FALSE) -> Harry | I252: =(RC[-5]-RC[-6])*(24)-1 -> 6.0000000001164153 | J252: =WEEKDAY(RC[-7],1) -> 7
A253: 252 | B253: 14 | C253: 2024-09-21T16:00:00.000 | D253: 2024-09-21T23:00:00.000 | H253: =VLOOKUP(RC[-6],staffs!C[-7]:C[-5],3,FALSE) -> Levi | I253: =(RC[-5]-RC[-6])*(24)-1 -> 6.0000000001164153 | J253: =WEEKDAY(RC[-7],1) -> 7
A254: 253 | B254: 1 | C254: 2024-09-22T16:00:00.000 | D254: 2024-09-23T00:00:00.000 | H254: =VLOOKUP(RC[-6],staffs!C[-7]:C[-5],3,FALSE) -> John | I254: =(RC[-5]-RC[-6])*(24)-1 -> 7.0000000000582077 | J254: =WEEKDAY(RC[-7],1) -> 1
A255: 254 | B255: 3 | C255: 2024-09-22T09:00:00.000 | D255: 2024-09-22T17:00:00.000 | H255: =VLOOKUP(RC[-6],staffs!C[-7]:C[-5],3,FALSE) -> William | I255: =(RC[-5]-RC[-6])*(24)-1 -> 7.0000000000582077 | J255: =WEEKDAY(RC[-7],1) -> 1
A256: 255 | B256: 4 | C256: 2024-09-22T16:00:00.000 | D256: 2024-09-23T00:00:00.000 | H256: =VLOOKUP(RC[-6],staffs!C[-7]:C[-5],3,FALSE) -> Liam | I256: =(RC[-5]-RC[-6])*(24)-1 -> 7.0000000000582077 | J256: =WEEKDAY(RC[-7],1) -> 1
A257: 256 | B257: 5 | C257: 2024-09-22T09:00:00.000 | D257: 2024-09-22T17:00:00.000 | H257: =VLOOKUP(RC[-6],staffs!C[-7]:C[-5],3,FALSE) -> Oliver | I257: =(RC[-5]-RC[-6])*(24)-1 -> 7.0000000000582077 | J257: =WEEKDAY(RC[-7],1) -> 1
A258: 257 | B258: 2 | C258: 2024-09-22T10:00:00.000 | D258: 2024-09-22T17:00:00.000 | H258: =VLOOKUP(RC[-6],staffs!C[-7]:C[-5],3,FALSE) -> Mia | I258: =(RC[-5]-RC[-6])*(24)-1 -> 6.0000000001164153 | J258: =WEEKDAY(RC[-7],1) -> 1
A259: 258 | B259: 7 | C259: 2024-09-22T16:00:00.000 | D259: 2024-09-23T00:00:00.000 | H259: =VLOOKUP(RC[-6],staffs!C[-7]:C[-5],3,FALSE) -> Eleanor | I259: =(RC[-5]-RC[-6])*(24)-1 -> 7.0000000000582077 | J259: =WEEKDAY(RC[-7],1) -> 1
A260: 259 | B260: 6 | C260: 2024-09-22T10:00:00.000 | D260: 2024-09-22T17:00:00.000 | H260: =VLOOKUP(RC[-6],staffs!C[-7]:C[-5],3,FALSE) -> Sarah | I260: =(RC[-5]-RC[-6])*(24)-1 -> 6.0000000001164153 | J260: =WEEKDAY(RC[-7],1) -> 1
A261: 260 | B261: 8 | C261: 2024-09-22T16:00:00.000 | D261: 2024-09-23T00:00:00.000 | H261: =VLOOKUP(RC[-6],staffs!C[-7]:C[-5],3,FALSE) -> Gianna | I261: =(RC[-5]-RC[-6])*(24)-1 -> 7.0000000000582077 | J261: =WEEKDAY(RC[-7],1) -> 1
A262: 261 | B262: 9 | C262: 2024-09-22T10:00:00.000 | D262: 2024-09-22T17:00:00.000 | H262: =VLOOKUP(RC[-6],staffs!C[-7]:C[-5],3,FALSE) -> Ethan | I262: =(RC[-5]-RC[-6])*(24)-1 -> 6.0000000001164153 | J262: =WEEKDAY(RC[-7],1) -> 1
A263: 262 | B263: 10 | C263: 2024-09-22T10:00:00.000 | D263: 2024-09-22T17:00:00.000 | H263: =VLOOKUP(RC[-6],staffs!C[-7]:C[-5],3,FALSE) -> Charles | I263: =(RC[-5]-RC[-6])*(24)-1 -> 6.0000000001164153 | J263: =WEEKDAY(RC[-7],1) -> 1
A264: 263 | B264: 11 | C264: 2024-09-22T10:00:00.000 | D264: 2024-09-22T17:00:00.000 | H264: =VLOOKUP(RC[-6],staffs!C[-7]:C[-5],3,FALSE) -> Henry | I264: =(RC[-5]-RC[-6])*(24)-1 -> 6.0000000001164153 | J264: =WEEKDAY(RC[-7],1) -> 1
A265: 264 | B265: 12 | C265: 2024-09-22T16:00:00.000 | D265: 2024-09-22T23:00:00.000 | H265: =VLOOKUP(RC[-6],staffs!C[-7]:C[-5],3,FALSE) -> Mason | I265: =(RC[-5]-RC[-6])*(24)-1 -> 6.0000000001164153 | J265: =WEEKDAY(RC[-7],1) -> 1
A266: 265 | B266: 13 | C266: 2024-09-22T16:00:00.000 | D266: 2024-09-22T23:00:00.000 | H266: =VLOOKUP(RC[-6],staffs!C[-7]:C[-5],3,FALSE) -> Harry | I266: =(RC[-5]-RC[-6])*(24)-1 -> 6.0000000001164153 | J266: =WEEKDAY(RC[-7],1) -> 1
A267: 266 | B267: 14 | C267: 2024-09-22T16:00:00.000 | D267: 2024-09-22T23:00:00.000 | H267: =VLOOKUP(RC[-6],staffs!C[-7]:C[-5],3,FALSE) -> Levi | I267: =(RC[-5]-RC[-6])*(24)-1 -> 6.0000000001164153 | J267: =WEEKDAY(RC[-7],1) -> 1
A268: 267 | B268: 1 | C268: 2024-09-23T16:00:00.000 | D268: 2024-09-24T00:00:00.000 | H268: =VLOOKUP(RC[-6],staffs!C[-7]:C[-5],3,FALSE) -> John | I268: =(RC[-5]-RC[-6])*(24)-1 -> 7.0000000000582077 | J268: =WEEKDAY(RC[-7],1) -> 2
A269: 268 | B269: 3 | C269: 2024-09-23T09:00:00.000 | D269: 2024-09-23T17:00:00.000 | H269: =VLOOKUP(RC[-6],staffs!C[-7]:C[-5],3,FALSE) -> William | I269: =(RC[-5]-RC[-6])*(24)-1 -> 7.0000000000582077 | J269: =WEEKDAY(RC[-7],1) -> 2
A270: 269 | B270: 4 | C270: 2024-09-23T16:00:00.000 | D270: 2024-09-24T00:00:00.000 | H270: =VLOOKUP(RC[-6],staffs!C[-7]:C[-5],3,FALSE) -> Liam | I270: =(RC[-5]-RC[-6])*(24)-1 -> 7.0000000000582077 | J270: =WEEKDAY(RC[-7],1) -> 2
A271: 270 | B271: 5 | C271: 2024-09-23T09:00:00.000 | D271: 2024-09-23T17:00:00.000 | H271: =VLOOKUP(RC[-6],staffs!C[-7]:C[-5],3,FALSE) -> Oliver | I271: =(RC[-5]-RC[-6])*(24)-1 -> 7.0000000000582077 | J271: =WEEKDAY(RC[-7],1) -> 2
A272: 271 | B272: 2 | C272: 2024-09-23T10:00:00.000 | D272: 2024-09-23T17:00:00.000 | H272: =VLOOKUP(RC[-6],staffs!C[-7]:C[-5],3,FALSE) -> Mia | I272: =(RC[-5]-RC[-6])*(24)-1 -> 6.0000000001164153 | J272: =WEEKDAY(RC[-7],1) -> 2
A273: 272 | B273: 7 | C273: 2024-09-23T16:00:00.000 | D273: 2024-09-24T00:00:00.000 | H273: =VLOOKUP(RC[-6],staffs!C[-7]:C[-5],3,FALSE) -> Eleanor | I273: =(RC[-5]-RC[-6])*(24)-1 -> 7.0000000000582077 | J273: =WEEKDAY(RC[-7],1) -> 2
A274: 273 | B274: 6 | C274: 2024-09-23T10:00:00.000 | D274: 2024-09-23T17:00:00.000 | H274: =VLOOKUP(RC[-6],staffs!C[-7]:C[-5],3,FALSE) -> Sarah | I274: =(RC[-5]-RC[-6])*(24)-1 -> 6.0000000001164153 | J274: =WEEKDAY(RC[-7],1) -> 2
A275: 274 | B275: 8 | C275: 2024-09-23T16:00:00.000 | D275: 2024-09-24T00:00:00.000 | H275: =VLOOKUP(RC[-6],staffs!C[-7]:C[-5],3,FALSE) -> Gianna | I275: =(RC[-5]-RC[-6])*(24)-1 -> 7.0000000000582077 | J275: =WEEKDAY(RC[-7],1) -> 2
A276: 275 | B276: 9 | C276: 2024-09-23T10:00:00.000 | D276: 2024-09-23T17:00:00.000 | H276: =VLOOKUP(RC[-6],staffs!C[-7]:C[-5],3,FALSE) -> Ethan | I276: =(RC[-5]-RC[-6])*(24)-1 -> 6.0000000001164153 | J276: =WEEKDAY(RC[-7],1) -> 2
A277: 276 | B277: 10 | C277: 2024-09-23T10:00:00.000 | D277: 2024-09-23T17:00:00.000 | H277: =VLOOKUP(RC[-6],staffs!C[-7]:C[-5],3,FALSE) -> Charles | I277: =(RC[-5]-RC[-6])*(24)-1 -> 6.0000000001164153 | J277: =WEEKDAY(RC[-7],1) -> 2
A278: 277 | B278: 11 | C278: 2024-09-23T10:00:00.000 | D278: 2024-09-23T17:00:00.000 | H278: =VLOOKUP(RC[-6],staffs!C[-7]:C[-5],3,FALSE) -> Henry | I278: =(RC[-5]-RC[-6])*(24)-1 -> 6.0000000001164153 | J278: =WEEKDAY(RC[-7],1) -> 2
A279: 278 | B279: 12 | C279: 2024-09-23T16:00:00.000 | D279: 2024-09-23T23:00:00.000 | H279: =VLOOKUP(RC[-6],staffs!C[-7]:C[-5],3,FALSE) -> Mason | I279: =(RC[-5]-RC[-6])*(24)-1 -> 6.0000000001164153 | J279: =WEEKDAY(RC[-7],1) -> 2
A280: 279 | B280: 13 | C280: 2024-09-23T16:00:00.000 | D280: 2024-09-23T23:00:00.000 | H280: =VLOOKUP(RC[-6],staffs!C[-7]:C[-5],3,FALSE) -> Harry | I280: =(RC[-5]-RC[-6])*(24)-1 -> 6.0000000001164153 | J280: =WEEKDAY(RC[-7],1) -> 2
A281: 280 | B281: 14 | C281: 2024-09-23T16:00:00.000 | D281: 2024-09-23T23:00:00.000 | H281: =VLOOKUP(RC[-6],staffs!C[-7]:C[-5],3,FALSE) -> Levi | I281: =(RC[-5]-RC[-6])*(24)-1 -> 6.0000000001164153 | J281: =WEEKDAY(RC[-7],1) -> 2
A282: 281 | B282: 1 | C282: 2024-09-24T16:00:00.000 | D282: 2024-09-25T00:00:00.000 | H282: =VLOOKUP(RC[-6],staffs!C[-7]:C[-5],3,FALSE) -> John | I282: =(RC[-5]-RC[-6])*(24)-1 -> 7.0000000000582077 | J282: =WEEKDAY(RC[-7],1) -> 3
A283: 282 | B283: 3 | C283: 2024-09-24T09:00:00.000 | D283: 2024-09-24T17:00:00.000 | H283: =VLOOKUP(RC[-6],staffs!C[-7]:C[-5],3,FALSE) -> William | I283: =(RC[-5]-RC[-6])*(24)-1 -> 7.0000000000582077 | J283: =WEEKDAY(RC[-7],1) -> 3
A284: 283 | B284: 4 | C284: 2024-09-24T16:00:00.000 | D284: 2024-09-25T00:00:00.000 | H284: =VLOOKUP(RC[-6],staffs!C[-7]:C[-5],3,FALSE) -> Liam | I284: =(RC[-5]-RC[-6])*(24)-1 -> 7.0000000000582077 | J284: =WEEKDAY(RC[-7],1) -> 3
A285: 284 | B285: 5 | C285: 2024-09-24T09:00:00.000 | D285: 2024-09-24T17:00:00.000 | H285: =VLOOKUP(RC[-6],staffs!C[-7]:C[-5],3,FALSE) -> Oliver | I285: =(RC[-5]-RC[-6])*(24)-1 -> 7.0000000000582077 | J285: =WEEKDAY(RC[-7],1) -> 3
A286: 285 | B286: 2 | C286: 2024-09-24T10:00:00.000 | D286: 2024-09-24T17:00:00.000 | H286: =VLOOKUP(RC[-6],staffs!C[-7]:C[-5],3,FALSE) -> Mia | I286: =(RC[-5]-RC[-6])*(24)-1 -> 6.0000000001164153 | J286: =WEEKDAY(RC[-7],1) -> 3
A287: 286 | B287: 7 | C287: 2024-09-24T16:00:00.000 | D287: 2024-09-25T00:00:00.000 | H287: =VLOOKUP(RC[-6],staffs!C[-7]:C[-5],3,FALSE) -> Eleanor | I287: =(RC[-5]-RC[-6])*(24)-1 -> 7.0000000000582077 | J287: =WEEKDAY(RC[-7],1) -> 3
A288: 287 | B288: 6 | C288: 2024-09-24T10:00:00.000 | D288: 2024-09-24T17:00:00.000 | H288: =VLOOKUP(RC[-6],staffs!C[-7]:C[-5],3,FALSE) -> Sarah | I288: =(RC[-5]-RC[-6])*(24)-1 -> 6.0000000001164153 | J288: =WEEKDAY(RC[-7],1) -> 3
A289: 288 | B289: 8 | C289: 2024-09-24T16:00:00.000 | D289: 2024-09-25T00:00:00.000 | H289: =VLOOKUP(RC[-6],staffs!C[-7]:C[-5],3,FALSE) -> Gianna | I289: =(RC[-5]-RC[-6])*(24)-1 -> 7.0000000000582077 | J289: =WEEKDAY(RC[-7],1) -> 3
A290: 289 | B290: 9 | C290: 2024-09-24T10:00:00.000 | D290: 2024-09-24T17:00:00.000 | H290: =VLOOKUP(RC[-6],staffs!C[-7]:C[-5],3,FALSE) -> Ethan | I290: =(RC[-5]-RC[-6])*(24)-1 -> 6.0000000001164153 | J290: =WEEKDAY(RC[-7],1) -> 3
A291: 290 | B291: 10 | C291: 2024-09-24T10:00:00.000 | D291: 2024-09-24T17:00:00.000 | H291: =VLOOKUP(RC[-6],staffs!C[-7]:C[-5],3,FALSE) -> Charles | I291: =(RC[-5]-RC[-6])*(24)-1 -> 6.0000000001164153 | J291: =WEEKDAY(RC[-7],1) -> 3
A292: 291 | B292: 11 | C292: 2024-09-24T10:00:00.000 | D292: 2024-09-24T17:00:00.000 | H292: =VLOOKUP(RC[-6],staffs!C[-7]:C[-5],3,FALSE) -> Henry | I292: =(RC[-5]-RC[-6])*(24)-1 -> 6.0000000001164153 | J292: =WEEKDAY(RC[-7],1) -> 3
A293: 292 | B293: 12 | C293: 2024-09-24T16:00:00.000 | D293: 2024-09-24T23:00:00.000 | H293: =VLOOKUP(RC[-6],staffs!C[-7]:C[-5],3,FALSE) -> Mason | I293: =(RC[-5]-RC[-6])*(24)-1 -> 6.0000000001164153 | J293: =WEEKDAY(RC[-7],1) -> 3
A294: 293 | B294: 13 | C294: 2024-09-24T16:00:00.000 | D294: 2024-09-24T23:00:00.000 | H294: =VLOOKUP(RC[-6],staffs!C[-7]:C[-5],3,FALSE) -> Harry | I294: =(RC[-5]-RC[-6])*(24)-1 -> 6.0000000001164153 | J294: =WEEKDAY(RC[-7],1) -> 3
A295: 294 | B295: 14 | C295: 2024-09-24T16:00:00.000 | D295: 2024-09-24T23:00:00.000 | H295: =VLOOKUP(RC[-6],staffs!C[-7]:C[-5],3,FALSE) -> Levi | I295: =(RC[-5]-RC[-6])*(24)-1 -> 6.0000000001164153 | J295: =WEEKDAY(RC[-7],1) -> 3
A296: 295 | B296: 1 | C296: 2024-09-26T16:00:00.000 | D296: 2024-09-27T00:00:00.000 | H296: =VLOOKUP(RC[-6],staffs!C[-7]:C[-5],3,FALSE) -> John | I296: =(RC[-5]-RC[-6])*(24)-1 -> 7.0000000000582077 | J296: =WEEKDAY(RC[-7],1) -> 5
A297: 296 | B297: 3 | C297: 2024-09-26T09:00:00.000 | D297: 2024-09-26T17:00:00.000 | H297: =VLOOKUP(RC[-6],staffs!C[-7]:C[-5],3,FALSE) -> William | I297: =(RC[-5]-RC[-6])*(24)-1 -> 7.0000000000582077 | J297: =WEEKDAY(RC[-7],1) -> 5
A298: 297 | B298: 4 | C298: 2024-09-26T16:00:00.000 | D298: 2024-09-27T00:00:00.000 | H298: =VLOOKUP(RC[-6],staffs!C[-7]:C[-5],3,FALSE) -> Liam | I298: =(RC[-5]-RC[-6])*(24)-1 -> 7.0000000000582077 | J298: =WEEKDAY(RC[-7],1) -> 5
A299: 298 | B299: 5 | C299: 2024-09-26T09:00:00.000 | D299: 2024-09-26T17:00:00.000 | H299: =VLOOKUP(RC[-6],staffs!C[-7]:C[-5],3,FALSE) -> Oliver | I299: =(RC[-5]-RC[-6])*(24)-1 -> 7.0000000000582077 | J299: =WEEKDAY(RC[-7],1) -> 5
A300: 299 | B300: 2 | C300: 2024-09-26T10:00:00.000 | D300: 2024-09-26T17:00:00.000 | H300: =VLOOKUP(RC[-6],staffs!C[-7]:C[-5],3,FALSE) -> Mia | I300: =(RC[-5]-RC[-6])*(24)-1 -> 6.0000000001164153 | J300: =WEEKDAY(RC[-7],1) -> 5
A301: 300 | B301: 7 | C301: 2024-09-26T16:00:00.000 | D301: 2024-09-27T00:00:00.000 | H301: =VLOOKUP(RC[-6],staffs!C[-7]:C[-5],3,FALSE) -> Eleanor | I301: =(RC[-5]-RC[-6])*(24)-1 -> 7.0000000000582077 | J301: =WEEKDAY(RC[-7],1) -> 5
A302: 301 | B302: 6 | C302: 2024-09-26T10:00:00.000 | D302: 2024-09-26T17:00:00.000 | H302: =VLOOKUP(RC[-6],staffs!C[-7]:C[-5],3,FALSE) -> Sarah | I302: =(RC[-5]-RC[-6])*(24)-1 -> 6.0000000001164153 | J302: =WEEKDAY(RC[-7],1) -> 5
A303: 302 | B303: 8 | C303: 2024-09-26T16:00:00.000 | D303: 2024-09-27T00:00:00.000 | H303: =VLOOKUP(RC[-6],staffs!C[-7]:C[-5],3,FALSE) -> Gianna | I303: =(RC[-5]-RC[-6])*(24)-1 -> 7.0000000000582077 | J303: =WEEKDAY(RC[-7],1) -> 5
A304: 303 | B304: 9 | C304: 2024-09-26T10:00:00.000 | D304: 2024-09-26T17:00:00.000 | H304: =VLOOKUP(RC[-6],staffs!C[-7]:C[-5],3,FALSE) -> Ethan | I304: =(RC[-5]-RC[-6])*(24)-1 -> 6.0000000001164153 | J304: =WEEKDAY(RC[-7],1) -> 5
A305: 304 | B305: 10 | C305: 2024-09-26T10:00:00.000 | D305: 2024-09-26T17:00:00.000 | H305: =VLOOKUP(RC[-6],staffs!C[-7]:C[-5],3,FALSE) -> Charles | I305: =(RC[-5]-RC[-6])*(24)-1 -> 6.0000000001164153 | J305: =WEEKDAY(RC[-7],1) -> 5
A306: 305 | B306: 11 | C306: 2024-09-26T10:00:00.000 | D306: 2024-09-26T17:00:00.000 | H306: =VLOOKUP(RC[-6],staffs!C[-7]:C[-5],3,FALSE) -> Henry | I306: =(RC[-5]-RC[-6])*(24)-1 -> 6.0000000001164153 | J306: =WEEKDAY(RC[-7],1) -> 5
A307: 306 | B307: 12 | C307: 2024-09-26T16:00:00.000 | D307: 2024-09-26T23:00:00.000 | H307: =VLOOKUP(RC[-6],staffs!C[-7]:C[-5],3,FALSE) -> Mason | I307: =(RC[-5]-RC[-6])*(24)-1 -> 6.0000000001164153 | J307: =WEEKDAY(RC[-7],1) -> 5
A308: 307 | B308: 13 | C308: 2024-09-26T16:00:00.000 | D308: 2024-09-26T23:00:00.000 | H308: =VLOOKUP(RC[-6],staffs!C[-7]:C[-5],3,FALSE) -> Harry | I308: =(RC[-5]-RC[-6])*(24)-1 -> 6.0000000001164153 | J308: =WEEKDAY(RC[-7],1) -> 5
A309: 308 | B309: 14 | C309: 2024-09-26T16:00:00.000 | D309: 2024-09-26T23:00:00.000 | H309: =VLOOKUP(RC[-6],staffs!C[-7]:C[-5],3,FALSE) -> Levi | I309: =(RC[-5]-RC[-6])*(24)-1 -> 6.0000000001164153 | J309: =WEEKDAY(RC[-7],1) -> 5
A310: 309 | B310: 1 | C310: 2024-09-27T16:00:00.000 | D310: 2024-09-28T00:00:00.000 | H310: =VLOOKUP(RC[-6],staffs!C[-7]:C[-5],3,FALSE) -> John | I310: =(RC[-5]-RC[-6])*(24)-1 -> 7.0000000000582077 | J310: =WEEKDAY(RC[-7],1) -> 6
A311: 310 | B311: 3 | C311: 2024-09-27T09:00:00.000 | D311: 2024-09-27T17:00:00.000 | H311: =VLOOKUP(RC[-6],staffs!C[-7]:C[-5],3,FALSE) -> William | I311: =(RC[-5]-RC[-6])*(24)-1 -> 7.0000000000582077 | J311: =WEEKDAY(RC[-7],1) -> 6
A312: 311 | B312: 4 | C312: 2024-09-27T16:00:00.000 | D312: 2024-09-28T00:00:00.000 | H312: =VLOOKUP(RC[-6],staffs!C[-7]:C[-5],3,FALSE) -> Liam | I312: =(RC[-5]-RC[-6])*(24)-1 -> 7.0000000000582077 | J312: =WEEKDAY(RC[-7],1) -> 6
A313: 312 | B313: 5 | C313: 2024-09-27T09:00:00.000 | D313: 2024-09-27T17:00:00.000 | H313: =VLOOKUP(RC[-6],staffs!C[-7]:C[-5],3,FALSE) -> Oliver | I313: =(RC[-5]-RC[-6])*(24)-1 -> 7.0000000000582077 | J313: =WEEKDAY(RC[-7],1) -> 6
A314: 313 | B314: 2 | C314: 2024-09-27T10:00:00.000 | D314: 2024-09-27T17:00:00.000 | H314: =VLOOKUP(RC[-6],staffs!C[-7]:C[-5],3,FALSE) -> Mia | I314: =(RC[-5]-RC[-6])*(24)-1 -> 6.0000000001164153 | J314: =WEEKDAY(RC[-7],1) -> 6
A315: 314 | B315: 7 | C315: 2024-09-27T16:00:00.000 | D315: 2024-09-28T00:00:00.000 | H315: =VLOOKUP(RC[-6],staffs!C[-7]:C[-5],3,FALSE) -> Eleanor | I315: =(RC[-5]-RC[-6])*(24)-1 -> 7.0000000000582077 | J315: =WEEKDAY(RC[-7],1) -> 6
A316: 315 | B316: 6 | C316: 2024-09-27T10:00:00.000 | D316: 2024-09-27T17:00:00.000 | H316: =VLOOKUP(RC[-6],staffs!C[-7]:C[-5],3,FALSE) -> Sarah | I316: =(RC[-5]-RC[-6])*(24)-1 -> 6.0000000001164153 | J316: =WEEKDAY(RC[-7],1) -> 6
A317: 316 | B317: 8 | C317: 2024-09-27T16:00:00.000 | D317: 2024-09-28T00:00:00.000 | H317: =VLOOKUP(RC[-6],staffs!C[-7]:C[-5],3,FALSE) -> Gianna | I317: =(RC[-5]-RC[-6])*(24)-1 -> 7.0000000000582077 | J317: =WEEKDAY(RC[-7],1) -> 6
A318: 317 | B318: 9 | C318: 2024-09-27T10:00:00.000 | D318: 2024-09-27T17:00:00.000 | H318: =VLOOKUP(RC[-6],staffs!C[-7]:C[-5],3,FALSE) -> Ethan | I318: =(RC[-5]-RC[-6])*(24)-1 -> 6.0000000001164153 | J318: =WEEKDAY(RC[-7],1) -> 6
A319: 318 | B319: 10 | C319: 2024-09-27T10:00:00.000 | D319: 2024-09-27T17:00:00.000 | H319: =VLOOKUP(RC[-6],staffs!C[-7]:C[-5],3,FALSE) -> Charles | I319: =(RC[-5]-RC[-6])*(24)-1 -> 6.0000000001164153 | J319: =WEEKDAY(RC[-7],1) -> 6
A320: 319 | B320: 11 | C320: 2024-09-27T10:00:00.000 | D320: 2024-09-27T17:00:00.000 | H320: =VLOOKUP(RC[-6],staffs!C[-7]:C[-5],3,FALSE) -> Henry | I320: =(RC[-5]-RC[-6])*(24)-1 -> 6.0000000001164153 | J320: =WEEKDAY(RC[-7],1) -> 6
A321: 320 | B321: 12 | C321: 2024-09-27T16:00:00.000 | D321: 2024-09-27T23:00:00.000 | H321: =VLOOKUP(RC[-6],staffs!C[-7]:C[-5],3,FALSE) -> Mason | I321: =(RC[-5]-RC[-6])*(24)-1 -> 6.0000000001164153 | J321: =WEEKDAY(RC[-7],1) -> 6
A322: 321 | B322: 13 | C322: 2024-09-27T16:00:00.000 | D322: 2024-09-27T23:00:00.000 | H322: =VLOOKUP(RC[-6],staffs!C[-7]:C[-5],3,FALSE) -> Harry | I322: =(RC[-5]-RC[-6])*(24)-1 -> 6.0000000001164153 | J322: =WEEKDAY(RC[-7],1) -> 6
A323: 322 | B323: 14 | C323: 2024-09-27T16:00:00.000 | D323: 2024-09-27T23:00:00.000 | H323: =VLOOKUP(RC[-6],staffs!C[-7]:C[-5],3,FALSE) -> Levi | I323: =(RC[-5]-RC[-6])*(24)-1 -> 6.0000000001164153 | J323: =WEEKDAY(RC[-7],1) -> 6
A324: 323 | B324: 1 | C324: 2024-09-28T16:00:00.000 | D324: 2024-09-29T00:00:00.000 | H324: =VLOOKUP(RC[-6],staffs!C[-7]:C[-5],3,FALSE) -> John | I324: =(RC[-5]-RC[-6])*(24)-1 -> 7.0000000000582077 | J324: =WEEKDAY(RC[-7],1) -> 7
A325: 324 | B325: 3 | C325: 2024-09-28T09:00:00.000 | D325: 2024-09-28T17:00:00.000 | H325: =VLOOKUP(RC[-6],staffs!C[-7]:C[-5],3,FALSE) -> William | I325: =(RC[-5]-RC[-6])*(24)-1 -> 7.0000000000582077 | J325: =WEEKDAY(RC[-7],1) -> 7
A326: 325 | B326: 4 | C326: 2024-09-28T16:00:00.000 | D326: 2024-09-29T00:00:00.000 | H326: =VLOOKUP(RC[-6],staffs!C[-7]:C[-5],3,FALSE) -> Liam | I326: =(RC[-5]-RC[-6])*(24)-1 -> 7.0000000000582077 | J326: =WEEKDAY(RC[-7],1) -> 7
A327: 326 | B327: 5 | C327: 2024-09-28T09:00:00.000 | D327: 2024-09-28T17:00:00.000 | H327: =VLOOKUP(RC[-6],staffs!C[-7]:C[-5],3,FALSE) -> Oliver | I327: =(RC[-5]-RC[-6])*(24)-1 -> 7.0000000000582077 | J327: =WEEKDAY(RC[-7],1) -> 7
A328: 327 | B328: 2 | C328: 2024-09-28T10:00:00.000 | D328: 2024-09-28T17:00:00.000 | H328: =VLOOKUP(RC[-6],staffs!C[-7]:C[-5],3,FALSE) -> Mia | I328: =(RC[-5]-RC[-6])*(24)-1 -> 6.0000000001164153 | J328: =WEEKDAY(RC[-7],1) -> 7
A329: 328 | B329: 7 | C329: 2024-09-28T16:00:00.000 | D329: 2024-09-29T00:00:00.000 | H329: =VLOOKUP(RC[-6],staffs!C[-7]:C[-5],3,FALSE) -> Eleanor | I329: =(RC[-5]-RC[-6])*(24)-1 -> 7.0000000000582077 | J329: =WEEKDAY(RC[-7],1) -> 7
A330: 329 | B330: 6 | C330: 2024-09-28T10:00:00.000 | D330: 2024-09-28T17:00:00.000 | H330: =VLOOKUP(RC[-6],staffs!C[-7]:C[-5],3,FALSE) -> Sarah | I330: =(RC[-5]-RC[-6])*(24)-1 -> 6.0000000001164153 | J330: =WEEKDAY(RC[-7],1) -> 7
A331: 330 | B331: 8 | C331: 2024-09-28T16:00:00.000 | D331: 2024-09-29T00:00:00.000 | H331: =VLOOKUP(RC[-6],staffs!C[-7]:C[-5],3,FALSE) -> Gianna | I331: =(RC[-5]-RC[-6])*(24)-1 -> 7.0000000000582077 | J331: =WEEKDAY(RC[-7],1) -> 7
A332: 331 | B332: 9 | C332: 2024-09-28T10:00:00.000 | D332: 2024-09-28T17:00:00.000 | H332: =VLOOKUP(RC[-6],staffs!C[-7]:C[-5],3,FALSE) -> Ethan | I332: =(RC[-5]-RC[-6])*(24)-1 -> 6.0000000001164153 | J332: =WEEKDAY(RC[-7],1) -> 7
A333: 332 | B333: 10 | C333: 2024-09-28T10:00:00.000 | D333: 2024-09-28T17:00:00.000 | H333: =VLOOKUP(RC[-6],staffs!C[-7]:C[-5],3,FALSE) -> Charles | I333: =(RC[-5]-RC[-6])*(24)-1 -> 6.0000000001164153 | J333: =WEEKDAY(RC[-7],1) -> 7
A334: 333 | B334: 11 | C334: 2024-09-28T10:00:00.000 | D334: 2024-09-28T17:00:00.000 | H334: =VLOOKUP(RC[-6],staffs!C[-7]:C[-5],3,FALSE) -> Henry | I334: =(RC[-5]-RC[-6])*(24)-1 -> 6.0000000001164153 | J334: =WEEKDAY(RC[-7],1) -> 7
A335: 334 | B335: 12 | C335: 2024-09-28T16:00:00.000 | D335: 2024-09-28T23:00:00.000 | H335: =VLOOKUP(RC[-6],staffs!C[-7]:C[-5],3,FALSE) -> Mason | I335: =(RC[-5]-RC[-6])*(24)-1 -> 6.0000000001164153 | J335: =WEEKDAY(RC[-7],1) -> 7
A336: 335 | B336: 13 | C336: 2024-09-28T16:00:00.000 | D336: 2024-09-28T23:00:00.000 | H336: =VLOOKUP(RC[-6],staffs!C[-7]:C[-5],3,FALSE) -> Harry | I336: =(RC[-5]-RC[-6])*(24)-1 -> 6.0000000001164153 | J336: =WEEKDAY(RC[-7],1) -> 7
A337: 336 | B337: 14 | C337: 2024-09-28T16:00:00.000 | D337: 2024-09-28T23:00:00.000 | H337: =VLOOKUP(RC[-6],staffs!C[-7]:C[-5],3,FALSE) -> Levi | I337: =(RC[-5]-RC[-6])*(24)-1 -> 6.0000000001164153 | J337: =WEEKDAY(RC[-7],1) -> 7
A338: 337 | B338: 1 | C338: 2024-09-29T16:00:00.000 | D338: 2024-09-30T00:00:00.000 | H338: =VLOOKUP(RC[-6],staffs!C[-7]:C[-5],3,FALSE) -> John | I338: =(RC[-5]-RC[-6])*(24)-1 -> 7.0000000000582077 | J338: =WEEKDAY(RC[-7],1) -> 1
A339: 338 | B339: 3 | C339: 2024-09-29T09:00:00.000 | D339: 2024-09-29T17:00:00.000 | H339: =VLOOKUP(RC[-6],staffs!C[-7]:C[-5],3,FALSE) -> William | I339: =(RC[-5]-RC[-6])*(24)-1 -> 7.0000000000582077 | J339: =WEEKDAY(RC[-7],1) -> 1
A340: 339 | B340: 4 | C340: 2024-09-29T16:00:00.000 | D340: 2024-09-30T00:00:00.000 | H340: =VLOOKUP(RC[-6],staffs!C[-7]:C[-5],3,FALSE) -> Liam | I340: =(RC[-5]-RC[-6])*(24)-1 -> 7.0000000000582077 | J340: =WEEKDAY(RC[-7],1) -> 1
A341: 340 | B341: 5 | C341: 2024-09-29T09:00:00.000 | D341: 2024-09-29T17:00:00.000 | H341: =VLOOKUP(RC[-6],staffs!C[-7]:C[-5],3,FALSE) -> Oliver | I341: =(RC[-5]-RC[-6])*(24)-1 -> 7.0000000000582077 | J341: =WEEKDAY(RC[-7],1) -> 1
A342: 341 | B342: 2 | C342: 2024-09-29T10:00:00.000 | D342: 2024-09-29T17:00:00.000 | H342: =VLOOKUP(RC[-6],staffs!C[-7]:C[-5],3,FALSE) -> Mia | I342: =(RC[-5]-RC[-6])*(24)-1 -> 6.0000000001164153 | J342: =WEEKDAY(RC[-7],1) -> 1
A343: 342 | B343: 7 | C343: 2024-09-29T16:00:00.000 | D343: 2024-09-30T00:00:00.000 | H343: =VLOOKUP(RC[-6],staffs!C[-7]:C[-5],3,FALSE) -> Eleanor | I343: =(RC[-5]-RC[-6])*(24)-1 -> 7.0000000000582077 | J343: =WEEKDAY(RC[-7],1) -> 1
A344: 343 | B344: 6 | C344: 2024-09-29T10:00:00.000 | D344: 2024-09-29T17:00:00.000 | H344: =VLOOKUP(RC[-6],staffs!C[-7]:C[-5],3,FALSE) -> Sarah | I344: =(RC[-5]-RC[-6])*(24)-1 -> 6.0000000001164153 | J344: =WEEKDAY(RC[-7],1) -> 1
A345: 344 | B345: 8 | C345: 2024-09-29T16:00:00.000 | D345: 2024-09-30T00:00:00.000 | H345: =VLOOKUP(RC[-6],staffs!C[-7]:C[-5],3,FALSE) -> Gianna | I345: =(RC[-5]-RC[-6])*(24)-1 -> 7.0000000000582077 | J345: =WEEKDAY(RC[-7],1) -> 1
A346: 345 | B346: 9 | C346: 2024-09-29T10:00:00.000 | D346: 2024-09-29T17:00:00.000 | H346: =VLOOKUP(RC[-6],staffs!C[-7]:C[-5],3,FALSE) -> Ethan | I346: =(RC[-5]-RC[-6])*(24)-1 -> 6.0000000001164153 | J346: =WEEKDAY(RC[-7],1) -> 1
A347: 346 | B347: 10 | C347: 2024-09-29T10:00:00.000 | D347: 2024-09-29T17:00:00.000 | H347: =VLOOKUP(RC[-6],staffs!C[-7]:C[-5],3,FALSE) -> Charles | I347: =(RC[-5]-RC[-6])*(24)-1 -> 6.0000000001164153 | J347: =WEEKDAY(RC[-7],1) -> 1
A348: 347 | B348: 11 | C348: 2024-09-29T10:00:00.000 | D348: 2024-09-29T17:00:00.000 | H348: =VLOOKUP(RC[-6],staffs!C[-7]:C[-5],3,FALSE) -> Henry | I348: =(RC[-5]-RC[-6])*(24)-1 -> 6.0000000001164153 | J348: =WEEKDAY(RC[-7],1) -> 1
A349: 348 | B349: 12 | C349: 2024-09-29T16:00:00.000 | D349: 2024-09-29T23:00:00.000 | H349: =VLOOKUP(RC[-6],staffs!C[-7]:C[-5],3,FALSE) -> Mason | I349: =(RC[-5]-RC[-6])*(24)-1 -> 6.0000000001164153 | J349: =WEEKDAY(RC[-7],1) -> 1
A350: 349 | B350: 13 | C350: 2024-09-29T16:00:00.000 | D350: 2024-09-29T23:00:00.000 | H350: =VLOOKUP(RC[-6],staffs!C[-7]:C[-5],3,FALSE) -> Harry | I350: =(RC[-5]-RC[-6])*(24)-1 -> 6.0000000001164153 | J350: =WEEKDAY(RC[-7],1) -> 1
A351: 350 | B351: 14 | C351: 2024-09-29T16:00:00.000 | D351: 2024-09-29T23:00:00.000 | H351: =VLOOKUP(RC[-6],staffs!C[-7]:C[-5],3,FALSE) -> Levi | I351: =(RC[-5]-RC[-6])*(24)-1 -> 6.0000000001164153 | J351: =WEEKDAY(RC[-7],1) -> 1
A352: 351 | B352: 1 | C352: 2024-09-30T16:00:00.000 | D352: 2024-10-01T00:00:00.000 | H352: =VLOOKUP(RC[-6],staffs!C[-7]:C[-5],3,FALSE) -> John | I352: =(RC[-5]-RC[-6])*(24)-1 -> 7.0000000000582077 | J352: =WEEKDAY(RC[-7],1) -> 2
A353: 352 | B353: 3 | C353: 2024-09-30T09:00:00.000 | D353: 2024-09-30T17:00:00.000 | H353: =VLOOKUP(RC[-6],staffs!C[-7]:C[-5],3,FALSE) -> William | I353: =(RC[-5]-RC[-6])*(24)-1 -> 7.0000000000582077 | J353: =WEEKDAY(RC[-7],1) -> 2
A354: 353 | B354: 4 | C354: 2024-09-30T16:00:00.000 | D354: 2024-10-01T00:00:00.000 | H354: =VLOOKUP(RC[-6],staffs!C[-7]:C[-5],3,FALSE) -> Liam | I354: =(RC[-5]-RC[-6])*(24)-1 -> 7.0000000000582077 | J354: =WEEKDAY(RC[-7],1) -> 2
A355: 354 | B355: 5 | C355: 2024-09-30T09:00:00.000 | D355: 2024-09-30T17:00:00.000 | H355: =VLOOKUP(RC[-6],staffs!C[-7]:C[-5],3,FALSE) -> Oliver | I355: =(RC[-5]-RC[-6])*(24)-1 -> 7.0000000000582077 | J355: =WEEKDAY(RC[-7],1) -> 2
A356: 355 | B356: 2 | C356: 2024-09-30T10:00:00.000 | D356: 2024-09-30T17:00:00.000 | H356: =VLOOKUP(RC[-6],staffs!C[-7]:C[-5],3,FALSE) -> Mia | I356: =(RC[-5]-RC[-6])*(24)-1 -> 6.0000000001164153 | J356: =WEEKDAY(RC[-7],1) -> 2
A357: 356 | B357: 7 | C357: 2024-09-30T16:00:00.000 | D357: 2024-10-01T00:00:00.000 | H357: =VLOOKUP(RC[-6],staffs!C[-7]:C[-5],3,FALSE) -> Eleanor | I357: =(RC[-5]-RC[-6])*(24)-1 -> 7.0000000000582077 | J357: =WEEKDAY(RC[-7],1) -> 2
A358: 357 | B358: 6 | C358: 2024-09-30T10:00:00.000 | D358: 2024-09-30T17:00:00.000 | H358: =VLOOKUP(RC[-6],staffs!C[-7]:C[-5],3,FALSE) -> Sarah | I358: =(RC[-5]-RC[-6])*(24)-1 -> 6.0000000001164153 | J358: =WEEKDAY(RC[-7],1) -> 2
A359: 358 | B359: 8 | C359: 2024-09-30T16:00:00.000 | D359: 2024-10-01T00:00:00.000 | H359: =VLOOKUP(RC[-6],staffs!C[-7]:C[-5],3,FALSE) -> Gianna | I359: =(RC[-5]-RC[-6])*(24)-1 -> 7.0000000000582077 | J359: =WEEKDAY(RC[-7],1) -> 2
A360: 359 | B360: 9 | C360: 2024-09-30T10:00:00.000 | D360: 2024-09-30T17:00:00.000 | H360: =VLOOKUP(RC[-6],staffs!C[-7]:C[-5],3,FALSE) -> Ethan | I360: =(RC[-5]-RC[-6])*(24)-1 -> 6.0000000001164153 | J360: =WEEKDAY(RC[-7],1) -> 2
A361: 360 | B361: 10 | C361: 2024-09-30T10:00:00.000 | D361: 2024-09-30T17:00:00.000 | H361: =VLOOKUP(RC[-6],staffs!C[-7]:C[-5],3,FALSE) -> Charles | I361: =(RC[-5]-RC[-6])*(24)-1 -> 6.0000000001164153 | J361: =WEEKDAY(RC[-7],1) -> 2
A362: 361 | B362: 11 | C362: 2024-09-30T10:00:00.000 | D362: 2024-09-30T17:00:00.000 | H362: =VLOOKUP(RC[-6],staffs!C[-7]:C[-5],3,FALSE) -> Henry | I362: =(RC[-5]-RC[-6])*(24)-1 -> 6.0000000001164153 | J362: =WEEKDAY(RC[-7],1) -> 2
A363: 362 | B363: 12 | C363: 2024-09-30T16:00:00.000 | D363: 2024-09-30T23:00:00.000 | H363: =VLOOKUP(RC[-6],staffs!C[-7]:C[-5],3,FALSE) -> Mason | I363: =(RC[-5]-RC[-6])*(24)-1 -> 6.0000000001164153 | J363: =WEEKDAY(RC[-7],1) -> 2
A364: 363 | B364: 13 | C364: 2024-09-30T16:00:00.000 | D364: 2024-09-30T23:00:00.000 | H364: =VLOOKUP(RC[-6],staffs!C[-7]:C[-5],3,FALSE) -> Harry | I364: =(RC[-5]-RC[-6])*(24)-1 -> 6.0000000001164153 | J364: =WEEKDAY(RC[-7],1) -> 2
A365: 364 | B365: 14 | C365: 2024-09-30T16:00:00.000 | D365: 2024-09-30T23:00:00.000 | H365: =VLOOKUP(RC[-6],staffs!C[-7]:C[-5],3,FALSE) -> Levi | I365: =(RC[-5]-RC[-6])*(24)-1 -> 6.0000000001164153 | J365: =WEEKDAY(RC[-7],1) -> 2

Sheet: customers
A1: id | B1: customer_first_name | C1: customer_last_name | D1: gender_cd | E1: customer_address | F1: customer_email_address | G1: customer_phone_number
A2: 1 | B2: Abigail | C2: Hernandez | D2: 2 | E2: 82-5 Una Vallis | F2: abigail.h@example.com | G2: XXX-974-5439
A3: 2 | B3: Alexander | C3: Anderson | D3: 1 | E3: 287-3 Durius Valles | F3: alexander.a@example.com | G3: XXX-400-5392
A4: 3 | B4: Amanda | C4: Johnson | D4: 2 | E4: 282-4 Utopia Planitia | F4: amanda.j@example.com | G4: XXX-272-1262
A5: 4 | B5: Amelia | C5: Jones | D5: 2 | E5: 166-2 Tinto Vallis | F5: amelia.j@example.com | G5: XXX-012-1324
A6: 5 | B6: Aria | C6: Brown | D6: 2 | E6: 152-5 Centauri Montes | F6: aria.b@example.com | G6: XXX-726-9363
A7: 6 | B7: Ashley | C7: Martin | D7: 2 | E7: 299-8 Bosporos Planum | F7: ashley.m@example.com | G7: XXX-831-6906
A8: 7 | B8: Aurora | C8: Davis | D8: 2 | E8: 103-3 Axius Valles | F8: aurora.d@example.com | G8: XXX-408-5878
A9: 8 | B9: Ava | C9: Martinez | D9: 2 | E9: 82-12 Amazonis Planitia | F9: ava.m@example.com | G9: XXX-004-9396
A10: 9 | B10: Avery | C10: Miller | D10: 2 | E10: 27-5 Ascuris Planum | F10: avery.m@example.com | G10: XXX-931-5474
A11: 10 | B11: Benjamin | C11: Garcia | D11: 1 | E11: 66-14 Elysium Planitia | F11: benjamin.g@example.com | G11: XXX-973-2509
A12: 11 | B12: Camila | C12: Moore | D12: 2 | E12: 228-2 Coronae Planum | F12: camila.m@example.com | G12: XXX-940-8850
A13: 12 | B13: Charles | C13: Hernandez | D13: 1 | E13: 81-15 Chalce Montes | F13: charles.h@example.com | G13: XXX-061-2330
A14: 13 | B14: Charlotte | C14: Rodriguez | D14: 2 | E14: 180-17 Grjota Valles | F14: charlotte.r@example.com | G14: XXX-231-3945
A15: 14 | B15: Chloe | C15: Johnson | D15: 2 | E15: 49-12 Isidis Planitia | F15: chloe.j@example.com | G15: XXX-836-3865
A16: 15 | B16: Daniel | C16: Jones | D16: 1 | E16: 250-11 Padus Vallis | F16: daniel.j@example.com | G16: XXX-445-4642
A17: 16 | B17: David | C17: Martin | D17: 1 | E17: 189-9 Locras Valles | F17: david.m@example.com | G17: XXX-943-8793
A18: 17 | B18: Dorothy | C18: Smith | D18: 2 | E18: 65-13 Termes Vallis | F18: dorothy.s@example.com | G18: XXX-765-1408
A19: 18 | B19: Eleanor | C19: Taylor | D19: 2 | E19: 45-2 Verde Vallis | F19: eleanor.t@example.com | G19: XXX-218-4796
A20: 19 | B20: Elijah | C20: Martinez | D20: 1 | E20: 99-4 Hibes Montes | F20: elijah.m@example.com | G20: XXX-655-5712
A21: 20 | B21: Elizabeth | C21: Thompson | D21: 2 | E21: 232-9 Moa Valles | F21: elizabeth.t@example.com | G21: XXX-624-3348
A22: 21 | B22: Ella | C22: White | D22: 2 | E22: 80 Argentea Planum | F22: ella.w@example.com | G22: XXX-946-0791
A23: 22 | B23: Ellie | C23: Miller | D23: 2 | E23: 34-5 Runa Vallis | F23: ellie.m@example.com | G23: XXX-510-3581
A24: 23 | B24: Emma | C24: Wilson | D24: 2 | E24: 238-10 Chryse Planitia | F24: emma.w@example.com | G24: XXX-043-5557
A25: 24 | B25: Ethan | C25: Moore | D25: 1 | E25: 93-11 Granicus Valles | F25: ethan.m@example.com | G25: XXX-060-4077
A26: 25 | B26: Evelyn | C26: Anderson | D26: 2 | E26: 173-11 Hibes Montes | F26: evelyn.a@example.com | G26: XXX-236-4207
A27: 26 | B27: George | C27: Rodriguez | D27: 1 | E27: 151-16 Argyre Planitia | F27: george.r@example.com | G27: XXX-319-3969
A28: 27 | B28: Gianna | C28: Brown | D28: 2 | E28: 282-9 Frento Vallis | F28: gianna.b@example.com | G28: XXX-869-2508
A29: 28 | B29: Harper | C29: Davis | D29: 1 | E29: 249-7 Louros Valles | F29: harper.d@example.com | G29: XXX-941-9649
A30: 29 | B30: Harry | C30: Garcia | D30: 1 | E30: 236-5 Euripus Mons | F30: harry.g@example.com | G30: XXX-667-3862
A31: 30 | B31: Henry | C31: Smith | D31: 1 | E31: 204-18 Asopus Vallis | F31: henry.s@example.com | G31: XXX-313-2708
A32: 31 | B32: Isabella | C32: Hernandez | D32: 2 | E32: 176-6 Ascraeus Mons | F32: isabella.h@example.com | G32: XXX-356-7828
A33: 32 | B33: Jack | C33: Taylor | D33: 1 | E33: 100-12 Stura Vallis | F33: jack.t@example.com | G33: XXX-738-3754
A34: 33 | B34: Jackson | C34: Thompson | D34: 1 | E34: 70-11 Gonnus Mons | F34: jackson.t@example.com | G34: XXX-803-6422
A35: 34 | B35: Jacob | C35: Johnson | D35: 1 | E35: 43-17 Syria Mons | F35: jacob.j@example.com | G35: XXX-189-0415
A36: 35 | B36: James | C36: White | D36: 1 | E36: 83-18 Nepenthes Planum | F36: james.w@example.com | G36: XXX-797-9810
A37: 36 | B37: Jennifer | C37: Jones | D37: 2 | E37: 107-17 Labou Vallis | F37: jennifer.j@example.com | G37: XXX-916-5657
A38: 37 | B38: Jessica | C38: Martin | D38: 2 | E38: 223-2 Vedra Valles | F38: jessica.m@example.com | G38: XXX-104-5481
A39: 38 | B39: John | C39: Smith | D39: 1 | E39: 10-18 Geryon Montes | F39: john.s@example.com | G39: XXX-741-9881
A40: 39 | B40: John | C40: Wilson | D40: 1 | E40: 297-14 Eridania Planitia | F40: john.w@example.com | G40: XXX-789-8825
A41: 40 | B41: Joseph | C41: Martinez | D41: 1 | E41: 173-16 Mawrth Vallis | F41: joseph.m@example.com | G41: XXX-435-0920
A42: 41 | B42: Layla | C42: Anderson | D42: 2 | E42: 271-19 Matrona Vallis | F42: layla.a@example.com | G42: XXX-551-5120
A43: 42 | B43: Levi | C43: Brown | D43: 2 | E43: 293-8 Charitum Montes | F43: levi.b@example.com | G43: XXX-668-3943
A44: 43 | B44: Liam | C44: Davis | D44: 1 | E44: 135-1 Hermus Vallis | F44: liam.d@example.com | G44: XXX-526-3448
A45: 44 | B45: Lily | C45: Garcia | D45: 2 | E45: 185-11 Tisia Valles | F45: lily.g@example.com | G45: XXX-724-8856
A46: 45 | B46: Lucas | C46: Hernandez | D46: 1 | E46: 252-9 Al-Qahira Vallis | F46: lucas.h@example.com | G46: XXX-904-1818
A47: 46 | B47: Luna | C47: Miller | D47: 2 | E47: 294-17 Elaver Vallis | F47: luna.m@example.com | G47: XXX-044-9533
A48: 47 | B48: Madison | C48: Johnson | D48: 1 | E48: 143 Argyre Mons | F48: madison.j@example.com | G48: XXX-761-2628
A49: 48 | B49: Margaret | C49: Moore | D49: 2 | E49: 187-5 Hadriacus Mons | F49: margaret.m@example.com | G49: XXX-436-6463
A50: 49 | B50: Mary | C50: Rodriguez | D50: 2 | E50: 29-5 Mamers Valles | F50: mary.r@example.com | G50: XXX-467-6161
A51: 50 | B51: Mason | C51: Jones | D51: 1 | E51: 225-1 Maumee Valles | F51: mason.j@example.com | G51: XXX-837-9065
A52: 51 | B52: Mateo | C52: Martin | D52: 1 | E52: 226-14 Amazonis Planitia | F52: mateo.m@example.com | G52: XXX-779-8138
A53: 52 | B53: Mia | C53: Smith | D53: 2 | E53: 191-9 Ravi Vallis | F53: mia.s@example.com | G53: XXX-381-2595
A54: 53 | B54: Michael | C54: Martinez | D54: 1 | E54: 25-7 Melas Chasma | F54: michael.m@example.com | G54: XXX-517-2065
A55: 54 | B55: Mila | C55: Miller | D55: 2 | E55: 96-7 Dittaino Valles | F55: mila.m@example.com | G55: XXX-323-5217
A56: 55 | B56: Noah | C56: Moore | D56: 1 | E56: 283-18 Huo Hsing | F56: noah.m@example.com | G56: XXX-803-6548
A57: 56 | B57: Oliver | C57: Rodriguez | D57: 1 | E57: 35-3 Amenthes Planum | F57: oliver.r@example.com | G57: XXX-195-1135
A58: 57 | B58: Olivia | C58: Taylor | D58: 2 | E58: 170-9 Hadriacus Mons | F58: olivia.t@example.com | G58: XXX-318-8536
A59: 58 | B59: Penelope | C59: Smith | D59: 2 | E59: 296-19 Peraea Mons | F59: penelope.s@example.com | G59: XXX-926-3165
A60: 59 | B60: Peter | C60: Taylor | D60: 1 | E60: 144-11 Oltis Valles | F60: peter.t@example.com | G60: XXX-778-9761
A61: 60 | B61: Richard | C61: Thompson | D61: 1 | E61: 187-2 Ascuris Planum | F61: richard.t@example.com | G61: XXX-882-6751
A62: 61 | B62: Robert | C62: Thompson | D62: 1 | E62: 67-1 Ravi Vallis | F62: robert.t@example.com | G62: XXX-672-1523
A63: 62 | B63: Sarah | C63: White | D63: 2 | E63: 242-3 Geryon Montes | F63: sarah.w@example.com | G63: XXX-800-7705
A64: 63 | B64: Scarlett | C64: Wilson | D64: 2 | E64: 190-19 Tharsis Montes | F64: scarlett.w@example.com | G64: XXX-174-5337
A65: 64 | B65: Sebastian | C65: White | D65: 1 | E65: 32-19 Uzboi Vallis | F65: sebastian.w@example.com | G65: XXX-193-6542
A66: 65 | B66: Sofia | C66: Wilson | D66: 2 | E66: 203-3 Her Desher | F66: sofia.w@example.com | G66: XXX-311-2539
A67: 66 | B67: Sophia | C67: Anderson | D67: 2 | E67: 13-5 Eos Chasma | F67: sophia.a@example.com | G67: XXX-726-6132
A68: 67 | B68: Susan | C68: Brown | D68: 2 | E68: 143-7 Harmakhis Vallis | F68: susan.b@example.com | G68: XXX-565-6562
A69: 68 | B69: Theodore | C69: Anderson | D69: 1 | E69: 17-13 Clanis Valles | F69: theodore.a@example.com | G69: XXX-131-9087
A70: 69 | B70: Thomas | C70: Brown | D70: 1 | E70: 103-12 Ganges Chasma | F70: thomas.b@example.com | G70: XXX-308-9216
A71: 70 | B71: Victoria | C71: Davis | D71: 2 | E71: 244-12 Charitum Montes | F71: victoria.d@example.com | G71: XXX-254-3188
A72: 71 | B72: William | C72: Garcia | D72: 1 | E72: 56-12 Hypsas Vallis | F72: william.g@example.com | G72: XXX-416-6645